id,user,date,timestamp,commentText,likes,hasReplies,numberOfReplies,replies.id,replies.user,replies.date,replies.timestamp,replies.commentText,replies.likes
,,,,,,,,z120trd5nr2nzzdcw235ud4oanrwh35wz04.1469118705034515,Jon Feltman,9 months ago,1469562732143,"wow -- not only do you buy like EVERY current popular conspiracy theory, you cherry pick em too... I can almost smell the stench of stale Doritos and Mountain Dew thru this post. You probably redefine ""chick repellent"".",2
,,,,,,,,z120trd5nr2nzzdcw235ud4oanrwh35wz04.1469118800845629,J Parnell,9 months ago,1469562732145,"We've been watching you for some time now....We put micro-GPS chips in your toothpaste and food when you weren't home and using satellite images along with thermal imaging to watch your every move. Be careful who you call, chat, or text, we're collecting it all and they'll go down with you too...We hear you, we're watching you, and don't you forget it..",3
,,,,,,,,z120trd5nr2nzzdcw235ud4oanrwh35wz04.1469119257209312,itscork,9 months ago,1469562732149,Oh boy....,0
,,,,,,,,z120trd5nr2nzzdcw235ud4oanrwh35wz04.1469119712773991,J Parnell,9 months ago,1469562732151,"+Jon Feltman
Feltman, you are correct. According to our data collection agencies, Mountain Dew and Doritos are the prime subsistence of Mr. Gay. Our records indicate Mr. Gay eats 3 family size bags of Doritos a day, 6 ham and cheese Hotpockets, and approximately 4 liters of Mountain Dew along with 4 Monster Energy Drinks per 24 hour period.",2
,,,,,,,,z120trd5nr2nzzdcw235ud4oanrwh35wz04.1469121555020668,Chris Vee,9 months ago,1469562732153,"slope, meet slippery",2
z12xebj42urlvnyr404chdcromvvivcoswg0k,fightington,9 months ago,1469562731757,you are a hero in the same league as buzz Aldrin for making these bro,0,false,0,,,,,,
z13hzr3atzmdcju5w04ceh1pjtvtwb1x33o,bob blow,9 months ago,1469562731760,THE MOON LANDING NEVER HAPPENED...  RESEARCH IT.,0,false,0,,,,,,
z13uvjuwkubsxv0as04chvuikkn1wjbaqio,Paper Box,9 months ago,1469562731764,"""The KGB couldn't figure it out, but this tub of shit somehow did"" haha!",10,false,0,,,,,,
z122xjbbmwvhij3wi04ccpaizpjiwngxh3g,Alexander George Tsakumis,9 months ago,1469562731767,"I love it!  Good for Buzz Aldrin. The false moon walk conspiracy theory nuts are exactly that--nuts! It not only happened, there is ample evidence that it did. Sadly, the Internet breeds these cranks and they multiply like maggots.",2,true,1,,,,,,
,,,,,,,,z122xjbbmwvhij3wi04ccpaizpjiwngxh3g.1469162275061621,Mark Fryer,9 months ago,1469562731770,"Hey hey, go easy on the insults towards maggots, they play an important part in the cycle of life and death and are particularly useful in stopping the spread of gangrene in sick patients now that we have super bugs to deal with.
I do however completely agree with your sentiments about conspiracy theorists.",2
z12fhrzptzr5wxk4o04cdvipexztgde4fq00k,Alfredo Marquez,9 months ago,1469562731772,I must feel so good to punch someone who wants you to swear on his sacred book. Buzz is the man.,0,false,0,,,,,,
z13vvfdquxfhyrcqo04chdeqry25ybooqkc0k,Jeb Kush,9 months ago,1469562731775,We saw a rocket ship fly up & then we saw them fall out the sky with a pod. Man this people are delusional.,0,true,1,,,,,,
,,,,,,,,z13vvfdquxfhyrcqo04chdeqry25ybooqkc0k.1469129648789779,Zulvis Diax Jr.,9 months ago,1469562731778,"gotta love a rocket's trajectory..the arc of a diver.  Also, don't give up your day job to become a detective.

""no way my wife is cheating on me, she went to work this morning!  I saw her leave the driveway with the car and then I saw her come back.  don't be delusional!""",1
z12kfrqh3ku0wjge523dvblpomq3y3j3l,Coury McGinnis,9 months ago,1469562731781,Buzz is the man,0,false,0,,,,,,
z13ahjjgplidj1jy304cidzzwq3yj1spdkw0k,DaveCareBear,9 months ago,1469562731784,OMG!!. Bill Burr used the word fag. WE MUST STOP THIS ANTI-GAY PSYCHOPATH!!!!,0,false,0,,,,,,
z12wd1cyduu3c5bc123lz5kooxrmeltig04,James Edward,9 months ago,1469562733704,YEAH BUZZ !!!!!!,0,false,0,,,,,,
z13kxrii3vbmvx1z104chraolraddrn4wc4,Jthe Lightseeker,9 months ago,1469562733708,Soft serve ice cream eating fag lmao,0,false,0,,,,,,
z12hhfxhrrfagp2ke22rcb2xgpnitjjpf04,Quentin Coldwater,9 months ago,1469562733712,"Ah the good ol' days, when Bill could call someone a fag without having to to call himself out for being a ""homophobe""...",1,false,0,,,,,,
z125cbexzzaptnnet23ognm54wjtzto2y,LulzKillerED,9 months ago,1469562733716,I hope Bill Burr gives you compensation for your work here.,0,false,0,,,,,,
z135hnvzoymhzpvdp23lztsohreljty1h,DoobieBruh,9 months ago,1469562733720,You think you hard niggy?..... Done niggy..,0,false,0,,,,,,
z12weroj1yugthdj104ccpuqwvryvxdq254,forsmanos,9 months ago,1469562733723,"haha, props to punching a fattie",0,false,0,,,,,,
z13lfhewxpv2jhh0g22zxbrrlrf0hp5fs,beefyb93,9 months ago,1469562733727,Bill has the best insults/descriptions of this sack of a man.  And good for Buzz.  Just imagine what Buzz could have done to this sack of shit if he was in his thirties.,13,true,2,,,,,,
,,,,,,,,z13lfhewxpv2jhh0g22zxbrrlrf0hp5fs.1469127141598927,FSM,9 months ago,1469562733733,I think that if Buzz kept going (at 80) he'd destroy this fat puke.,4
,,,,,,,,z13lfhewxpv2jhh0g22zxbrrlrf0hp5fs.1469162180461318,Kristopher Tope,9 months ago,1469562733736,That was a 'shut the fuck up' punch.  The look on his face and his stance made it very clear that he could have made that tubby bitch take a nap if he wished to continue.,6
z13ljzsyikfofvxe223afx4oayidzbzbo04,Basement Beer Reviews,9 months ago,1469562733739,"....you're a coward, and a liar, and a NNNNFFFF!",12,false,0,,,,,,
z13afvpjgnbcznzcv23yulljftrnefgde,mike byers,9 months ago,1469562733742,"really if you landed on the moon, why would it be such a big to not swear on the bible?  I mean I did it, I would swear in a heartbeat just to put it to rest.  But he didnt.  Hmmm",0,false,0,,,,,,
z12nyd5hek3bxxt2f23cy33hgrzbvlto404,krazy16dude,9 months ago,1469562733746,Asking an astronaut to swear on the bible is a weird move. What are the odds that someone who flew through the heavens and saw nothing but clouds still believes in god?,0,false,0,,,,,,
z13wvvnymvyzzhagh04cflbogwf5dnfxgzk0k,Ville Mononen,9 months ago,1469562733748,"Maybe the best part besides the POW was when the ladyfriend, after numerous attempts to pull Buzz away, knew the shit was getting real and simply let go @ 3:03.",0,false,0,,,,,,
z12awfcx0xbrdjrdy22tin5hwqajhdq1b,EraserTraceur,9 months ago,1469562733751,"3:06
ahhhhh I love how fattys word ""thief"" came out... as it was coming out his mouth that NASA hook smashed his mouth at the same time and made ""thief"" sound stuttered... ""the heef.."" hahahahaha!!! amazing. 
thanks uploader",0,false,0,,,,,,
z13rujpiroyax15zc04cf5ugprmstxpas4w,EraserTraceur,9 months ago,1469562733754,"how do u know he wasnt on the moon? were you fucking there? 
here is the thing with people and their beliefs...most are retarted..because.....here....I have a saying if its not on video or photo I dont care....like Michael Brown for instance....I dont give a fuck if 13 witnesses said the cop shot him in cold blood I need some video evidence.....and even then technology can trick us...your watching a video in court thats evidence in a rape trial but it was altered by a professional and nobody knew....and the case gets dropped....SO...basically....the TRUTH is SO SO hard to know...unless your two squishy eyes saw it.....Did he land on the moon? There is not enough evidence to confront someone about over this.......dont waste your time..... stupid people are everywhere and they are not aware they are stupid because they are stupid. ;-) 
Did Jesus or Muhammad walk the earth a long time ago? I dont fucking know and yoy want me to just believe a book that says its true??? a book.....its 2016 and a book that could have been wrote by a retard thousands of years ago before you were born....lul....stupid people....they are everywhere.....about 70% of the public is mentally fucked",0,true,1,,,,,,
,,,,,,,,z13rujpiroyax15zc04cf5ugprmstxpas4w.1469120324341508,Jon Feltman,9 months ago,1469562733758,hey genius you misspelled 'retarded',0
z13kzpwjlt2ccpviv04cct2o2xuzedmzffc,fresco brigante,9 months ago,1469562733762,Do the Buckner/Bartman breakdown,3,true,1,,,,,,
,,,,,,,,z13kzpwjlt2ccpviv04cct2o2xuzedmzffc.1469119158207546,Jon Feltman,9 months ago,1469562733767,solid suggestion...,0
z12gttrxgpifxvnw104cf5ugprmstxpas4w,EraserTraceur,9 months ago,1469562733771,like a boss,0,false,0,,,,,,
z12jc1ozzv30f3i5404cdbxx1yf4ghgbpwc0k,Bernardo Berruga,9 months ago,1469562733775,I thought Buzz orbited the spaceship around the moon while the other two walked on it,0,true,2,,,,,,
,,,,,,,,z12jc1ozzv30f3i5404cdbxx1yf4ghgbpwc0k.1469106258221565,Jim McKenzie,9 months ago,1469562733782,Buzz came out after Armstrong. Michael Collins was in the orbiter.,0
,,,,,,,,z12jc1ozzv30f3i5404cdbxx1yf4ghgbpwc0k.1469469347141002,Bernardo Berruga,9 months ago,1469562733785,"Got it, thanks",0
z13circo3uiiddmwm04cj3z5jlr4wp0h2lk0k,Stephen Roberts,9 months ago,1469562733787,You are doing gods work.,0,false,0,,,,,,
z12odj1yrzbjex44a04cenv45zmnidpp3cc,mymatejake,9 months ago,1469562733790,Buzz still mad he was 2nd man on the moon.,0,false,0,,,,,,
z124jxjaupagsxrxg04cclpi1z3sepfxpjo,Deleted,9 months ago,1469562733793,"Fuck, just got an America Boner, and have no way to get rid of it at work.",59,true,15,,,,,,
,,,,,,,,z124jxjaupagsxrxg04cclpi1z3sepfxpjo.1469128570617082,MagicVonBuffalo,9 months ago,1469562734362,"Hang the flag from it and wear it proudly, good patriot.",22
,,,,,,,,z124jxjaupagsxrxg04cclpi1z3sepfxpjo.1469129371046860,Zulvis Diax Jr.,9 months ago,1469562734364,living vicariously through the lies of free masons?  you just gave me ED.,2
,,,,,,,,z124jxjaupagsxrxg04cclpi1z3sepfxpjo.1469496710382525,Galactic President Superstar McAwesomeville,9 months ago,1469562734366,"+Zulvis Diax Jr. Aw, Jesus, you're an Illuminati tinfoil hat wearing retard too? I didn't think you could get any worse.",3
,,,,,,,,z124jxjaupagsxrxg04cclpi1z3sepfxpjo.1469693932840098,Zulvis Diax Jr.,8 months ago,1472241134369,"+Galactic President Superstar McAwesomeville Hey man, sorry for threatening you with violence.  That was lame and shitty of me.  I usually do not resort to that kinda crap, even in my trolliest of moods.  I was having an off day.  seriously, i apologize.

side note: pretty sure devon aka winnie the pooh voice banned me or whatever.  he is a little bitch.",0
,,,,,,,,z124jxjaupagsxrxg04cclpi1z3sepfxpjo.1469996276012567,Galactic President Superstar McAwesomeville,8 months ago,1472241134371,"Don't worry about it, YouTube brings out the worst in all of us. Yeah Devon will do that if you challenge him on anything. Some ""alpha male"" he is.",0
,,,,,,,,z124jxjaupagsxrxg04cclpi1z3sepfxpjo.1475386337684346,Golly Po,6 months ago,1477511534373,The only way to get rid of an American boner is to fuck a small middle-eastern country.,4
,,,,,,,,z124jxjaupagsxrxg04cclpi1z3sepfxpjo.1475444182818674,Deleted,6 months ago,1477511534375,+Golly Po HELL YEAH!,0
,,,,,,,,z124jxjaupagsxrxg04cclpi1z3sepfxpjo.1477371276545721,Dan Zeman,6 months ago,1477511534378,Rub it until you see stars then stripes come out,2
,,,,,,,,z124jxjaupagsxrxg04cclpi1z3sepfxpjo.1480724826488575,viciousspew,4 months ago,1482781934381,Pretty gay dude.,0
,,,,,,,,z124jxjaupagsxrxg04cclpi1z3sepfxpjo.1480777476757701,Deleted,4 months ago,1482781934383,"+viciousspew If that is your first reaction, then you may want to consider taking up the ass as a life choice.",0
,,,,,,,,z124jxjaupagsxrxg04cclpi1z3sepfxpjo.1480779464984595,viciousspew,4 months ago,1482781934402,"+Alex M. Hey, you're the one getting a hard-on watching an old man, pal.",1
,,,,,,,,z124jxjaupagsxrxg04cclpi1z3sepfxpjo.1480780355137342,Deleted,4 months ago,1482781934405,"+viciousspew Let me educate you. An American Boner is patriotic, you like dick if you sexualize it BTW. If ISIS cut your head off, I'd get a Kill Boner. Want to sexualize my Kill Boner?",0
,,,,,,,,z124jxjaupagsxrxg04cclpi1z3sepfxpjo.1480781121975626,viciousspew,4 months ago,1482781934408,"+Alex M. Stop posting, faggot.",0
,,,,,,,,z124jxjaupagsxrxg04cclpi1z3sepfxpjo.1480783921668803,Deleted,4 months ago,1482781934410,+viciousspew Don't like thinking about my Kill Boner?,0
,,,,,,,,z124jxjaupagsxrxg04cclpi1z3sepfxpjo.1481279065294235,timwins31,4 months ago,1482781934412,"I like thinking about it.  keep it coming, if u know what I mean.  ;-)",1
z12vtxvhlu3chpkqt04ci33o3o32xbzaio40k,Skeet Er,9 months ago,1469562733799,I can only imagine what Buzz would have done to him 40 years ago. I love this video!,0,false,0,,,,,,
z12ihh45kr3gyj3yr04cgvlz1snbzjmrzpo0k,Matt Moore,9 months ago,1469562735452,sexy Asian chick at 2:35,0,false,0,,,,,,
z12wxrh4xyrys1vkz22eg5y4vxekivsir04,Cléo Z,9 months ago,1469562735455,Hope there's not gonna be a conspiracy theory about Buzz's fist landing squarely on that guy's moon-shaped fucking face.,1,false,0,,,,,,
z121x35jclidjv4mb22psl3iywjicpd4l04,Justin Torres,9 months ago,1469562735458,Stanley kubrick!,0,false,0,,,,,,
z12mufsoxxe4h5znj23nijdbxxbohpqlz,Toby,9 months ago,1469562735461,"""probably outweighs him by a hundred and fifty fucking pounds, all quarter pounder with cheese though"" HAHAHAHAAHA fucking Bill, thats gold right there",0,false,0,,,,,,
z13zepwxplvvtvs0k23ygza4mlq1unsom04,catlypso,9 months ago,1469562735464,"I love stupid people getting punched in the face, especially when they are carrying a bible. That makes it so much better!",3,false,0,,,,,,
z121jdtyllzaxhims23dh1xpnwe5szeiy04,Alex Woodward,9 months ago,1469562735467,the man has been on the moon. do you really think he gives a fuck about a human slug like this?,4,true,1,,,,,,
,,,,,,,,z121jdtyllzaxhims23dh1xpnwe5szeiy04.1469128517438377,MagicVonBuffalo,9 months ago,1469562735470,"Only in the sense that you or I care when there's shit on our shoe. There's only so much that a man is willing to take. That said, I'd have popped the fat dipshit sooner than he did, but not nearly as well.",5
z13ssj1ooovjc5a3t23lgtohhm21vflms,Russ Logan,9 months ago,1469562735474,He is a lier because not only did he not walk on the moon but who says the moon is even something that can be landed on. It's not a rock in space that reflects sunlight. It generates its own light which is a cool light   Research it smart ass,0,true,6,,,,,,
,,,,,,,,z13ssj1ooovjc5a3t23lgtohhm21vflms.1469103534145532,Alex Woodward,9 months ago,1469562735866,lel,0
,,,,,,,,z13ssj1ooovjc5a3t23lgtohhm21vflms.1469107457188966,Chip Chipperson,9 months ago,1469562735870,this guy sounds fawkin zooted,1
,,,,,,,,z13ssj1ooovjc5a3t23lgtohhm21vflms.1469108233788958,You can't-a have-a de Mango!,9 months ago,1469562735872,It's so weird when people say the dumbest shit like THE MOON GENERATES ITS OWN LIGHT!! Or THE EARTH IS FLAT!! And they call you a stupid fucking moron YOU THINK THE EARTH IS ROUND? LOL U DUMB FUCK!! I feel like nature is not trimming our dead weight off and we have to walk out we these fucktards until an asteroid our something makes a lil more room for hopefully us smarter ones,3
,,,,,,,,z13ssj1ooovjc5a3t23lgtohhm21vflms.1469109021820185,Alex Woodward,9 months ago,1469562735875,if the moon generated its own light we'd have a full moon all around the world every single night,3
,,,,,,,,z13ssj1ooovjc5a3t23lgtohhm21vflms.1469146654539940,Russ Logan,9 months ago,1469562735878,+You can't-a have-a de Mango! Funny how the moon is covered in so called craters from thousands of meteor impacts right? Yet in all recorded history  have we ever seen anything hit the moon? Nope   Why not   It isn't what u think it is smart guy! Ya it's flat too,0
,,,,,,,,z13ssj1ooovjc5a3t23lgtohhm21vflms.1469150663866244,You can't-a have-a de Mango!,9 months ago,1469562735881,Thank you Alex for your insightful logic. Now that's a smart guy,0
z12qgvliopb4jlhkk22wjlwxjuj4udh2c,Qas Perr,9 months ago,1469562735478,These Moon landing conspiracy freaks are fucking dumb as a pillowcase full of shit.,0,false,0,,,,,,
z12wxxw5avfxinb4i04ccblyvzmichfii3g,SpecialHandlingUnit,9 months ago,1469562735481,"that fat douche trying to take short cuts by leeching off other's achievements, when fat douches do this their names and faces shouldn't make the news, blur it out so they remain a nobody the way nature intended.",0,true,1,,,,,,
,,,,,,,,z12wxxw5avfxinb4i04ccblyvzmichfii3g.1469103012059623,catlypso,9 months ago,1469562735485,True.,0
z121sryhnv22er5ex23ffz5z1xm4vxlee,Mike Perry,9 months ago,1469562735488,fucking buzz hit him with a loaded fist lol,1,false,0,,,,,,
z13pebcifnaoj1kbf04ceb54zriqvblybcc,Ginip Ginab,9 months ago,1469562735490,fuck yea,0,false,0,,,,,,
z13bu3qpryqccjaqj04cdfyqjpiuhntgjq40k,Biggus Dickus,9 months ago,1469562735493,I don't know about the Moon but Buzz sure landed that punch,307,true,15,,,,,,
,,,,,,,,z13bu3qpryqccjaqj04cdfyqjpiuhntgjq40k.1469109118102952,Johnny Flores,9 months ago,1469562736091,👍,0
,,,,,,,,z13bu3qpryqccjaqj04cdfyqjpiuhntgjq40k.1469125127327763,danh5150,9 months ago,1469562736093,"Well played, sir. Well played.
polite clap",3
,,,,,,,,z13bu3qpryqccjaqj04cdfyqjpiuhntgjq40k.1469128547457639,H Roark,9 months ago,1469562736096,"Epic.

How's the wife, Incontinentia Buttocks, Biggus?",1
,,,,,,,,z13bu3qpryqccjaqj04cdfyqjpiuhntgjq40k.1469142559311429,SparksDrinker,9 months ago,1469562736097,I know about both.,2
,,,,,,,,z13bu3qpryqccjaqj04cdfyqjpiuhntgjq40k.1469161192977170,Carlo Martini,9 months ago,1469562736099,"You ""don't know about the moon"" because you're dead from the neck up",9
,,,,,,,,z13bu3qpryqccjaqj04cdfyqjpiuhntgjq40k.1469303722221036,MrTamendez,9 months ago,1469562736101,bahaha,0
,,,,,,,,z13bu3qpryqccjaqj04cdfyqjpiuhntgjq40k.1469447673584885,Eddie83,9 months ago,1469562736103,+Carlo Martini haha,0
,,,,,,,,z13bu3qpryqccjaqj04cdfyqjpiuhntgjq40k.1469621791003680,krayzeejojo,8 months ago,1472241136105,Just about now that guy's teeth are about to land on the moon.,1
,,,,,,,,z13bu3qpryqccjaqj04cdfyqjpiuhntgjq40k.1470159683712470,Steve Bartman,8 months ago,1472241136108,This fuck never went to the moon.,0
,,,,,,,,z13bu3qpryqccjaqj04cdfyqjpiuhntgjq40k.1470181823759731,Carlo Martini,8 months ago,1472241136110,+Steve Bartman And you never had ideal parents or role models bringing you up with critical thinking skills,2
,,,,,,,,z13bu3qpryqccjaqj04cdfyqjpiuhntgjq40k.1470440238909933,Santee Bandit,8 months ago,1472241136112,"Python fans rule. 
It's a joke name sir...like Naughtiest Maximus..",1
,,,,,,,,z13bu3qpryqccjaqj04cdfyqjpiuhntgjq40k.1470450630004115,Carlo Martini,8 months ago,1472241136114,+Jay Hart And you're a goddamn joke who has his nose planted in the dirt and refuses to dream about humanity's future and be optimistic about his own incredible species,2
,,,,,,,,z13bu3qpryqccjaqj04cdfyqjpiuhntgjq40k.1486877146975142,Geo408,2 months ago,1488138736116,Biggus Dickus This is true.,0
,,,,,,,,z13bu3qpryqccjaqj04cdfyqjpiuhntgjq40k.1492397585831008,Clint Hobson,1 week ago,1492631536118,Congratulations... you legit got me with your profile pic +Biggus Dickus... I thought there was a hair on my screen... bastard...,3
,,,,,,,,z13bu3qpryqccjaqj04cdfyqjpiuhntgjq40k.1492813317829458,Mark Skeeter,4 days ago,1492890736120,Freaking brilliant!,0
z13ahha4iubsybvwf04cg5oa5mfovbtyzbs,shaolintiger88,9 months ago,1469562735498,bang zoom! right to the moon! lol,0,false,0,,,,,,
z12eixw4qye4v5woa04ccbmgakvwex4jzwk0k,Ernestas Kalnins,9 months ago,1469562735501,"we didint land on the moon
 Nasa in hebrew means Deceive
apollo 11 means -apollo in greek means satan",0,false,0,,,,,,
z13czvy4gkavchuf0235g5sxvrulhnnlx,Bourne Accident,9 months ago,1469562735503,Did Stanley Kubrick film the landing of this punch too?,8,false,0,,,,,,
z12kehxwhsmtudfzw04cizqjxyywz3uaxyg0k,Eric,9 months ago,1469562735506,"Please add ""hic"" and ""morty"" every other sentence.",0,false,0,,,,,,
z13cfvnhxqezel1lr23sir0q0lmxjns3m,Spencer Huffman,9 months ago,1469562735509,"dude you are the man, all of these are awesome",0,false,0,,,,,,
z12msbwpommqwrtaf04cetmbiz3rjlqjkzk0k,djordan22,9 months ago,1469562735512,"Swear on this fictional novel.  Lol, ok guy.  What a tool.",153,true,22,,,,,,
,,,,,,,,z12msbwpommqwrtaf04cetmbiz3rjlqjkzk0k.1469129139560801,Zulvis Diax Jr.,9 months ago,1469562736009,"doesn't the American court system do the same?  honestly, atheists, what gives?  If he is telling the truth, put your hand on it and say it again then tell the person to fuck off.  If you are lying, put your hand on the meaningless fiction book and lie some more.  Well these astronauts wouldn't do either.  

Now even though they have lied to the world, touching the Holy Bible and telling one more lie to a weirdo with a camera was a bridge too far...why?",1
,,,,,,,,z12msbwpommqwrtaf04cetmbiz3rjlqjkzk0k.1469151332273672,Shaun Pearson,9 months ago,1469562736011,"You're as much of a tool as he is to equate ""fictional novel"" with lack of truth. As if Ullysses or King Lear lack truth. Atheism allows dumbasses to feel smart for free. Do some thinking on your own.",8
,,,,,,,,z12msbwpommqwrtaf04cetmbiz3rjlqjkzk0k.1469159964216522,India zeroserieswon in Australia,9 months ago,1469562736013,Never understand why people swear on the biggest load of bullshit ever written.,10
,,,,,,,,z12msbwpommqwrtaf04cetmbiz3rjlqjkzk0k.1469170544397368,djordan22,9 months ago,1469562736015,+Shaun Pearson And youtube allows pussies to say ignorant shit.  The road to atheism is precisely learning to think on your own and not buy into dogmatic bullshit that lacks evidence.,3
,,,,,,,,z12msbwpommqwrtaf04cetmbiz3rjlqjkzk0k.1469171238692115,Pr1nceRob,9 months ago,1469562736017,wow youre so edgy,7
,,,,,,,,z12msbwpommqwrtaf04cetmbiz3rjlqjkzk0k.1469286480851789,Just Doit,9 months ago,1469562736019,why should they?!Its way beneath them to consider even entertaining placing there hand on the fantasy books.You like this ice cream guy are of average intelligence and so can be stooged easily  to believe the landing was false and that god exists.I will give you a question to prove what I am saying is correct.The soviets had also been in space and so obviously had tracking for space flights. If the American space flight was a Hollywood fake then why not hear anything from the soviet union who was competing aggressively against the US?!,4
,,,,,,,,z12msbwpommqwrtaf04cetmbiz3rjlqjkzk0k.1469397464581227,Phillip Collins,9 months ago,1469562736021,Top kek,1
,,,,,,,,z12msbwpommqwrtaf04cetmbiz3rjlqjkzk0k.1469465775410506,um broog,9 months ago,1469562736023,Derp.,0
,,,,,,,,z12msbwpommqwrtaf04cetmbiz3rjlqjkzk0k.1469465842858692,um broog,9 months ago,1469562736025,Lol internet atheists... So glad you'll never find a real place in society.,5
,,,,,,,,z12msbwpommqwrtaf04cetmbiz3rjlqjkzk0k.1469506765577174,Just Doit,9 months ago,1469562736026,"+um broog
Well actually in north western Europe atheism is the majority. Also the highest level of education in the world in these same areas.
Education/wealth is freedom and power to think and question and so no surprise atheist.
The lowest levels of education have the highest levels of religious observance so African continent and south America.
I am also an atheist but don't believe that atheism will become a world majority as requires the world to be well educated and well off to  succeed and this well never be the case. Sad really as the world would be a much better place.",7
,,,,,,,,z12msbwpommqwrtaf04cetmbiz3rjlqjkzk0k.1469515679242593,djordan22,9 months ago,1469562736028,+um broog how do 'just doits' balls taste on your chin?  #owned,0
,,,,,,,,z12msbwpommqwrtaf04cetmbiz3rjlqjkzk0k.1469522296960510,Zulvis Diax Jr.,9 months ago,1469562736030,"+Just Doit Western Europe?  Have fun with Sharia, you wussies.",1
,,,,,,,,z12msbwpommqwrtaf04cetmbiz3rjlqjkzk0k.1469534459112157,Just Doit,9 months ago,1469562736032,"+Zulvis Diax Jr.
I am not from Europe.
Religion is based on fear and so followed by the fearful.",3
,,,,,,,,z12msbwpommqwrtaf04cetmbiz3rjlqjkzk0k.1469538169737861,Phillip Collins,9 months ago,1469562736049,"But the West also has rising levels of 'Eastern' Spiritualism, Buddhism, Zen etc, subjects which have common content with Quantum Science, mathmetics, fact and Truth. Spiritualism is not dead in the West, it is evolving.",0
,,,,,,,,z12msbwpommqwrtaf04cetmbiz3rjlqjkzk0k.1470077821463252,Craig Gagnon,8 months ago,1472241136052,Ok hold on here....are you telling an atheist to have original thought?  Do you know how ridiculous that statement is man?  hahahaha wow.  You need to re-think that angle my friend.,0
,,,,,,,,z12msbwpommqwrtaf04cetmbiz3rjlqjkzk0k.1470095650622132,Diego Augusto,8 months ago,1472241136053,More like convoluted fantasy,0
,,,,,,,,z12msbwpommqwrtaf04cetmbiz3rjlqjkzk0k.1470127842845944,Just Doit,8 months ago,1472241136055,"+djordan22
you were the first to respond emotionally with rudeness and so owned by us. WOOPS!",0
,,,,,,,,z12msbwpommqwrtaf04cetmbiz3rjlqjkzk0k.1473014602251388,Nathan Zimmerman,7 months ago,1474919536057,LOL PWNED LMAO ROFLCOPTER NAMBLA LOL,0
,,,,,,,,z12msbwpommqwrtaf04cetmbiz3rjlqjkzk0k.1481621850230848,Leviathan,4 months ago,1482781936059,"+Pr1nceRob only faggots say edgy, stop embarrassing yourself. your probably say cuck too",0
,,,,,,,,z12msbwpommqwrtaf04cetmbiz3rjlqjkzk0k.1481622030222152,Leviathan,4 months ago,1482781936061,+Craig Gagnon what the hell are you talking about. only gay kids are named Craig btw so I guess congrats to your parents for predicting you would be. anyway how does lacking a belief in this or that branch of Theism make you less intelligent? lol you believe the shit your dumbass parents told you. do you still believe in the tooth fairy and Santa? damn what a loser,0
,,,,,,,,z12msbwpommqwrtaf04cetmbiz3rjlqjkzk0k.1493150587067841,TwizzElishus,23 hours ago,1493153536063,* dibs bedora *,0
