id,user,date,timestamp,commentText,likes,hasReplies,numberOfReplies,replies.id,replies.user,replies.date,replies.timestamp,replies.commentText,replies.likes
z12itfqyspb0vp0mi23ngllo2yjxsrw3v,tacoma171,22 hours ago,1493157062506,I love this. Old school baby.,0,false,0,,,,,,
z123vpkafqvutjq3v22cvp2whqvjjj2j404,CaptainHappen,1 day ago,1493149862508,"Guy: ""Did you  land on the moon?""
Buzz Aldrin: ""Did my fist land on your face?""",0,false,0,,,,,,
z12zhb0bbum2cn2bf04cit5jkkfis5jj41s,Robert Woods,4 days ago,1492890662512,"they siphoned billions of dollars away from the public that could have been spent on a lot more urgent needs billy boy, i'm glad buzz ""buzzed"" him ,  the guy was a cunt !",0,false,0,,,,,,
z125svs4fnfsxzbnv23sgrrhotzctxkho04,Frank Beltran,4 days ago,1492890662514,Wow you even added Jay Weidner's take on Stanley Kubrick's The Shining movie faked moon landing clues.  Fuckin perfect.,0,false,0,,,,,,
z12se1g5vwr2fvkkx22ozrdzxo2otfnlr,Einherjar Viking,1 week ago,1492631462516,I've had enough of your disingenuous assertions.,1,false,0,,,,,,
z12zv1cgelr3vzoz504cfztxavm4ghlb0g4,RuralBreakfast,1 week ago,1492631462518,Buzz got fed up.,0,false,0,,,,,,
z12xu5gosxrpzrqjh04cg5uhvpyri1goyu40k,Brenda sally,1 week ago,1492631462520,Buzz Aldrin is a World hero. If you are slandering him in these comments you should be ashamed of yourself. When the human race expands out into the stars it will be on men like Buzz Aldrin's shoulders!,0,false,0,,,,,,
z130gxppnznxzppok04cdtejtt2ewjcxfu00k,Tri Wahyu Utomo,1 week ago,1492631462523,"nice one, buzz",0,false,0,,,,,,
z13dgnmbjwu0zp2th23rijbhgvmzwpdg504,Just Chill in Space,1 week ago,1492631462525,go BUZZ!!!,0,false,0,,,,,,
z13ctdhqxt3aihcuo23hzjda4sqwuxqsj,gaz riley,1 week ago,1492631462527,Leave me alone!  will Ten bucks cover it?  lol,0,false,0,,,,,,
z13lsbqaavjbdn3gz04celahxzb2znv5sxc0k,NOFace,1 week ago,1492631462529,"i dont like buzz, i dont like the fat guy, and i dont believe we landed on the moon. But damnit i love bill burr :P",0,false,0,,,,,,
z13hwt2quwabuxwyg04cd1qgtz30yx0g420,justin carson,1 week ago,1492631462531,I don't understand how you can be this smart and this ignorant at the same time but somehow Bill pulls it off...,0,false,0,,,,,,
z13dc50xilbagzmn222jflmjdouaftnnn,Patty Hurst,2 weeks ago,1492026662533,I wish I could have ONLY one Hour with this Asshole Sibrel!,0,false,0,,,,,,
z12rfpmanw3dfje3u23tvpoxmrv2sjnyd04,Peoples Jason,2 weeks ago,1492026662536,Yup those Freemasons can hit hard when you call out their BS! ;),0,false,0,,,,,,
z13ncv2jcsvgf1cmz23owd4g1lfhedvcv,EvilProfesseur,2 weeks ago,1492026662538,"Houston, the Eagle has landed...a right hook",0,false,0,,,,,,
z132zj3ysqizsp1cf22ehxhwtkmmynvsy,Luke,2 weeks ago,1492026662540,So remember to eat your oats children. You may not be able to go to the moon like Buzz ... but you'll still be strong enough to punch an arsehole's lights out when you're in your 80s!,0,false,0,,,,,,
z13xubxbtln0ynfgk04cfhzokzqsjn5b2g0,xXHexatronXx,2 weeks ago,1492026662542,when you realize the video time is 420blazeit,0,false,0,,,,,,
z12uhvtzrwmhydkun222ht1hek35xbd0x,mode101wpb,2 weeks ago,1492026662544,Fat fucking triple cheesburger eatin face lol!,0,false,0,,,,,,
z13lftiinwmjfrgw404chxjgnznyzhlalis,Eduardo Luna,2 weeks ago,1492026662547,"Nicely put, Bill. ""The KGB couldn't figure out if Americans didn't go to the moon but this tub of shit apparently did.""",0,false,0,,,,,,
z133idnxuoy2zzdz404civwzkzf2z5yx0uo0k,Buzzard King51,2 weeks ago,1492026662549,"Answer to your question at 0:50.  You'll notice that at the height of the Vietnam war, during the presidency of Tricky Dick Nixon, is when all the moon landing missions occurred.  Whenever there was really bad news coming in from Vietnam Tricky Dick sent 3 more astronauts to the moon to distract the American tax payers and keep them patriotic while 300+ young American soldiers were coming home in body bags every week.  Who did it hurt?  Wake up after 48 years, you fucking nimrod.",0,false,0,,,,,,
z12gi10jklydelzem23djx5ppweucjfu0,Mats,2 weeks ago,1492026663384,Holy shit just shut the fuck up and show us the video,0,false,0,,,,,,
z13ah3hiokv4d32d3221s1zqeuvosj22k,TheGoldcountry,2 weeks ago,1492026663388,"I am anti-violence, but this is one of my favorite punches of all time.",0,false,0,,,,,,
z12jixyjcovhyno2523kszpqvs2juz5rq04,Creepy Little Book,2 weeks ago,1492026663390,"not only for being a hero but for punching a fatty in the face. oh man! that was good, I lost it.",0,false,0,,,,,,
z12fzjhhhobfy5sfp22ndffiysbgefcs5,UggaBugga1,2 weeks ago,1492026663392,A man that punches like that in his 80s is not one to fuck with. Lmao learned a lesson real quick.,0,false,0,,,,,,
z13eh1myqoihsxlmn235ubtwstr3wzw3p,cnn8420,2 weeks ago,1492026663395,would not put his hand on the Bible ... i don't know,0,false,0,,,,,,
z13nwn45aruafrlq504cjtfo3pvyfvjbhts0k,N/A N/A,2 weeks ago,1492026663397,"Buzz is a hero great video this made me subscribe to your channel, thumbs way up",0,false,0,,,,,,
z12asrdbovfrtx0gl04cjtfo3pvyfvjbhts0k,N/A N/A,2 weeks ago,1492026663400,Buzz should have knocked his ass out!!!,0,false,0,,,,,,
z13fzzz5wmelirofl22ix1y5nzypfp23p,Wun Hung Lo,2 weeks ago,1492026663403,buzz actually lifted fat fag a little with that right,0,false,0,,,,,,
z12lxjth5neueh3nl224trjhbsrieztdn,Mr Mason,2 weeks ago,1492026663405,"👨🏼‍🚀That fuck'n American Hero🇺🇸.....he should've landed his foot right on his balls....than said ""That's one small step for man, one giant leap for mankind"" 🌚 than kick him right in the teeth.....👴🏼like a boss...than walk 🚶🏻across the street....into the lobby up the stairs on stage with a half chub💪🏼 ...say most awesomeness speech ever in American history🗣🇺🇸....awhile single tooth still stuck on bottom of his shoe....than you hear whispered in the wind 🌬""I'm mother fuck'n.... Buzz Aldrin ....Bitch...& don't you forget it"" 🖕🏻",1,false,0,,,,,,
z132tl2yxzist3uku23uixpgrpypj3vuu,TKA GAMEON,3 weeks ago,1491421863407,He had me dead at: Last guy picked in gym class hahahaha,0,false,0,,,,,,
z13fyjpzrkbxide2z23mjn2blrutc3cwh04,Castle Bravo,3 weeks ago,1491421863409,Aldrin hits him a good one. Watch the guys head jerk back.,0,false,0,,,,,,
z13qtloa0mvneztwe04ccrcqpsyrxvb5s0o,Champion_of_Faith,3 weeks ago,1491421863413,"My friend you are the definition of apathy. You don't care that you are lied to. Its about the fact that NASA lies about everything they do.

https://www.youtube.com/watch?v=pEE7OPKLhaM",0,false,0,,,,,,
z13uhpn55xq2yf3we04ci3rw5krjt1hhsm40k,New Tuber,3 weeks ago,1491421863415,Nice punch... better than anything Mayweather or Connor for that matter... has ever done in their illustrious career.,0,false,0,,,,,,
z22mdnvbkke4zzw3nacdp433albvmtodihru0q0yodxw03c010c,Michael O'Brien,4 weeks ago,1490817063418,Why should buzz have to put up with that? Good for him!,0,false,0,,,,,,
z22bedxhwnr3uraleacdp43a5lydl2uuilow52efvptw03c010c,Peter G,4 weeks ago,1490817063420,420,0,false,0,,,,,,
z23zh1ph1zjhhvcq404t1aokgudrzjyfur3kavawumjdrk0h00410,FoulplayMFer,4 weeks ago,1490817063423,He may not have landed on the moon but his right hand sure as hell landed on that chin.,0,false,0,,,,,,
z22odrhjxueiv3uvuacdp434bhyxsdf0gpq4xxcjvehw03c010c,chitowncarm,1 month ago,1490557863425,"lol, one right hook for mankind! Still laughing",0,false,0,,,,,,
z223yb14nqfihec1m2hd0sxg2cbgjr25hlasoz2wvj00u00c2,cjhatescomputers,1 month ago,1490557863428,youre a coward and a liar and a HHMPPGH,0,false,0,,,,,,
z131iz0bgkyqybnh504cgryren3biv5bm2o,aviti mushi,1 month ago,1490557863430,Buzz Aldring is a GOD!!,0,false,0,,,,,,
z12au5mj5xymctvqa04cgzfq5lm3tlfbihs,Kevin Schaffner,1 month ago,1490557863432,he would have dropped me... you pussy.,0,false,0,,,,,,
z123wt2qavmtvrpuq22ix1y5nzypfp23p,Wun Hung Lo,1 month ago,1490557864316,excellent synopsis of of aldrins encounter with a major douche,0,false,0,,,,,,
z12nvzzikor3yrz5x04cedrgsrmttblqkso0k,brian browers,1 month ago,1490557864320,He was better in Toy story,1,false,0,,,,,,
z12oh11jjobpzdbya04cenbwlxv2yhhqwyw0k,lily winx,1 month ago,1490557864325,why would Buzz Aldrin punch the guy? Because this guy was saying the truth!!!!!!,1,false,0,,,,,,
z13ryzzhtmysybbuq23qu1lbwqfpjjh1l,BRIGS,1 month ago,1490557864329,USE MY SONG AUGURY IN YOUR INTRO,0,false,0,,,,,,
z12rsfwxsu23evpyb04cdvg4arunvdrjsy40k,Lekestue,1 month ago,1490557864333,The two things Bill hates most on this world womans and fat peoples,0,false,0,,,,,,
z12pdzebwrqcczxoo04cdxiadxanctjaiig,Patty Hurst,1 month ago,1490557864338,"Well done, Sir Buzz Aldrin!",1,false,0,,,,,,
z13rc3ebpoqeexhrj04cf5b4tvjcg3shhf0,Adam Goodwin,1 month ago,1490557864342,Haha love your commentary the guy sooo deserved it tho,0,false,0,,,,,,
z12hznrx3kmgup3vw23vgh05yozbuh0vh,More Than I thought,1 month ago,1490557864346,what's a bouse? How is this like one?,0,false,0,,,,,,
z12ju3nivlr3zvfbf04chp2zkvvjxrvihg4,- Vileer,1 month ago,1490557864389,Buzz should have just sworn on the Bible.. that's all it took.... lol,0,false,0,,,,,,
z13xwbtxtkqptdwtv220hpjoqqrbfxj2p,Escape the Matrix,1 month ago,1490557864395,Get'm Buzz!! That fat dumb ass deserved it!!,0,false,0,,,,,,
z12qx1my4ummznhbf04cil2wwlmcdfmyvss0k,Benoni Siagian,1 month ago,1490557864401,"OO WEE LOOK AT ME, I FAILED SCHOOL AND MY LIFE IS A COMPLETE JOKE. 
BUT IT'S OKAY, BCUZ IM ENLIGHTENED AND SHIEET. 
I'M SPECIAL!!!! 
I'M NOT A SHEEPLE LIKE YOU! 
I SAY THE MOON LANDING AND SCIENCE IS A LIE! 
THE FACT THAT A LOWLIFE PATHETIC MORON LIKE ME SAID THAT COMPLETELY DISCREDITS EVERY SINGLE SCIENTIST AND SCIENCE DISCOVERY THERE IS! 
NO! I DIDN'T FAIL SCHOOL BECAUSE I'M RETARDED, I QUIT SCHOOL CAUSE I'M SPECIAL AND SHIEEEEET. YOU ARE ALL BELOW ME!!!!!!",0,false,0,,,,,,
z13cyxvp1oz5wtycx22pzvnxgy2dclddi,Daver Son,1 month ago,1490557864406,"That's what I call ""The right stuff"", although others might call it ""The right cross"". Either way, I likes it.",0,false,0,,,,,,
z13qfz4guynbip02f23uihggdmnbuxhlh,Old Parts,1 month ago,1490557864412,https://youtu.be/b2yq0jfmcvM  mason lands on fake moon,0,false,0,,,,,,
z12pwvdzszb0zreoa04cgnzq2yr3u5lbmtw0k,Ron Burgundy,1 month ago,1490557864421,"""You're a coward, and a liar, and a THWOOEEF""",1,false,0,,,,,,
z132vlv40tanexx3c22tgrlh5rquyrkbv04,"Beeswax, like",1 month ago,1490557864428,That was a rude way of dealing with the issue but he's probably right. Those guys never went to the moon.,0,false,0,,,,,,
z12hjr44hraqdpfij04cidpxpnetdpbo3tk0k,mdricey,1 month ago,1490557864437,"I love how the lady finally just walks away like ya know what fuk it , hit him.",0,false,0,,,,,,
z13mup2i5smljvl5r04cijo5mrfpvpuq1zc0k,Scott Pedroley,1 month ago,1490557864444,Wow!  Ole Buzz tried to send that guy to the moon...but he was to fat...but he SURE did make him see the stars!   Lol.,0,false,0,,,,,,
z13vtzvwwl3gyvvp304cixsitoa4ftryxzs0k,terrypussypower,1 month ago,1490557864451,"Buzz never punched this idiot because he denied the moon landing, he smacked him for harrassing him and his family, and for calling him a liar and a coward in public. Buzz should have kicked the living shit out of him.",1,false,0,,,,,,
z13hg5pplymyx3vck22hvpkxntq0s5kie04,djneedles000,2 months ago,1488138664457,FAT,0,false,0,,,,,,
z120xzzylwjzihrpl04cflyw3pzixxgbzmw0k,Azrael095,2 months ago,1488138664462,Should have beaten that disrespectful cunt unconscious.,0,false,0,,,,,,
z12hcfxotsufife2h233wztpzzj3trwtl,Larry Metheney Jr.,2 months ago,1488138665242,I love it! A man with balls that's not afraid to stand up to a asshole! I wish he really beat the shit out of him!!!,0,false,0,,,,,,
z13gf1ej1o2bcv3cj23tzb3hcvz2vrwqv04,Barbie Reynolds,2 months ago,1488138665245,van allen radiaiton belts...lost telemetry data....moon landing seems like a hoax. burr sounds like a dope here.,0,false,0,,,,,,
z12xz3xyqxjdh3rds23uxl3pbvugsdh33,Glenn parent,2 months ago,1488138665249,put that buzz bastard in jail---like he landed on the moon lmao,0,false,0,,,,,,
z12bgzjp2vulgldap04cjfq4iozjdn15ogg,Glenn parent,2 months ago,1488138665253,taking a punch for the truth,0,false,0,,,,,,
z13ad3drgmecwfnqn04cjfq4iozjdn15ogg,Glenn parent,2 months ago,1488138665256,hang that buzz liar,0,false,0,,,,,,
z13mcjaqmkzygtmig04cjfq4iozjdn15ogg,Glenn parent,2 months ago,1488138665261,sue that liar son of a bitch,0,false,0,,,,,,
z12xyfxpotqowvqpe04cel5zmz2qixhzvr40k,LegendLength,2 months ago,1488138665264,I feel like that is legally harassment and if not it should be.,0,false,0,,,,,,
z13jzn5gfxqqytt0b22rgdu5ir3oilb3i,Kevin Lauerman,2 months ago,1488138665267,"I can't take credit for thinking of this comment. Saw it on a different Buzz punch video and it's total gold:

2nd best landing by Buzz.",0,false,0,,,,,,
z13dfldzsmrfvlawl04cgx1i1rj5jbdot3k,Grey Rose,2 months ago,1488138665271,That was the greatest thing I've seen in a LONG time!! Ex boxer here...Great punch!!,0,false,0,,,,,,
z13dt5dybzaai3t5f04cgvr4ssfoefgbxj0,acuff825,2 months ago,1488138665276,I come to this video once and a while just to hear bill call this guy a soft serve ice creme eating fag. Fuckin gold.,0,false,0,,,,,,
z13jxzyi0vvwvdyrg04ce1iihqbiyrl4jj4,Michel Bakhos,2 months ago,1488138665281,His name is Bart Sibrel !,0,false,0,,,,,,
z131zjniiv3exjsxq04cf5mr2zuyutha41w,shidashinpan,2 months ago,1488138665285,"that guy is a flat earth theorist, he goes around finding astronauts and making them swear on the bible",0,false,0,,,,,,
z12pvdq5kp33italh22qtdarpyfkdnmy504,Kurt Adams,2 months ago,1488138665289,only retard Americans still believe they landed on the moon,0,false,0,,,,,,
z13kwl44nzy5c1dru04cg5ty4yqah3dyh0s,Wise Fool,2 months ago,1488138665292,""" You're a coward, and a liar, and a... FEETH! """,0,false,0,,,,,,
z12udnxymsn3wharh04cgxxi0v3oyhmhync0k,Tony Vincenzi,2 months ago,1488138665297,anyone notice anything funny here? 3:03,0,false,0,,,,,,
z13ke3mben2qhznxt04cczzyjlaavfswedc,Geo408,2 months ago,1488138665301,"Classic, hahaha",0,false,0,,,,,,
z12ssjma1uytejosz23ks3hw2sy0itr4m04,bademoxy,2 months ago,1488138665305,"yeah- it was a FAKED MORON LANDING! gawd it would be so much fun loop replaying that punch in time to ""another one bites the dust"".
wish to fuck this would also happen to all the 9/11 truthers out there, fucking losers all.",0,false,0,,,,,,
z13hwvlwsqmotde4204cenvwdqu1v30xeaw,Connor Grey,2 months ago,1488138665309,I don't care about the moon. He's a hero for punching a fatty  in the face. Rock on Buzz Aldrin.,0,false,0,,,,,,
z12avfjykkjif355m04cgrjq4rvss3g4kyk0k,Tobi,2 months ago,1488138665312,Is this guy where Buzz lightyear got his name from?,0,false,0,,,,,,
z12hzhogxmqeznewu04ci1pwvojzuhqrgpo0k,Adem Adiyaman,2 months ago,1488138665315,Fuck moon landing deniers,0,false,0,,,,,,
z133ttoqzyedvdja004cfzr4nteww5g4toc0k,ShoRyu Ken,2 months ago,1488138666291,we have never landed on the moon or been out of the earth atmosphere.. He is right. They are all freemasons,0,false,0,,,,,,
z134dxjpkxuswpsrc04chlkpmkjrshvy3jg,David Walton,2 months ago,1488138666296,Awesome!,0,false,0,,,,,,
z12qhjwwqqftsnjwl04cgzeirzrauxdykrs0k,cere tomer,2 months ago,1488138666299,"Didn't hit him enough.  Of course, that chubby fuck either sued him or is in the process of doing so.  A lot of guys would have disemboweled him.",0,true,1,,,,,,
,,,,,,,,z12qhjwwqqftsnjwl04cgzeirzrauxdykrs0k.1490351237550950,mk b,1 month ago,1490557866305,Hoaxboy tried to sue and was literally laughed out of court,0
z13fzhh5zzacjpfmu23qebprmuq4jtsxn04,Patrik Drevestedt,2 months ago,1488138666309,"I agree with Bill Burr in this video, but why call this guy a fag? Is he referring to that homosexuality is a bad thing?",0,false,0,,,,,,
z12kjfaylzriftt0d23gcfapezvojnn4u04,karl53133,2 months ago,1488138666312,I'll that was a haymaking of a bunch... 😕 💥,0,false,0,,,,,,
z13ys3jhelaribudi22usjwretmivzl05,John Patrick,2 months ago,1488138666316,This video was staged.  Buzz Aldrin never punched this guy.,0,false,0,,,,,,
z131tdjb5or2ybwnh23mynayrun3yphf1,PioneerSaturnDougie,2 months ago,1488138666320,"Buzz, hats off to you for that! He should've been wearing a ring that had ""Eagle 1"" on it backwards, to let that fool know it landed...",0,false,0,,,,,,
z13iz3hrxwycyvoil04ccbwiqmn2i1xz4x40k,E. Beth K. Bobby,3 months ago,1485460266323,Happy Birthday Our Hero Buzz thanks for Dance at20th fox 70's Edy Williams hope Cross path again Sorry for that lunatic stalker!,0,false,0,,,,,,
z12vxpnztpraehm3m231h3ww2q2jhjrn2,Rocket Launching Llama,3 months ago,1485460266328,"Damn, you can see that loser's skull move before his face.",0,false,0,,,,,,
z13qipxbarf2xzej004cchf5gpicxfxi54c,pol1250,3 months ago,1485460266332,maybe they faked it ...who cares!!  But the balls it takes to sit at the top of that Saturn V...full of fuel !!!,0,false,0,,,,,,
z125zx3o0zayynx1j22niz25xvfni3mvu,David Steers,3 months ago,1485460266336,none of them would swear on the bible and say they landed on the moon.,0,false,0,,,,,,
z122dvti4zzoc1d3t22ovfmpopnjcbjev,bgold9,3 months ago,1485460266340,"""Soft serve ice cream eatin fag""...",0,false,0,,,,,,
z13yc3hzhm2nxpbpt04chjchcxanjbojed4,LORDMEGACOM,3 months ago,1485460266343,"Good for him, I'd have done the same thing",0,false,0,,,,,,
z134tboornu2sb2sm23sc3ygvreuezu3q,w67bv2cxm,3 months ago,1485460266347,"This is a VERY distressing video to watch.  And the most distressing part is, Buzz didn't put this stupid son of a bitch in the hospital for a couple of months.",0,false,0,,,,,,
z12nvpqoopalvb0ix04ce5cp0wbei5krtsw0k,JD,3 months ago,1485460266350,"Agree with everything Bill says, except that ""it"" (fake or not) did ""hurt"" a lot of people, because ""it"" was paid with extorted tax money.",0,false,0,,,,,,
z13cydsxryjcw1ckj23qwduijtiafpxng,Guatemalan Dude 69,3 months ago,1485460266355,"Tips on how to punch like Buzz Aldrin:




- Don't blow it
- Keep it simple
- Count your money",0,false,0,,,,,,
z134cldhuuryifng204cg3nahnimgnyiiuw0k,T Fal87,3 months ago,1485460266358,"Fuck that fat coward piece of shit. Glad Buzz buzzed his ass. Calling that old man a coward, when he himself is a coward for trying to provoke an old ass man!",0,false,0,,,,,,
z130wbhzrw3iftzs423edzuy3wnrvxxg304,stephen borst,3 months ago,1485460266361,"ya mess with the bull ya get the horns  , awesome  , Buzz is a true hero !",0,false,0,,,,,,
z13rhtfw5xexhjl4104cff1hnnyytjaq0s40k,MANDINGOS INC.,3 months ago,1485460266365,Mean straight right,0,false,0,,,,,,
z13thfkgsyfnx33o404cfngx1zepzrwynss0k,Richard Ott,3 months ago,1485460266369,are u related to Sarah Palin?,0,false,0,,,,,,
z13vtpt4gqbht3h2z231d1m4izahwjlrk04,Terry TT,3 months ago,1485460267183,"Buzz and fellow Astronauts have more guts than any of these harassing assholes who probably don't know their ass from their elbows anyway! We're proud of Buzz and all the brave men and women that have the guts to go into space! Buzz, take it easy, you deserve it.",0,false,0,,,,,,
z124ydmqdyvvc1evo220xpu4llive140i,MrThegamemasterlord,3 months ago,1485460267186,lol fat chesse burgar face good punch,0,false,0,,,,,,
z12wslw4ikqjhrjnb23jxxugsk3wuzwpt04,Bobby G,3 months ago,1485460267190,"RIP Buzz, you were the man",0,false,0,,,,,,
z13qsj4yourcclzv4222jff5upeug3aso,Lehmann Peters,3 months ago,1485460267194,Buzz needed to put his body more into that punch.,0,false,0,,,,,,
z12qfzjpvlr0cbs0322nepdaexjms5s5y04,915TANK,3 months ago,1485460267197,">somehow manages to pass through the van allen radiation belt and survive through freezing temperatures in the lunar space craft without having on-board batteries to support such power expenditures to enable a heating and protective device.
>gets defended by government welfare sell-sword queen with a jewtube account whose best argument is calling the opposition a fatty.",0,false,0,,,,,,
z13zclhrlqmytfjjd04cit3orqa2zvlq5lg0k,alpachino,3 months ago,1485460267200,I like how u put that shinning conspiracy bit,0,false,0,,,,,,
z12cxjty5pucijyp404chpnzko25tbvwd3k,ddgallion,3 months ago,1485460267204,"No judge or jury would ever convict him for slugging this guy. No prosecutor would ever even bring any charges. Even if the guy sued he would never win because Buzz is a national hero and this guy is a idiot who got what he deserved. What I do find disappointing is that someone else there did not get in this guy's face and back him down, or lay him out if necessary,  before it ever got this far.",0,false,0,,,,,,
z12vuz5oevqlsnz2v23dctwroyqbjrrey,ryan muro,3 months ago,1485460267208,lmao true American hero,0,false,0,,,,,,
z121sft4yvymjbs0p23nvphq5kr0uxbc5,Maxyshadow,3 months ago,1485460267211,My favourite punch ever!,0,false,0,,,,,,
z134zlfabzijslqkl23xzfyh1nbagfh1g,Rafael Duran,3 months ago,1485460267214,"The dude was acting like a woman, insulting somebody and not thinking about the physical ramifications that could happen (ass kicking). Don't know why I went all lawyer on ya but eh.",0,false,0,,,,,,
z123wfi4vlzmjlqr504cel5wawmawb0xk1o,Grantflip,3 months ago,1485460267218,"love our channel man,  keep it up :)",0,false,0,,,,,,
z13pv3ep1nurffyam04cdtqpit3jflfp5qo0k,ik ben boe,3 months ago,1485460267221,Usa had every reason to fake a moon landing. Most important was to bankrupt the soviets into space. Im not saying it did happen but its dum to say they had no reason to fake it.,0,false,0,,,,,,
z13rjf4gktrcwzdzu04civ2bvonvgxsb0e0,CoreyLevins,3 months ago,1485460267224,"Buzz, you are an American hero! salute for Rockin that pussy.",0,false,0,,,,,,
z13synnojsrwjneyh04cd1epjpify3xwnu00k,Steve Buckby,3 months ago,1485460267227,Nice one buzz that Bible bashing inbreeding pice of uninformed dumdass monkey crap got what he deserved if nobody landed on the moon both the Russian and Chinese space agency's would have posted any information regarding a lie to world that the Americans lied in getting to the moon but as they have not means the Americans got there.,0,false,0,,,,,,
z13nej3gnzbcj34kx22edxwq1oyhejrcj,FatRakoon,3 months ago,1485460267231,"I think its pretty sad that some people have such sad pathetic lives that they come up with these conspiracies.
I mean, sure, there are lots of things that hve unanswered questions, but fuck me the moon... Have some people got no shame?
If you get a really really good telescope, especially a digital one that you can control with your PC, you can enter in all kinds of locations and you can see in many cases, some of the crap we have left up there, such as moon buggies and so on.
I have seen these for myself with my fathers own telescope.

Its the same with the ISS.... Anyone with a pair of even good binoculars can see it for fucks sake, and yet there are some stupiud morons who say it doesnt exist! - what sort of stupidity must someone have to be that dumb?",0,false,0,,,,,,
z13zvd1i2xv4sjdqr04cepjq1oikz1bysko0k,TheCynicalDouche,3 months ago,1485460267234,"Do you love the way the guy's voice wanes when he says ""thief"", as Buzz's fist crams some justice down his throat?",0,false,0,,,,,,
z12edxw42oyaira5j04cczpzsvjgztp5efw,JPERS,3 months ago,1485460267237,To the Moon Alice,0,false,0,,,,,,
z13rzpghdqaexrey304ci1sy1kzqurvyfzc0k,Swag Bihhh,3 months ago,1485460267241,that Dick head ate one big knuckle sandwich,0,false,0,,,,,,
z12lexezpl2qsbfir04chpxbbninyvkzbuw0k,coreykemp10,3 months ago,1485460267244,notice how buzz's daughter spends the video stopping him from decking that bloke but as soon as he is called a coward she turned and walked away and just let him unload. she knew she wasn't stopping shit after that comment.,0,false,0,,,,,,
z120vlnpftbkz1u1422kvja5tlzuelag504,Gromitdog1,3 months ago,1485460267247,You don't get it?  Use your fucking brain.,0,false,0,,,,,,
z13ld1f5nnbpu1ske22asjz5tnzww5goz04,Dillon Green,4 months ago,1482781868146,Moonfist,0,false,0,,,,,,
z13nef255rzssafckymsfpsa3ujxtr101,X0verXDriveX,4 months ago,1482781868150,He didn't punch him hard enough in the face. It didn't satisfy me.,0,false,0,,,,,,
z12mgptzdpvnzhpd022gwtrgrnu5fhe0p,Chuck Merfouth,4 months ago,1482781868153,"Buzz landed that punch...no conspiracy there. Lucky for the guy I wasnt the doorman, i would have
broke up the fight by stepping on the guys face....they had to be separated right?",0,false,0,,,,,,
z12bjdrbwzqetvhsy23mddm4bmetz30vs,Frisky Bottomsuuater,4 months ago,1482781868156,"Imagine the onions on this guy!   To get on to a rocket, with a very good chance of exploding, to go into a hostile enviroment with even a GREATer chance a deadly failure.   Too bad he only popped this pudgy fuck, once!",0,false,0,,,,,,
z135idz5fvf4zfe0e222svgp1zrrij0sf,Luke Schumacher,4 months ago,1482781868159,Wish there were a couple more good ole boys there to lobotomize this disrespectful anti American sack of vomit.,0,false,0,,,,,,
z13bu3gx0raiwppxb04cj30iwwutcnyyj4s,Redbeardian,4 months ago,1482781868163,Buzz Aldrin and his colleagues lost a lot of close friends to accidents in the space program.  I'd imagine that would fuel a lot of rage when asshats rant in his face like this situation.,0,false,0,,,,,,
z12exdajyvjzhvrkd22sv5550kbae33oj04,M Bedaard,4 months ago,1482781868166,As tweetie bird said...Right on the kisser!,0,false,0,,,,,,
z13dypmz1rumtfapf04cjltp5kjgyxhzpk40k,Boco Corwin,4 months ago,1482781868170,"Fuck that pasty pile. People like this piss me off because they always have a better job than me. Like, this freak? Really? Wtvr",0,false,0,,,,,,
z12nvb4wynvhuxbq104chpe4kkqdfr1hly00k,Nautilus1972,4 months ago,1482781868173,"The asshole is Bart Sibrel, who ironically has a very good documentary called 'A funny thing happened on the way to the moon' (availble on youtube) which is actually worth watching. Then he did another where he doorstops all the astronauts that went to the moon and does the same thing. He gains access to their homes unfortunately and some it is quite upsetting.",0,false,0,,,,,,
