id,user,date,timestamp,commentText,likes,hasReplies,numberOfReplies,replies.id,replies.user,replies.date,replies.timestamp,replies.commentText,replies.likes
z122fvly5miaudsg404cgppoim2widxr1wk0k,Blood Legion,8 months ago,1472241088359,Good for you Buzz. Fuck that douchebag! He needs to get laid. I would have not only punched him out but kick him and piss on his fucking face!,0,false,0,,,,,,
z12tjdp5bzfftzjhu04cgbgy2mngf1z5ao00k,Phuok Yu,8 months ago,1472241088363,"wow bill burr is a steaming pile of shit, totally unoriginal, nothing of worth here, just a retard mindlessly blabbering things that the average retard ""relates to""",0,false,0,,,,,,
z132ivdwis30h3swb04cfrsriujqzdl5vn00k,Area51 Coffee Shop,8 months ago,1472241088365,Even the Judge agreed that he deserved the rocket launch punch.,0,false,0,,,,,,
z13vdlij2wb5sfyvv23hfnhpvsuzxrlm1,Maher David,8 months ago,1472241088369,aldrin behavior certainly backs up the theory,1,true,5,,,,,,
,,,,,,,,z13vdlij2wb5sfyvv23hfnhpvsuzxrlm1.1469818006978099,Queef Micester,8 months ago,1472241088693,Um.. no,2
,,,,,,,,z13vdlij2wb5sfyvv23hfnhpvsuzxrlm1.1469820809361365,Maher David,8 months ago,1472241088696,Apparently you have no experience In reading people,0
,,,,,,,,z13vdlij2wb5sfyvv23hfnhpvsuzxrlm1.1469850727521135,Dylan Jones,8 months ago,1472241088698,"The fat guy was harassing him, Aldrin's character was being attacked.. 1+2= fat man gets physically humiliated",3
,,,,,,,,z13vdlij2wb5sfyvv23hfnhpvsuzxrlm1.1469910990931519,Queef Micester,8 months ago,1472241088701,"+Maher David Um I'll tell you who really has no experience in reading people, your frined in this video, hence why he got laid out on the floor HAHAHAH",0
,,,,,,,,z13vdlij2wb5sfyvv23hfnhpvsuzxrlm1.1476846479408978,Matt E,6 months ago,1477511488704,"+Maher David talk shit to a war vet. Call him a liar, say he never went to war, he never saw his friends die. Promptly get decked in the face. And than go back to that first year psychology class you dropped out of, so you can see where you went wrong.",0
z12oerqx3raqhrkpc04cf3gq3lzjxlerei0,Brynjar Valsson,8 months ago,1472241088375,he should stab him the next time and do the world a favor,0,false,0,,,,,,
z13xttsoknrnfja2f22isvuaqm2swf0ml,1000 MONOLOGUES,8 months ago,1472241088378,9/11 never happened! You're all fools!,0,false,0,,,,,,
z13thj1ahymtx5nu122zubzrbnqqwxqlv,HatredPrime,8 months ago,1472241088381,Kubrick made him a star.,0,false,0,,,,,,
z121ff15cofysd4fp22ydtswmnq3vvvze04,anthony falconetti,8 months ago,1472241088388,"well neil armstrong would not swear on a bible.. now that was telling..and what is even weirder is the video of the lunar lander blasting off from the moon..it looks like it is being jerked by a cable..and btw, who was left behind to video that ??  last of all, if we went to the moon in 1969, with the rudimentary technology of the times, then why couldn't we go today ??  or in 2 yrs ?? because we don't have the technology..and we sure as hell didn have it then..

so why didn he just swear on a bible that he did ?? that is the question..instead of throwing a punch ?",0,false,0,,,,,,
z13txznxiyfuxdwcm223vrpwezblfbh4o04,JackJames2612,8 months ago,1472241089680,"I swear to God that Bill used to be one of those 'moon landings are a conspiracy' guy? Or am I just crazy..?And Allen your videos are great, keep up the good work and go fuck yourself",4,true,5,,,,,,
,,,,,,,,z13txznxiyfuxdwcm223vrpwezblfbh4o04.1469736116157094,allenpalin,8 months ago,1472241090193,"lol..thanks, bro! :)",0
,,,,,,,,z13txznxiyfuxdwcm223vrpwezblfbh4o04.1470393419861003,Rockmaster2112,8 months ago,1472241090197,That was Joe Rogan when he was younger. He has since changed his views.,1
,,,,,,,,z13txznxiyfuxdwcm223vrpwezblfbh4o04.1474071120359123,Karl Dilkington,7 months ago,1474919490201,"I think he's had a few arguments with O&A about the moon landing, but those were probably just for entertainment's sake.",5
,,,,,,,,z13txznxiyfuxdwcm223vrpwezblfbh4o04.1475435094184971,Nathan Holstrom,6 months ago,1477511490204,"Bill has always hated Bankers like any intelligent person should... but he was never a moon conspiracy guy. I don't even think the moon conspiracy guys are wrong, they are just small minded... like we did go to the moon AND Kubrick took way better pictures on a soundstage at JPL. Those arent mutually exclusive events... cause the ones that they say are faked probably are since they are substantially better pictures.",0
,,,,,,,,z13txznxiyfuxdwcm223vrpwezblfbh4o04.1480284549055957,Stevan Popovic,4 months ago,1482781890207,"I think there's a video of him talking about faking a moonlanding,maybe its just a joke dunno,i think its the video where he trashes meryl strip",0
z122cbcxtpbzcrw3s233urzq3nifuxl5004,Harry J,8 months ago,1472241089684,Buzz threw a nice right hook lol,0,false,0,,,,,,
z13vcncohofnzpack23gedljtnqzgpl4n04,Caligula Jones,8 months ago,1472241089687,you're a coward and a liar and thwwweeeefffff,0,false,0,,,,,,
z130cv0pksu2xzdbp04ce33ovsrmsffilxk0k,Walt Rowen,8 months ago,1472241089690,4:20,0,false,0,,,,,,
z12htne4dx2bxxkwf04ccdabjpiqefpjiew,Jose Antonio,8 months ago,1472241089693,"If you watch the whole video you would hear the crazy preacher claims space is not real, lmao!",0,false,0,,,,,,
z13hgxqqcmqcfh2fk23ocpk4vnj5z1g3s,Craig S,8 months ago,1472241089697,NASA now has a six billion dollar budget courtesy of a moon landing that didn't happen that comes out of taxpayer dollars so it hurts everyone that they lie about everything,1,true,1,,,,,,
,,,,,,,,z13hgxqqcmqcfh2fk23ocpk4vnj5z1g3s.1469774923734093,Jay,8 months ago,1472241089700,I'd love to hear your thoughts on the bloated defense budget.,0
z12dthmprnb5dfasn22cu1vhkmbge1hhj04,TexasActorsWorkshop,8 months ago,1472241089703,"This guy got exactly what he deserved for harassing an American legend!  Nice job, Buzz!",0,false,0,,,,,,
z12wybqzaobitv11522cu1vhkmbge1hhj04,TexasActorsWorkshop,8 months ago,1472241089725,Love this!,0,false,0,,,,,,
z122t5kauuelgtllv22nxbwx0nipfbxyf04,psmith85,8 months ago,1472241089729,We never went to the moon,1,true,1,,,,,,
,,,,,,,,z122t5kauuelgtllv22nxbwx0nipfbxyf04.1469735746665636,haufbraus,8 months ago,1472241089733,You never got an education.,7
z12rxj2i1lnbexa5c04cd1vrfumhs1aa1rw0k,PatstarDeluxe,8 months ago,1472241089736,"""You're a coward, and a liar, and a HEEF!""",0,false,0,,,,,,
z12lwtvbquunw1uks223e5spckz0j1eta,Meyro Lcs,8 months ago,1472241089739,"BILL BURR, WHAT THE FUCK IS YOUR PROBLEM. AND WHO ARE YOU ANYMORE.",0,false,0,,,,,,
z12rxfezwkjrvtkjz04cchcr2p23w1w5f4s,Meyro Lcs,8 months ago,1472241089742,"Does anyone know who that piece of shit who was laid out by one of our nations greatest icons is. Buzz you  held your dignity as long as you could. then the, I'm sorry mommy I live in your basement little boy can't give a man his space. WHO DO YOU THINK LANDED ON THE MOON!!! SOME LITTLE SHIT WHO HASN'T CONTRIBUTED to HIS COUNTRY OTHER THAN TAKING A SHIT WHILE CLOGGING UP THE SEWER PIPE?  BECAUSE HIS FAT ASS ATE CHEESE BURGERS AND WE ALL KNOW WHAT HAPPENS WHEN YOU HAVE TO MANY CHEESE BURGERS. YOU FAT PIECE OF SHIT BUZZ ALDRIN IS AN AMERICAN HERO. HE PROTECTED OUR COUNTRY WHILE YOU, YOU FAT NO WORKING DUMB ASS SHOULD HAVE BEEN LEFT ON THE TISSUE YOUR FATHER INTENDED YOU TO LAND ON. HOW DARE YOU THINK YOU CAN PUSH THIS HERO AROUND LIKE YOU DID. EXCUSE ME MR. ALDRIN FOR MY LANGUAGE. I KNOW YOU HAVE PASSED AWAY, GOD REST YOUR SOAL. IF THE PIECE OF SHIT WHO WOULDN'T LEAVE YOU ALONE WANTS TO COME OUT AND OWN HIS ATTACK ON YOU I WOULD BE GLAD TO MEET THE PIECE OF SHIT. I KNOW IT'S BEEN MANY YEARS SINCE THE INCIDENT AND I JUST SAW IT FOR THE FIRST TIME. YOU DON'T DO THAT TO AN AMERICAN HERO FROM A GENERATION YOU KNOW NOTHING ABOUT. YOU FAT FN PIECE OF SHIT. RESPOND AND WE'LL CHAT IF YOU HAVE THE BALLS",0,false,0,,,,,,
z121wv0rbna0tz5d123aj55pzyazjpyu0,Magnus Fullauto,8 months ago,1472241089745,we need to go back to the days when people got punched in the face,0,false,0,,,,,,
z13lw5o5stvch1shy04cjzazmyqsxnuay1g,Gwen King,8 months ago,1472241089748,While I don't believe we went to the moon I would never humiliate a national hero like this guy tried to do to Mr. Aldrin. Nice right hook there Buzz,0,false,0,,,,,,
z134djwo3qijyfmkd231ijmp4titxbowy04,ProudAnselmo,8 months ago,1472241089752,Do you remember where you were when Buzz Aldrin landed one on that that guy's stupid face?,0,false,0,,,,,,
z13ixd0g4qbvcda0e224wzrpzuarwv4qu04,Eric s,8 months ago,1472241089755,Old man strength.,1,false,0,,,,,,
z13rutehnq2rz10qr04cgtlzzljhhrnj4b0,Steptoe Edwall,8 months ago,1472241089758,This is great! Buzz Aldrin is a bad maw fugger!,0,false,0,,,,,,
z12xxn0h5qzhwpitm230ij3wapyndblwh04,Cyge Firstcaste,8 months ago,1472241089761,how old is the original content? cause i thought this shit happened YEARS ago? good video yet again bud,0,false,0,,,,,,
z12ndrqzdtr1cptz504cituafkqjwhfzhfw,379buzz,8 months ago,1472241089764,"Love ya Bill! We don't agree on everything however, I'm with you 100% on this one!",0,false,0,,,,,,
z133ezmpkkfbw5jnm23uf53jhyz2djhvl,mazen edrees,8 months ago,1472241089767,one small punch for man kind .. one giant stand for humanity.,0,false,0,,,,,,
z13yfx0bkvebydgz404cjbnzzyvwhxzy5z40k,MKrip808,8 months ago,1472241091749,Bill Burr's verbal take on things comes out as pure poetry.,2,false,0,,,,,,
z12xf114hrrquh55c04cftv52lvyzlywj1g,Mark JN,8 months ago,1472241091752,"I cannot tell you how angry this video makes me. I cannot imagine having such contempt for an elderly man who did more in his life than most of us could dream. 

Major applause for Buzz Aldrin for throwing a nice right 'cross that asshole's jaw. I'd buy Buzz a beer right now if I could.",1,false,0,,,,,,
z13lubuwzrvnhdbm123zvhf5asmexxynw,phapnui,8 months ago,1472241091755,He should have punched him in the adam's apple to put him in an immediate paralysis of pain.  That would larn him...,2,false,0,,,,,,
z132ybaqtmzyxr3zy04cffaafvrtzntwkgc,BubbleOnPlumb,8 months ago,1472241091758,"It really should not be against the law to punch someone who so desperately needs it the way that guy did.  How much verbal abuse and jackass behavior does one have to put up with before you can legitimately dish out a response?  Don't get me wrong, I am not talking about being able to beat someone to a bloody pulp; but what is so wrong with giving a black eye or fat lip to someone who is just begging for it by being a relentless jackass?",0,false,0,,,,,,
z13zfnmrtqmswlcn023tifo5kxjlghgzt04,Chris billing,8 months ago,1472241091760,he probly wont be getting in anyones face anymore,0,false,0,,,,,,
z12qwxbgxkqhj3rif04civf4ep2cif4pnnk0k,Dennis Bwake,8 months ago,1472241091763,"You obviously don't realise that to perpetuate a lie is to control and steal from society.
The Fake moon landing is an archetypical example of the control mechanism that the elite 1% have upon humanity. 
Therefore to answer your question, once you accept non truths as factual reality a great deal of your existence is equated to that falsehood and thus depriving you of true experience of existence; a good place to start would be George Orwell's 1984.",0,false,0,,,,,,
z12hvvxykoijslaal04cetrhqlqzhrig1mk0k,CC DeVille,8 months ago,1472241091766,"That happened in 2002 when Aldrin was 72, not in his 80s as Burr claims.",0,false,0,,,,,,
z13nvzlbwujszltey23ri5pipuvsi1eek,Guiseppe Kay,8 months ago,1472241091769,"Thanks for pointing this out, Bill.

For showing the actual clip.

...dude got rocked.",0,false,0,,,,,,
z122zl3ompnhh34hs04cgjaixxmbgv1xgk40k,Monty Dog,8 months ago,1472241091772,I remember watching the landing in the 7th grade: the whole world watched.,0,false,0,,,,,,
z12cwv352qjrj5nj104ci5qqqubowfkwbf4,Harry Manback,8 months ago,1472241091774,Totally rational to attack someone over words.  So big strong man,0,false,0,,,,,,
z12febjwxvuxtf303225fdrzlxueyj4kx,John White,8 months ago,1472241091777,your Beautiful Buzz GET'EM YAAAAAAAAAAAA,0,false,0,,,,,,
z12ywpe50v20grlzo04ccxlpvwjcwp5zx1c,420Kasper420,8 months ago,1472241091780,"No matter how many times I watch it, that ""you're a coward, and a liar, and a mdfghi7ghtsdygfyrb"" sequence never gets old.",0,false,0,,,,,,
z12wg1koxnejvdzj404cetu4gsb5zj0yko00k,rustyolgun,8 months ago,1472241091783,at a boy Buzz!!!,0,false,0,,,,,,
z125s3ij0qzbjj4ip04cilbw4nypjngour40k,Fred Nickel,8 months ago,1472241091785,I love that the guy sued Buzz and lost,0,false,0,,,,,,
z13bgljhpuaayh5nx220yvopwtz2tnnlb,Dr. Sidney Marlborough,8 months ago,1472241091788,Old fashioned bad ass.  Question a mans honor you deserved to get hit.,0,false,0,,,,,,
z122vvygmsmswfigh04cfdviapufyhxicxo0k,Kevin Osborne,8 months ago,1472241091790,There were such things as telescopes even in 1969. Does anyone really think the space vehicles were not tracked by multiple sources coming and going? http://pages.astronomy.ua.edu/keel/space/apollo.html,0,false,0,,,,,,
z13yzvawazunhlhyi04ccblybkfrtdojrl40k,Justin InstrumentalSavings,8 months ago,1472241091793,"Hey guys. The idea was that we forced the Russians to destroy their economy by having them believe that we were going to spend our money on space exploration. They jumped at the opportunity to be the first, and were happy to spend vast amounts of their own money. Buzz isn't to blame, he was just an actor. No big deal.",0,false,0,,,,,,
z121irj5lunowfwww04cep54zrmjch0bwgk,Chris Thompson,8 months ago,1472241091797,Moon rocks in that fist.,0,false,0,,,,,,
z130ud34rrawstbsi23ajvv5zwyishw4v04,Alex walker,8 months ago,1472241091800,fat fucking triple cheeseburger eating face LMFAO 3:10,16,true,1,,,,,,
,,,,,,,,z130ud34rrawstbsi23ajvv5zwyishw4v04.1469673365753392,MKrip808,8 months ago,1472241091803,Bill's a poet.,3
z12mutqr1rbmerbnd23xhjapwtjljtfqu04,Tbuschken Prince,8 months ago,1472241091805,You're a coward and a liar and a thiEEEFHJHFJG,0,false,0,,,,,,
z13gsdv4txuov5lxp04ch3mi3uffer5pvbw,akumachill,8 months ago,1472241092897,BAM! Right in the kisser! BAM! Riding the kissah! BAM! Writing the kiss uh! BAM! Writhing the kissah!,0,false,0,,,,,,
z12bwbig0p3xwbry004cgt0qwuarepab2ig,Quay Rude,8 months ago,1472241092902,"Ahhh.  Perfect.  Favorite comedian raises favorite internet moment to new heights.  (and for MANY reasons, Buzz Aldrin is a national treasure - I hope I age with even half the energy and spirit of this man)",0,false,0,,,,,,
z12lgzeq3lq3v1xbm04cgpbjkmmpgrfq2qw0k,TazeMeBro McCleskey,8 months ago,1472241092907,"Agreed. The Russians would have loved nothing more than to prove we didn't land on the moon. They were ahead of the U.S for a long time regarding space travel and exploration. They were very prideful about their space accomplishments, the Russians would have found out and told the world if NASA didn't actually send a person to the moon. 
    The Russians would have to be in on it too, and I don't see that one happening during that time period.",0,false,0,,,,,,
z121vrkozx2tfxotp22zffgppoaysbcgt04,M Johnson,8 months ago,1472241092910,i fuckin luv buzz,0,false,0,,,,,,
z13hcv5yppagidwnk221yjcwanvvxpdry04,dvlarry,8 months ago,1472241092914,81 years old still a hero haha.,0,false,0,,,,,,
z132dvv5dneodngoe04cgxdiuw3hz5npmfc,bobtastic47,8 months ago,1472241092917,"""SWEAR ON THE BIBLE""..??????????... THAT WOULD BE EVEN A BIGGER LIE...!!!!",0,false,0,,,,,,
z120zzvxmnq1yrjpb04cebnj2pu3z5ly0ks0k,Danijel L,8 months ago,1472241092921,That was the most satisfying punch I've ever seen!,0,false,0,,,,,,
z120vzlpruaxwj1ez22mcf5oxoilhzila,James Pitoola,8 months ago,1472241092925,is that the same guy from Youtube Video of the Week?,0,false,0,,,,,,
z13mg1gpinrhehfn022ssrppemeruz315,petestrat07,8 months ago,1472241092928,They sure did land on the moon. Carl Sagan helped them do it and his integrity was unquestionable,0,false,0,,,,,,
z12uvfgjwzubfbgx204cfz0inp3uwlgjaoo0k,Dylan Goode,9 months ago,1469562692949,this is the best narration in a video iv ever heard,0,false,0,,,,,,
z12vtxqr1q2chhstf23avzfqizrzdlw5104,TheCrazyCanuck420,9 months ago,1469562692952,Imagine if this POS was around 30 years ago and tried that on a 50 year old Buzz :),0,false,0,,,,,,
z12byjh5xtrgjrcnj23wzvcg5ne4tx3s2,David Ayre,9 months ago,1469562692956,"Moon landing deniers are hilarious, sad and incomprehensible all at the same time.

The landing was a pretty awesome feat, but it wasn't like performing a miracle.  It took a lot of work and careful preparation, but at the end of the day, going to the moon is just not that hard a thing to do.  We had the technology.

By the way, old badasses like Buzz Aldrin don't need to be coddled -- his age wasn't the reason to leave him alone.  It's more like, 1) have some respect and 2) don't fuck with a man who can still beat the shit out of 95% of the population.",2,true,2,,,,,,
,,,,,,,,z12byjh5xtrgjrcnj23wzvcg5ne4tx3s2.1469636903105525,Quay Rude,8 months ago,1472241092960,"... agree with your main point.  But ""not that hard to do""?",0
,,,,,,,,z12byjh5xtrgjrcnj23wzvcg5ne4tx3s2.1471321473108096,David Ayre,8 months ago,1472241092964,"+Quay Rude 
I had a feeling my wording there might raise some eyebrows...

I probably used the wrong phrase.  I mean, everything's relative.  Maybe it's just semantics.  But, when I said ""not that hard"", I was thinking about the process from a couple different angles.

First, with consideration of something said by, if I'm not mistaken, Henry Ford.  To paraphrase, ""No task is particularly difficult when broken down into manageable steps"".  I imagine that's how we went to the moon.  I could be wrong, but none of those individual steps required any act of genius -- it was just a process.

Now, the principles upon which the Apollo program was based are another matter entirely -- certainly, to do what it did, NASA stood upon the proverbial shoulders of giants.  I'd never dispute that it was hard to acquire some of the knowledge underlying our success.  We're not going back to the wheel, though.

Secondly, there's my (unproven) personal conviction that the universe is chock full of life, including myriad intelligent species, and that we on earth haven't climbed the ladder very high at all.  So to me it's not hard to envision a race to whom touching down on and coming back from our moon would be looked upon as primitive child's play.  Hard for homo sapiens, easy for some little green men somewhere far away.  Sure, since it's all relative; I see I was off-base.

I'll add one thing: I made that bold statement also with a mind towards (as I see it) the truly great human achievements.  To me, these are accomplishments like Shakespeare's body of work or Michelangelo's Pietà.  It was so hard to do things like these, no one else ever was able to accomplish anything of comparable magnitude.  Just my opinion though. ^_^",2
z13dyntxdxaui5awq04cedajmmfdzvwhr5o,Ry Guy,9 months ago,1469562692967,"""believes in the bible but not the moon landing""....hilarious!
good for you old man buzz, teach that waste of skin some respect!",0,false,0,,,,,,
z123yhlhlxmsgxkji04cgt4b4supfjfh33w,Jeffrey Kent,9 months ago,1469562692971,buzz didn't land on the moon but he sure did make that guy see stars,0,false,0,,,,,,
z13ws5upduapz1ffw221sjnoyoaxvda25,Analyzingfunny,9 months ago,1469562692975,this comes from a documentary about flat earth? why dont they say that,0,false,0,,,,,,
z13tjl3w5vbvt5ylg22ywb3pfzmkub1pl04,peter francis,9 months ago,1469562692980,i love bill burr,0,false,0,,,,,,
z12ozdtjoyyuexnqe04chbyamob4vzhzzbk,zakkwylde4201,9 months ago,1469562692984,"I really wanted to see what happened after the punch (people's reactions, what was said, etc.) Almost cool video but you talk too much, replayed the punch so many times like a dork and didn't let us see the end. Good job",0,false,0,,,,,,
z13pt1v4fwbhdlovm22kslpruwimzl4ck,healthhavencom,9 months ago,1469562692988,"No one has ever walked on the moon.

Get over it.",0,true,5,,,,,,
,,,,,,,,z13pt1v4fwbhdlovm22kslpruwimzl4ck.1469581458028734,Gubba Bump,9 months ago,1469562693320,Yes they have.  And anyone with a functioning brain understands that.  Get over it.,0
,,,,,,,,z13pt1v4fwbhdlovm22kslpruwimzl4ck.1469582126104973,healthhavencom,9 months ago,1469562693323,"+Gubba Bump Troll Boy

No one has ever walked on the moon.

Get over it.﻿

Then get a brain.",0
,,,,,,,,z13pt1v4fwbhdlovm22kslpruwimzl4ck.1469582727688547,Gubba Bump,9 months ago,1469562693325,Actually they have.  12 men.,0
,,,,,,,,z13pt1v4fwbhdlovm22kslpruwimzl4ck.1469583945724076,JaBron Junklove,9 months ago,1469562693327,Michael Jackson begs to differ.  Thrilla!,1
,,,,,,,,z13pt1v4fwbhdlovm22kslpruwimzl4ck.1476846593337822,Matt E,6 months ago,1477511493329,"+Kaos I say we just send all those nutters to the moon so they can walk in it themselves. And than leave them there to die, a place they said no one ever was. Their bodies will remain as evidence for the rest of our time.",0
z13dxluqiumojdcbm04cez25kszhcnt4ybo,shanemoura,9 months ago,1469562692992,"The Eagle has Landed, motherfucker.",0,false,0,,,,,,
z121fnw53umltb5do22pu5dizw2lebq0j,JAYDEE KAY,9 months ago,1469562694174,"Wow! You're pretty good at calling people names while denouncing the name calling someone else is doing. 😂😂Typical liberal, do as I say not as I do. Lmao you guys are nothing more than a bunch of one liners wrapped up in an ignorant stuper of idiocracy . Your party is burning my friend and the whole world is laughing! 😂😂😂",0,false,0,,,,,,
z13kvnaa4py1gndtp22ad3opclumctgp304,Jick Niblet,9 months ago,1469562694176,Yeah!! Go back to California!,0,false,0,,,,,,
z12vhh3yssnzizleo22xy1lp5vrktnhjf04,PlaceOfOrigin,9 months ago,1469562694180,It should become a national holiday. Punch a Fatty in the Face Day.,0,false,0,,,,,,
z13pjbaxkprxi3gqk04cd5zqborjxduah0g,hendetra888,9 months ago,1469562694183,"""Props to Buzz Aldrin, for not only being a hero, but punching a fatty in the face.""",0,false,0,,,,,,
z125tpq4gpa3in5ec22htzhahkyoyfa1l,Murrangurk2,9 months ago,1469562694186,Fat fuckin tripple cheese burger eating face!,0,false,0,,,,,,
z12pi32gdxywcd0ba04cen1y5wbic5ig43s,Ken Howell,9 months ago,1469562694188,I didn't know Buzz could be any more a hero to me! I just wish you would have kicked him in the balls so hard that they would have returned from the moon baring witness the Buzz's footprints.,0,false,0,,,,,,
z12zzjeaiwzjddq2h22dzxoy5rasftzv2,Tony Kenyon,9 months ago,1469562694192,You have a great way with words dude. haha.,0,false,0,,,,,,
z125j5brnqvryr45c04cfh0qamywufdov14,chromo48,9 months ago,1469562694195,"Not a fan of when things end up becoming violent, but this is honestly one of those times when it was truly the last and best option. Well deserved punch in the face.",0,false,0,,,,,,
z131frubnvnay3uqf04cizajytzdi5bbh3g,Kevin N,9 months ago,1469562694198,Cunts will cunt,0,false,0,,,,,,
z13fgvmwtqmsih1hm04civviyrfmt14yiik,Vroktar2009,9 months ago,1469562694201,Fuck that fat fuck. Nice work Buzz.... :),0,false,0,,,,,,
z133zhhzwz3pttprr04ch3p5rm2tg3jhnt40k,jtomasik,9 months ago,1469562694203,"Way to call it Bill.  You got it dead on.  Heck, just to strap a Saturn  V to your ass and light that candle takes bigger balls than anything else on earth.  That's about 800,000 horsepower.  Yeah...hang on!  Aldrin's punch was awesome.  That fat douche should be required to show everyone he meets that vid, so you know what kind of an idiot you're dealing with.",0,false,0,,,,,,
z12xjvtqzof3tdzwt04cgv4ojnefyviotuw0k,Hugo Carvalho,9 months ago,1469562694206,"I used to think this was the stupidest conspiracy theory ever. Then I became aware of ""flat earthers"".",0,false,0,,,,,,
z12jcrm4mzugc1k0g23ihneqesurzxo1r,rkent06,9 months ago,1469562694209,"who gives a fuck if he went to the moon, there's proof he socked this cunt in the face and thats a far bigger achievement.",16,true,2,,,,,,
,,,,,,,,z12jcrm4mzugc1k0g23ihneqesurzxo1r.1469581381645194,Gubba Bump,9 months ago,1469562694213,Yeah but these moon conspiracy nutjobs could actually convince themselves that the punch was fake and it was actually photoshopped.,3
,,,,,,,,z12jcrm4mzugc1k0g23ihneqesurzxo1r.1469740902038453,DW,8 months ago,1472241094215,One clean jab for mankind.,1
z13rdxzzsqnps5gdi23ksffbkluoythlb,dbltrplx,9 months ago,1469562694217,"That wasn't a right hook bill.
That was a straight right hand.
And not bad for an old stick.",0,false,0,,,,,,
z12rx5oo2xncy1puk22ecrtrmvbewpqtr,GTL5427,9 months ago,1469562694220,"""I don't even know how he puts on his flight suit, the size of this guy's balls."" LMFAO",0,false,0,,,,,,
z12fzpchzkbwh3d3s22ushfiksmtgbkd3,neckarsulme,9 months ago,1469562694223,why have we never gone back?,1,true,5,,,,,,
,,,,,,,,z12fzpchzkbwh3d3s22ushfiksmtgbkd3.1469581499356815,Gubba Bump,9 months ago,1469562695423,We did.  6 times.,3
,,,,,,,,z12fzpchzkbwh3d3s22ushfiksmtgbkd3.1469590971850871,neckarsulme,9 months ago,1469562695425,"+Gubba Bump yea, since the last mission.",0
,,,,,,,,z12fzpchzkbwh3d3s22ushfiksmtgbkd3.1469644764325083,Lemonjamin,8 months ago,1472241095427,"probably lack of funding in the govt. There are now private businesses who are providing options for space explorations (in my opinion, that's better)",0
,,,,,,,,z12fzpchzkbwh3d3s22ushfiksmtgbkd3.1469666999235967,Gubba Bump,8 months ago,1472241095429,"+Lemonjamin Yep, that's exactly why.  The Apollo program was incredibly expensive and there really was no benefit to keep going back.  2 or 3 of those last visits were probably just because of momentum.  Of course, tinfoil hat wearers probably think that all of that money was spent on some nefarious government program that they have been waiting 50 years to unleash on all of us idiots.",0
,,,,,,,,z12fzpchzkbwh3d3s22ushfiksmtgbkd3.1476846716527288,Matt E,6 months ago,1477511495431,"Well. We don't really have a reason to right now. We went. We gathered samples for analysis. We walked around a bit. Not much to go for now, unless we need some more moon rocks.",1
