commentText,likes
Obviously they never went to the moon!ðŸ˜‚didnt think people still thought we did thats worrying,1
hell yeah buzz,0
"fatty showed everyone his colors ,, he has no problem bullying very old people,, winner of the dickhead of the year award  plain and simple,, and if your on his side,,, your as  pathetic",0
Bill Burr,0
RIGHT THERE FRED!,0
RIGHT THERE FRED!,0
That was the very best commentary on any video ever. I laughed through the whole thing! Soft serve eating fag! Thanks bill burr,0
That fat fuck should kill himself,1
"""..soft serve eatin fag"" haha ima use that phrase someday",0
"So this moon hoaxer looks angry after ""landing on the moon"", and now physically assaults people?  LOL Aldrin you disgraced moon hoaxer pig. Coward go fuck up yourself we exposed your lies.",0
now thats a Â´Â´theoryÂ´Â´ innit ^ ^,0
"imagine this... the did it... no not the phAikâ‚¬... the landinc... 
zen wot ? rite... data. data is haoley kau... 
so ? rite build in errors to harvest data sheeple ^",0
"rite no difference... jfk roswell palme beetle oll the shame -.- 
but guess wot yangs... not its comin round a gain ^^ 
part of jew nu ^",0
"What I find hilarious... the woman who was trying her ass off to keep buzz away.. was actually trying to protect the fat dude... until she just goes... "" ok.. your on your own now... I'll be over here when you're done practicing getting up and down""",0
"Well done, Bill.",0
I think the fattie was right though.,0
I truly love Bill Burr,0
"Ya, but what if they didn't land on the Moon Billy?",0
Props to fatty I see a law suit coming. Nice work,0
what a son of a whore...,0
"The taller guy was right, Buzz would not swear that he walked on the moon.  It was all a hoax.  Stop worshipping bill burr, the guys a moron, he's funny, but he's a moron.",1
"""You're a coward and a liar and thooft!""",0
"But it is made of cheese, right?  Whack!",0
The Aldrin doth protest too much.,0
"I would have smacked him WAY earlier than that. See, when you look old you can get away with a lot more. Props to Buzz for holding off for so long. Great post.",0
Who did it hurt? Wow,0
You're a liar and a coward and thief^%$&! )*ERFFFFFFFGGGGGGHHH!,0
Who did it hurt?The military funneled arms and aid to Britain so they could conquer the Asian countries in the late 60s while every body in the us is waving their fun flags and cheering a Walt Disney production.Now I can buy my winter coat that was made in viet Nam and my under ware from indonesia!Sweatshops and cheap slave labor for everybody!Too bad our economies in shambles except for the 1 % at the top!,0
"Whether or not they went to the moon, you don't just walk up to someone and started barking nonsense to their face.
Buzz was in the right to punch him in the face.",0
"Just another Mikey Moore wantabe, screw the facts, get me in front of the camera-just not too close, pan back 'cause I'm a fat tub of sh*t!",0
Think we all agree with you pal...But cut out the personal stuff..Unnecessary.,0
"If you beleive in the moon landing conspiracy then you need to talk to Jodrell Bank, they fire a laser at the moon every day to calculate distance, in order for that laser beam to return it has to bounce off a mast!",0
That guy might be a cunt but then so is Bill Burr,0
I would have punched him too,0
"america lie about everything, moon landings no exception.",0
awesome,0
Why have we not been to the moon since?,0
"I would've blocked Buzz's punch, then I'd throw a right cross, sending Buzz's dentures to the moon. Seriously, we did land on the moon butÂ a lotÂ of the photography and video was faked. They had to make it look good for the public.",0
"Put your hand on the fucking Bible and swear it's easy, the moon landings are as fake as Pamela Andersons tits..Buzz is a fucking liar and a thief.",0
That conspiracy shit deserves to be punched in the head until he's a retarded... or dead,0
"Bud Aldrin, based.",0
Great video allenpalin,0
usa got bragging rights before russia. noone has gone back since. because noone went in the first place.,0
"should have kicked him in the ball too, we don't need morons like him reproducing.",0
who did it hurt? the american taxpayer? and if they did not what have they really been up to?,0
this video would be better if some annoying fuck wasnt giving his life story,0
"Gave him the ol' RIGHT THERE, FRED!",0
Theithph....my toof! D:,0
he's probably one of those idiots that thinks the Earth is flat and the Sun is a 30 mile wide light bulb and all the other planets are dishes in the sky are plates that are painted and we are part of some higher intelligence chemistry experiment,0
an 80 yr old man can be 20 yrs old for one split second once a year... fact,0
Haha bruv. Big cheeseburger eating slob. Would've liked to see Buzz drop him tho,0
"""props.....for hitting a Fatty....in the face"" lol",0
"wise move calling a war hero a coward...i,m surprised buzz didn,t rip out his throat ""roadhouse"" style",0
"""triple cheeseburger eating face'- A true American poet.",0
"I'll tell you what wasn't faked, Buzz's fist landing on that guy's face.",7
Hilarious commentary.,0
I believe in freedom of speech but you don't have the right to verbally accost someone. Buzz was right!,0
I think I'm going to watch that punch landing the rest of the morning. Total satisfaction.,0
went down the rabbit hole and watched all your vids....youre awesome for doing this...this looks professional as shit ....great job man.,82
Kubricked!,0
bravo buzz what a hero,0
god bless u buzz.,0
Too much cussing here. I'd prefer you work harder on articulating yourself because that takes more skill.,1
"What does the fact that the guy is 'tubby' have to do with anything? If the guy is a jerk, he is a jerk, regardless of whether he is tubby or not.",0
"real  man versus   classroom  idiot,,  nice hook buzz",0
a soft served ice cream eating fag lololololol Triple cheese fucking face lol,2
YES! Buzz Aldrin justifiably punches intimidating lump of biological waste,0
Steak and Milk vs Cheeseburger and Soda. Who will win?,0
they should create a medal for this and awarding it to Buz,0
I wish Buz had given this douchebag a good kick in the balls for good measure,0
"""So props to Buzz Aldrin. For not only being a hero; for punching a fattie in the face."" - Bill Burr. One of the best quotes I've heard in ages.",1
"I'm big on conspiracy theories, really big. But, of course we went to the moon ffs....",1
"Too bad we can't get away with knocking out other SJW...because you know the CT is one with all of that disrespect.  Even if Buzz didn't go to the moon, he was still the best of the best in his field and has earned common courtesy and respect.  I wish we could have seen the part where the guy bursts into tears, runs home to mommy, and hides in her basement where he still lives with his cat and his huge porn collection.",0
Buss Aldrin punching that guy was....PRICELESS!! Along with your commentary about the fat fucker that got what he deserved.,0
"Just before Buzz hit him he was probably thinking, 5,4,3,2,1 POW.",0
Awesome punch,2
should kicked him in the balls as well nice one buzz fuckin legend,0
"Can you imagine, three of Buzz's best friends died in a fire when Apollo 1 was still sitting on the test pad because the capsule was pressurized with 100% oxygen and an electrical spark caused a massive fire?   And this fat piece of lard had the balls to tell Buzz Aldrin he is a ""coward""?   The only thing I'm more sorry about is that Buzz didn't have Bruce Lee  as his security guard.  Buzz, you are the greatest.  This jerk actually sued Buzz for punching him, but the Judge dismissed the case saying that the Jerk ""had it coming to him"".   ""To the Moon Alice"".
        BTW, please consider giving Buzz credit for the first words to have been spoken on the Moon.  Most  believe that Neil Armstrong spoke the first words on the moon, but in reality Buzz did. ( See, Rocketmen, by Craig Nelson).  As the LEM (Lunar Excursion Module) was being manually flown by Armstrong, because the on board computer was going to land the ""Eagle"" into a rocky area, Neil Armstrong flew the LEM for more time than was planned.  They landed with only about 17 seconds of fuel left on board.  Armstrong was descending at a rate of a few ft per second, but was travelling sideways about 20 ft. per second.  Everybody was sweating because fuel was low and they had not yet landed.  Finally when the LEM was about 10 feet or so above the moon, one of the three feet long wires hanging from each of the landing strut pads contacted the moon's surface.  They were kind of like the spring ""curb feelers"" on the old large sedans from the 1960s"".  Then, as one of these long  wires ""feelers"" touched the Moon's surface, a blue light went off on the instrument panel.  This meant it was time for Armstrong to hit the button that turned off the landing rocket motor.  As soon as the blue light came on, Buzz Aldrin said ""Contact light"".   Thus the first word spoken on the moon was the word ""Contact"".  Of course we can all argue as to the point when the astronauts were really ""on"" the Moon, but technically, it was when the LEM first touched the moon.  That's why they called the lights on the panel ""contact lights"".   Another tidbit FYI.  The OMEGA SpeedMaster Professional watch was the only watch approved by NASA for space flight, even after they tested it against 5 other contenders like Rolex, and other big names.  The Speedmaster is now known as the ""Moonwatch"".  Neil Armstrong left his hanging on the instrument panel because the LEM's internal clock stopped working.  But Buzz wore his Speedmaster strapped with a very long band of velcro wrapped several times around his wrist on the outside of his space suit.  So, Buzz Aldrin was the first person to wear a watch on the moon, and that watch was the Omega Speedmaster Professional, .321 Movement.  FYI  for anybody who likes moon landing trivia.  The book, ""Rocketmen"" is awesome.  I like the audio book version so I can hear it while driving. FYI",1
Didn't harm anyone????Tell that to OJ Simpson.,0
conspiracy theorists are morons stuck in reverse.,0
I HATE  it when I can't see the reaction to the people in videos like that.,0
"Slay the Hildabeast!  Bernie, (or Jill Stein) or BUST!!!! I would crash and burn with Idiot Thief Trump  rather than sell out to the Hildabeast.....but Bernie and/or Jill Stein are better.",0
That tub of shit deserved it!! LOL,1
"Nice, Buzz!",0
"I give props to Buzz, for punching fatty in the FACE!!",1
i enjoy your commentary. this video is great!,0
That asshole deserved far worse then that .,0
that was a heavy fucking hit lmao,1
"Food for thought..... As to the moron harassing Buzz, he asks him to swear on the Bible. If this moron doesn't believe Mr. Aldrin landed on the Moon, I have no doubt he also doesn't believe in the Bible. Video trash seeking his fifteen minutes of fame....",0
I hope I still got it like that when Im old..... Mucho respect......Thats the way to enjoy those last years!,0
"but the real Punch line of this story is Buzz was charged with Assault (or maybe it was just a civil action) & when they went before the Judge, the Judge threw out the case..... charges dropped,  -0- damages,  -0- liability   whatever.  Buzz Aldrin is 'justified' to smack any nimrod like this.  Sounds good & just to me.   Go Buzz & thanks",0
"Aldrin was actually 72 at the time, but that's still some punch for a 72 year old.",0
Good for you Buzz. Fuck that douchebag! He needs to get laid. I would have not only punched him out but kick him and piss on his fucking face!,0
"wow bill burr is a steaming pile of shit, totally unoriginal, nothing of worth here, just a retard mindlessly blabbering things that the average retard ""relates to""",0
Even the Judge agreed that he deserved the rocket launch punch.,0
aldrin behavior certainly backs up the theory,1
he should stab him the next time and do the world a favor,0
9/11 never happened! You're all fools!,0
Kubrick made him a star.,0
"well neil armstrong would not swear on a bible.. now that was telling..and what is even weirder is the video of the lunar lander blasting off from the moon..it looks like it is being jerked by a cable..and btw, who was left behind to video that ??  last of all, if we went to the moon in 1969, with the rudimentary technology of the times, then why couldn't we go today ??  or in 2 yrs ?? because we don't have the technology..and we sure as hell didn have it then..

so why didn he just swear on a bible that he did ?? that is the question..instead of throwing a punch ?",0
"I swear to God that Bill used to be one of those 'moon landings are a conspiracy' guy? Or am I just crazy..?And Allen your videos are great, keep up the good work and go fuck yourself",4
Buzz threw a nice right hook lol,0
you're a coward and a liar and thwwweeeefffff,0
4:20,0
"If you watch the whole video you would hear the crazy preacher claims space is not real, lmao!",0
NASA now has a six billion dollar budget courtesy of a moon landing that didn't happen that comes out of taxpayer dollars so it hurts everyone that they lie about everything,1
"This guy got exactly what he deserved for harassing an American legend!  Nice job, Buzz!",0
Love this!,0
We never went to the moon,1
"""You're a coward, and a liar, and a HEEF!""",0
"BILL BURR, WHAT THE FUCK IS YOUR PROBLEM. AND WHO ARE YOU ANYMORE.",0
"Does anyone know who that piece of shit who was laid out by one of our nations greatest icons is. Buzz you  held your dignity as long as you could. then the, I'm sorry mommy I live in your basement little boy can't give a man his space. WHO DO YOU THINK LANDED ON THE MOON!!! SOME LITTLE SHIT WHO HASN'T CONTRIBUTED to HIS COUNTRY OTHER THAN TAKING A SHIT WHILE CLOGGING UP THE SEWER PIPE?  BECAUSE HIS FAT ASS ATE CHEESE BURGERS AND WE ALL KNOW WHAT HAPPENS WHEN YOU HAVE TO MANY CHEESE BURGERS. YOU FAT PIECE OF SHIT BUZZ ALDRIN IS AN AMERICAN HERO. HE PROTECTED OUR COUNTRY WHILE YOU, YOU FAT NO WORKING DUMB ASS SHOULD HAVE BEEN LEFT ON THE TISSUE YOUR FATHER INTENDED YOU TO LAND ON. HOW DARE YOU THINK YOU CAN PUSH THIS HERO AROUND LIKE YOU DID. EXCUSE ME MR. ALDRIN FOR MY LANGUAGE. I KNOW YOU HAVE PASSED AWAY, GOD REST YOUR SOAL. IF THE PIECE OF SHIT WHO WOULDN'T LEAVE YOU ALONE WANTS TO COME OUT AND OWN HIS ATTACK ON YOU I WOULD BE GLAD TO MEET THE PIECE OF SHIT. I KNOW IT'S BEEN MANY YEARS SINCE THE INCIDENT AND I JUST SAW IT FOR THE FIRST TIME. YOU DON'T DO THAT TO AN AMERICAN HERO FROM A GENERATION YOU KNOW NOTHING ABOUT. YOU FAT FN PIECE OF SHIT. RESPOND AND WE'LL CHAT IF YOU HAVE THE BALLS",0
we need to go back to the days when people got punched in the face,0
While I don't believe we went to the moon I would never humiliate a national hero like this guy tried to do to Mr. Aldrin. Nice right hook there Buzz,0
Do you remember where you were when Buzz Aldrin landed one on that that guy's stupid face?,0
Old man strength.,1
This is great! Buzz Aldrin is a bad maw fugger!,0
how old is the original content? cause i thought this shit happened YEARS ago? good video yet again bud,0
"Love ya Bill! We don't agree on everything however, I'm with you 100% on this one!",0
one small punch for man kind .. one giant stand for humanity.,0
Bill Burr's verbal take on things comes out as pure poetry.,2
"I cannot tell you how angry this video makes me. I cannot imagine having such contempt for an elderly man who did more in his life than most of us could dream. 

Major applause for Buzz Aldrin for throwing a nice right 'cross that asshole's jaw. I'd buy Buzz a beer right now if I could.",1
He should have punched him in the adam's apple to put him in an immediate paralysis of pain.  That would larn him...,2
"It really should not be against the law to punch someone who so desperately needs it the way that guy did.  How much verbal abuse and jackass behavior does one have to put up with before you can legitimately dish out a response?  Don't get me wrong, I am not talking about being able to beat someone to a bloody pulp; but what is so wrong with giving a black eye or fat lip to someone who is just begging for it by being a relentless jackass?",0
he probly wont be getting in anyones face anymore,0
"You obviously don't realise that to perpetuate a lie is to control and steal from society.
The Fake moon landing is an archetypical example of the control mechanism that the elite 1% have upon humanity. 
Therefore to answer your question, once you accept non truths as factual reality a great deal of your existence is equated to that falsehood and thus depriving you of true experience of existence; a good place to start would be George Orwell's 1984.",0
"That happened in 2002 when Aldrin was 72, not in his 80s as Burr claims.",0
"Thanks for pointing this out, Bill.

For showing the actual clip.

...dude got rocked.",0
I remember watching the landing in the 7th grade: the whole world watched.,0
Totally rational to attack someone over words.  So big strong man,0
your Beautiful Buzz GET'EM YAAAAAAAAAAAA,0
"No matter how many times I watch it, that ""you're a coward, and a liar, and a mdfghi7ghtsdygfyrb"" sequence never gets old.",0
at a boy Buzz!!!,0
I love that the guy sued Buzz and lost,0
Old fashioned bad ass.  Question a mans honor you deserved to get hit.,0
There were such things as telescopes even in 1969. Does anyone really think the space vehicles wereÂ not tracked by multiple sources coming and going? http://pages.astronomy.ua.edu/keel/space/apollo.html,0
"Hey guys. The idea was that we forced the Russians to destroy their economy by having them believe that we were going to spend our money on space exploration. They jumped at the opportunity to be the first, and were happy to spend vast amounts of their own money. Buzz isn't to blame, he was just an actor. No big deal.",0
Moon rocks in that fist.,0
fat fucking triple cheeseburger eating face LMFAO 3:10,15
You're a coward and a liar and a thiEEEFHJHFJG,0
BAM! Right in the kisser! BAM! Riding the kissah! BAM! Writing the kiss uh! BAM! Writhing the kissah!,0
"Ahhh.  Perfect.  Favorite comedian raises favorite internet moment to new heights.  (and for MANY reasons, Buzz Aldrin is a national treasure - I hope I age with even half the energy and spirit of this man)",0
"Agreed. The Russians would have loved nothing more than to prove we didn't land on the moon. They were ahead of the U.S for a long time regarding space travel and exploration. They were very prideful about their space accomplishments, the Russians would have found out and told the world if NASA didn't actually send a person to the moon. 
    The Russians would have to be in on it too, and I don't see that one happening during that time period.",0
i fuckin luv buzz,0
81 years old still a hero haha.,0
"""SWEAR ON THE BIBLE""..??????????... THAT WOULD BE EVEN A BIGGER LIE...!!!!",0
That was the most satisfying punch I've ever seen!,0
is that the same guy from Youtube Video of the Week?,0
They sure did land on the moon. Carl Sagan helped them do it and his integrity was unquestionable,0
this is the best narration in a video iv ever heard,0
Imagine if this POS was around 30 years ago and tried that on a 50 year old Buzz :),0
"Moon landing deniers are hilarious, sad and incomprehensible all at the same time.

The landing was a pretty awesome feat, but it wasn't like performing a miracle.  It took a lot of work and careful preparation, but at the end of the day, going to the moon is just not that hard a thing to do.  We had the technology.

By the way, old badasses like Buzz Aldrin don't need to be coddled -- his age wasn't the reason to leave him alone.  It's more like, 1) have some respect and 2) don't fuck with a man who can still beat the shit out of 95% of the population.",2
"""believes in the bible but not the moon landing""....hilarious!
good for you old man buzz, teach that waste of skin some respect!",0
buzz didn't land on the moon but he sure did make that guy see stars,0
this comes from a documentary about flat earth? why dont they say that,0
i love bill burr,0
"I really wanted to see what happened after the punch (people's reactions, what was said, etc.) Almost cool video but you talk too much, replayed the punch so many times like a dork and didn't let us see the end. Good job",0
"No one has ever walked on the moon.

Get over it.",0
"The Eagle has Landed, motherfucker.",0
"Wow! You're pretty good at calling people names while denouncing the name calling someone else is doing. ðŸ˜‚ðŸ˜‚Typical liberal, do as I say not as I do. Lmao you guys are nothing more than a bunch of one liners wrapped up in an ignorant stuper of idiocracy . Your party is burning my friend and the whole world is laughing! ðŸ˜‚ðŸ˜‚ðŸ˜‚",0
Yeah!! Go back to California!,0
It should become a national holiday. Punch a Fatty in the Face Day.,0
"""Props to Buzz Aldrin, for not only being a hero, but punching a fatty in the face.""",0
Fat fuckin tripple cheese burger eating face!,0
I didn't know Buzz could be any more a hero to me! I just wish you would have kicked him in the balls so hard that they would have returned from the moon baring witness the Buzz's footprints.,0
You have a great way with words dude. haha.,0
"Not a fan of when things end up becoming violent, but this is honestly one of those times when it was truly the last and best option. Well deserved punch in the face.",0
Cunts will cunt,0
Fuck that fat fuck. Nice work Buzz.... :),0
"Way to call it Bill.  You got it dead on.  Heck, just to strap a Saturn  V to your ass and light that candle takes bigger balls than anything else on earth.  That's about 800,000 horsepower.  Yeah...hang on!  Aldrin's punch was awesome.  That fat douche should be required to show everyone he meets that vid, so you know what kind of an idiot you're dealing with.",0
"I used to think this was the stupidest conspiracy theory ever. Then I became aware of ""flat earthers"".",0
"who gives a fuck if he went to the moon, there's proof he socked this cunt in the face and thats a far bigger achievement.",16
"That wasn't a right hook bill.
That was a straight right hand.
And not bad for an old stick.",0
"""I don't even know how he puts on his flight suit, the size of this guy's balls."" LMFAO",0
why have we never gone back?,1
"Lesson:  faked or not faked, don't fuck with the old guys",0
"The moon is fake, but Uranus is far too real.",0
"The only thing I don't like about this video is that Buzz DIDN'T HIT HIM HARD ENOUGH!!! Then, Buzz should have kicked him where his balls are SUPPOSED to be!! Slap the shit outta this dick head Buzz and send him home to his mommy!!!",0
Kudos to Buzz Aldrin,0
Pit bull mode...Bill Burr finally admits that pit bulls are predisposed to be a violent breed of dog. Love it!,0
the guy deserved it...good for Buzz..,0
I'd say Buzz was doing him a favor. He needed some sense knocked into him.,0
Awesome,0
Dr Buzz knocked the fuck outta that fat fuck,0
"Who cares if we didn't land on the moon. Do you have any idea of the technology that came from NASA?? I mean come on. Just the technology alone is worth it. Now there is a story of the CIA pitching an idea to Stanley Kubrick about faking it IF they couldn't do it, but who cares??",0
Good commentary dude!!! Shit was fucking great. Just to let people know there are Satalite pictures of the moon landing. Taken by a Japanese probe,1
"Bill burr is one funny cunt had me laughing through the hole thing ""that punch would have dropped me"" hahaha",0
The Russians always knew we didn't go to the moon. research the subject.,0
"Bill's comments here are spot on. This, for me, is the strongest argument against these conspiracy theories . The Apollo Missions were in the middle of the cold war and the Soviets were watching everything like hawks and no doubt had spies in NASA, just like they had spies in the Manhattan project to build the bomb in WWII.
If the moon landings had been fake the Soviets would have known and it would have been all over Pravda.
The funny thing about this jackass who was harassing Buzz Aldrin, is that he tried to sue Buzz for assault and the judge essentially told him to fuck off. That's the icing on the cake.",0
Nice one Buzz.,0
"Every moon-hoaxer deserves this fate....maybe we should honor Buzz and punch the nearest fat fuck, lunar-conspiracy moron so hard that his tin foil hat lands in his vegetarian chili.",1
this is probably one of the mot satisfying videos on YT...,0
should have stamped all over his head,0
All I read on more than half of these comments are people dick-riding.,0
What was that video about the shining at the end,0
"Conspiracy theorists generally have an inferiority complex. It's about being more intelligent than the other ""sheeple"". If they weren't dumb I guess they weren't conspiracy theorists to begin with.

You can look up just about any significant or major news event, and you'll find a moron who is trying to be smarter than others. Holocaust didn't happen, Titanic didn't sink, Elvis isn't dead, terrorist event X didn't happen...",0
"""What did it hurt"" How about the fact that they have taken BILLIONS AND BILLIONS OF DOLLARS. You really dont know shit do you Bill. You cant travel through the Van Allen Radiation Belts. Its impossible and that proves nobody landed on the moon.",0
he should be punched,0
"Like a boss,  nice one Buzz",0
wonderful stuff,0
What a fukin shot!!!!!,0
"umm what?
how did you come the conclusion of what the kgb had knowledge of?",0
Ha...your a coward a liar and a thuuuuuuuf!,0
win,0
Who is Bill Burr?,0
"Buzz Aldrin does his impression of Eddie Deezen like a bawse, motherf*cker!",0
That's the greatest fucking thing I've ever seen on YouTube.,0
