id,user,date,timestamp,commentText,likes,hasReplies,numberOfReplies,replies.id,replies.user,replies.date,replies.timestamp,replies.commentText,replies.likes
,,,,,,,,z12wxvyjbkf3ypslb23hgfdabx2pevz0t.1482191999400331,ttv0,4 months ago,1482781913749,"+The Big Bopper The space craft also had a bathroom, again, you stupid fuck",0
,,,,,,,,z12wxvyjbkf3ypslb23hgfdabx2pevz0t.1482303298917065,The Big Bopper,4 months ago,1482781913752,"+ttv0 do yourself a favor and go watch the press conference with the 3 men after their journey.  It is totally apparent that these men were not comfortable getting up in front of the media and lying their asses off.  They were actors, nothing more, nothing less, and they did a piss poor job of it.  They flubbed their lines numerous times and it was like they were at a funeral.  No joy, no happiness after the greatest journey of all time??  If that journey really did happen they would not have been able to control their excitement and their smiles would have lit up the room and they would have had super positive energy, but there was no hint of any excitement at all! Total and complete grade AAA steaming stinking monkey crap.  If you can't see it, you are blinded by your controlled mind",0
,,,,,,,,z12wxvyjbkf3ypslb23hgfdabx2pevz0t.1482306988588627,ttv0,4 months ago,1482781913755,"+The Big Bopper You just contradicted yourself, if they were actors why would they be uncomfortable? It's because they weren't you dipshit. It's not like they just got done with one of the greatest achievements in human history, gee I wonder why they'd be awkward in front of millions of people. It's not as if what they were saying would be an integral moment for decades to come. Why don't you think for once, I'm sure it may seem like a lot to ask, but use your head and think about what you're saying dumbass.",0
,,,,,,,,z12wxvyjbkf3ypslb23hgfdabx2pevz0t.1482478618644524,The Big Bopper,4 months ago,1482781913759,+ttv0 you can't fake the emotions that would go along with an expedition to the moon.  You wanna see contradictions? watch these guys contradict each other about the Van Allen radiation belts.  It's laughable.  You can't even see the truth when it is right in front of you.  NASA could get on CNN and hold a press conference telling the world that the Apollo missions were an elaborate hoax and people like you still would believe in your own little fairy tales. Are you aware that 6 out of the 7 people that were supposedly on the Challenger that blew up in 1986 are still alive?  Have you done any research at all about NASA's lies over the years??,0
,,,,,,,,z12wxvyjbkf3ypslb23hgfdabx2pevz0t.1482479851014842,ttv0,4 months ago,1482781913762,"+The Big Bopper An actor can't fake emotions? Are you fucking retarded? That's exactly what actors do. You dumb fuck. Where is your evidence on that? Because I can't find any. Nasa's official site states 7 died. Dipshit 
nasa.gov",0
z13gyzapkneoz3br404cfjvyszmbetkah2g,Wizard of Aus,9 months ago,1469562712804,Yay buzz,0,false,0,,,,,,
z123y5nbxnnze33oh04ced4rzkjlt1xbdjw,terry hollands,9 months ago,1469562712807,"Good for Buzz, that fat tub of sh*t insulting  Buzz  deserved a good beating.",0,false,0,,,,,,
z13vtfbqzy3pd3z1m23igjy5qwiuxtonj,cfytcf,9 months ago,1469562712811,Bill Burr is the kind of degenerate loser.. that Bill Burr would happily tear into.,0,false,0,,,,,,
z122ebwrkz3cifkrh04cfdjilnmacrrr2fg,getredytagetredy,9 months ago,1469562712813,Bill if you think that 1969 technology got humans to the moon ...AND BACK...especially from this murdering...thieving...lying  creature we call government and their media...I'd be surprised because you don't appear to be brainwashed or indoctrinated or programmed for stupid...,1,true,7,,,,,,
,,,,,,,,z122ebwrkz3cifkrh04cfdjilnmacrrr2fg.1469298322436143,Jimsta N,9 months ago,1469562713272,"You'd be surprised at what humans can do with a lot of money and smart people thrown into a big collaboration.

lol

In just 3 years during the ww2....do you understand how much shit got developed and progressed?  lol that's just 3 years the moment the world went ham.  All the years before that was nothing comprared.

Then you think about the internet.  Now days.....you can literally come up with unreal shit as long as you have the money.

Yes, we can technically just destroy the whole planet if we wanted to and reset earth.   It literally only cost 20-40billion and we could level this planet earth.  Hell we can even blow a hole so deep and so wide in the earth that we can cause our own volcano.  With less then 40 billion dollars.

That's just with the technology we currently have.  Even though we are all rich.....we don't have a whole country focusing on technology.  We have companies throwing in money for research and shit like that moves on.
You can't imagine the shit we could do if we focused on something.

Lets say viruses/bacteria.  We can throw in 20-50 billion dollars to develop a way to mass kill people across the globe near tropical areas or any dense populations.  Lol.  Like you have no fucking idea how easy it is to get things done with 20 - 50 billion $ +.

It's just insane in terms of research and engineering.  

You can do all sorts of crazy shit with biology. Like the mature/growth rate of virues. It's scary as fuckkkkkkkkkkkkkkkkkk


so yeah i do believe in science.  especially in engineering.  Energy is amazing o.o",0
,,,,,,,,z122ebwrkz3cifkrh04cfdjilnmacrrr2fg.1469345082121829,sey yed,9 months ago,1469562713275,ur a complete fool,0
,,,,,,,,z122ebwrkz3cifkrh04cfdjilnmacrrr2fg.1469350146779153,getredytagetredy,9 months ago,1469562713277,+Jimsta N I understand what you are saying...But the tech wasn't there...and its still not...The psychopaths who run this world with fiat currency cant even get to the bottom of the oceans for more than an hour... or feed the starving . or house the homeless in the economies that they flattened and destroyed for personal profit and gain...with their central banks of course...Their Zionist NWO has 170 central banks installed to control economies and keep the gullible enslaved...Whatever they release to the public as information is highly edited to suit their agenda's...BTW  they own mostly all media on the planet...They are the prince's of the air...They are so corrupted by power and greed and convinced that there are too many humans on the planet...which is nonsense...,0
,,,,,,,,z122ebwrkz3cifkrh04cfdjilnmacrrr2fg.1469353269988394,sey yed,9 months ago,1469562713279,+getredytagetredy dude shut the fuck up,0
,,,,,,,,z122ebwrkz3cifkrh04cfdjilnmacrrr2fg.1469357891917594,getredytagetredy,9 months ago,1469562713281,+sey yed...That's all you got?,0
,,,,,,,,z122ebwrkz3cifkrh04cfdjilnmacrrr2fg.1469365058860311,Jimsta N,9 months ago,1469562713283,"+getredytagetredy they this, they that.  blah blah. You're still talking about uneducated people who do not love science.

Business and politics has always been bigger then science. Science now days is less important then school funds to maintain our kids main.  To teach them common sense.

We spend more money on that then science.

It's business that wants to make a profit who invests money.  Scientists are there. The blue print to destroy the world is literally in Japan's blue prints but they dont have the funds.  They have the blue prints in case a war breaks out and that's when they will produce. The USA makes and updates instead(physically)

Do you get it?  We are so fucking smart cause we can do whatever the hell we want as long as we can gather the material and heads.

I dont give a fuck about your focus in politics(no offense)

you're balls fucking deep into politics and uneducated people.  Literally.  You're literally focusing on stupid as fuck people.  

However, those people that you are focusing on have the ability to increase budget for science.

Then you have to understand that back then.....benefits werent amazing.  What 500,000$ could do back then was AMAZING.

Now days 500,000 won't get any research done unless you have a lab already.  lol.

When you understand what it takes to move 10,000 lbs into the air...you kind of get the idea that in the end....it's ALLLL about energy and controlling energy.  It's all about efficiency and weight.

When you have 10,000's of people all focused into something like that...you WILL get it done.

It's that simple.

I dont care what country it is.  If you have a college in that country and experience.....you will be able to go to the moon. You just need money,

money.
Money.

Money.

Money.

lol.  I dont know shit about nasa or anything like that.

However, i do know a lot about rockets and the numbers behind it.  Nothing special just someone who loves rockets lol.

AND YES IT'S SO EASYYYYYY TO GET TO THE MOON.  ARE YOU KIDDING ME?

Im sitting here imaging 10,000 super nerds who are WAYYYY smarter then me going to town on one collaboration.

With one another testing eachothers ideas and arguing....you can imagine the millions of ideas being bounced back and forth by the month.  Each one being eliminated like fish.  You will get down to the final product that might be the BEST solution for a small problem out of the thousands.

hell it might take 1000 people to figure out how to design that chair, but you better understand that every gram of that chair was calculated.

lol please don't shit on scientists.  You can shit on all those politicians but do not talk crap or shit on people who actually understands things that we can BARELY comprehend.

Weather or not the moon landing was real.  It was 100% possible.

I can assure you that no matter what the fuck the case is...getting to the moon during that time was 100% possible.

The only thing i'm thinking about is how they got him the fuck back.

The thinking process behind all that and the calculations are so fucking intense.  It blows my tiny little mind when i think about it.

You have so many great minds going into one project.  It's like a super organism that will fucking kill anything physical or digital or anything.

Humans are fucking scary when you put them together into a collaboration. lol

I mean like i said....even if no human has been on the moon...we could have anyways.  The idea of getting someone to the moon is just so damn easy.  So so so so so so so so easy.

especially when you have some bad ass scientists stolen from the nazi's lol",0
,,,,,,,,z122ebwrkz3cifkrh04cfdjilnmacrrr2fg.1469372215040240,getredytagetredy,9 months ago,1469562713285,"Humans are scary because they have been victims of a culture of left brain enslavement...Computers have taken the man out of human. This culture is awash with violence , greed and evil and hate...If you really want to see what the human race and its scientists are  capable of ...
You would be starry eyed and blissed out when we operate from Love  instead of fear...Right now the world operates from a fear based regimented left brain idiom ..

.The ancients knew about being one to one with nature...They were capable of many things ,that our scientists today haven't a clue, because they were operating from a wholeness of right brain(feminine) and left brain(masculine) duality..

.They knew levitation. The Pyramids were not built by Egyptians , but  much older beings who knew how to soften granite with frequency sound...and levitate...

.I believe there are people around today that could provide the human race with free energy as Tesla tried to but was immediately marginalized by big money greed pigs...There are a certain group of people on the planet...





They are very rich , and got that way thru central bank fraud...If you care to find out how, There is a book called ""the creature from Jeykyl Island  by G.Edward Griffin, ...Its about how the Rothschild and Rockefeller bankers and their agents coerced , bribed and hijacked the printing of America's money..The ""Fed"" is not federal..it was a fraud from the start...

They print our money ,then sell it back to us as bonds at usury, Then out of thin air, deem that 9 times more valuable than it was a second ago...calling it fractional banking...then loaning that out at usury...and repeating this process for 104 years...

These people are the reason that there isn't free energy in the world ...where everyone would be prosperous and comfortable if they put in the effort...But bankers do 0 for the untold trillions they have cheated Americans and the world for..
.The talking points iv'e made here can be researched as facts with irrefutable evidence...This is only my perspective 2 cents, and everything is always subject to change...I am a musician, farmer, ironworker,artist, animal rights activist, vegan...And I try to do the right thing...How about you , my friend..?",0
z12pzzwoqqf3cpbdq22jdhagik23tbjou04,Panch Grinch,9 months ago,1469562712820,Buzz served him up a little sweet chin music,1,false,0,,,,,,
z12uglhghp3ahh0kn23bwpzzol3dexvzz04,Just Doit,9 months ago,1469562712823,Hats off to an 81 year old still slugging it out. He wasn't a test pilot in the days of just breaking the  sound barrier and ejector chairs by coincidence.The conspiracy theorist is not only the ultimate coward for antagonising an 81 year old but also of average IQ. The soviet union  would of tracked the flight to the moon and would of been the first to claim that it was a Hollywood stunt but never did. That in its self says enough.,1,false,0,,,,,,
z13cfn3bsnuhu5pwz04cjhkrxxvkwbmhiuw0k,JD H.,9 months ago,1469562712825,"Captain Aldrin has some of the biggest balls on the planet. That's been demonstrated long ago. Although I loved it when he punched that bibble-waving moron, I would much prefer we prevent the science-deniers from ever having children and passing on their ridiculous beliefs.",0,false,0,,,,,,
z121jragboebjtncp23sefjq1u2ssbich,NaturallyNathalie2,9 months ago,1469562712829,Right hook.,0,false,0,,,,,,
z12oxnwggw2rtn3ub23lgdwozpuqdfwp004,cloudtoground,9 months ago,1469562712832,that creepo should be arrested.  It a shame Aldrin didn't have a gun on him.,0,false,0,,,,,,
z13yhrzbtyvjip0cg22hh3jaqtidcf13r,Janta Janardhan,9 months ago,1469562712834,How come no one's pointing out the fact that this dude is making money through YouTube ads off a podcast that's been released for free?,0,false,0,,,,,,
z12dexxbcmmjhdexf04cepxhepuftvqa3n00k,shafta99,9 months ago,1469562712837,"if buzz was ten years younger he would've totally kicked this creampuffs ass and drug him through the street. he was a badass back then and still one, even in his eighties. would this coward that was insulting him even have the guts to sit on top of a rocket that could blow up and kill you, go through the launch into space and land on the moon?! he would shit his pants at the thought of it. good for buzz for drilling this loser, he said leave me alone and still kept it up, thinking he could pick on an old man. he thought wrong.",0,false,0,,,,,,
z133stbwuuyzjjzwk04ch32i4uevyzlizp40k,13lood13ath,9 months ago,1469562712840,Go to 5:11 in this video - https://www.youtube.com/watch?v=zPhCYkaTvS0,0,false,0,,,,,,
z13jxlk5vo3ygn2zc04chnizbwaydbux4hc,Lucky C,9 months ago,1469562712843,call a man a coward be prepared to fight.,0,false,0,,,,,,
z12ctt0zozf0tvgly232svqgnp2zvlao104,Pagansdad,9 months ago,1469562712846,He gave that aggravating bastard every chance in the world to walk away.  Got what he deserved says me.,95,true,6,,,,,,
,,,,,,,,z12ctt0zozf0tvgly232svqgnp2zvlao104.1469359575573756,jon122569,9 months ago,1469562713195,I agree a thousand percent. Hats off to the hero buzz!!,2
,,,,,,,,z12ctt0zozf0tvgly232svqgnp2zvlao104.1469378624065989,Rökkvi Vésteinsson,9 months ago,1469562713197,"Yeah. You can only harass a person so much like that, yell at them, get in their personal space, ignore them when they tell you to get away and leave you alone, before they are in their right to physically hit you.",10
,,,,,,,,z12ctt0zozf0tvgly232svqgnp2zvlao104.1469379250348116,jon122569,9 months ago,1469562713200,I wish I had a punch like buzzes. The guy can handle himself.,1
,,,,,,,,z12ctt0zozf0tvgly232svqgnp2zvlao104.1469427199745447,noodle knight,9 months ago,1469562713202,Couldn't agree more,0
,,,,,,,,z12ctt0zozf0tvgly232svqgnp2zvlao104.1469570483421067,rcrnitto,9 months ago,1469562713205,"don't mess with vets, or you'll get what you deserve.",4
,,,,,,,,z12ctt0zozf0tvgly232svqgnp2zvlao104.1471544774374898,Solomon Anczarski,8 months ago,1472241113207,"I agree, and so did the police who sided with Buzz and didn't press charges.",6
z12xg3giqynaw5xcs22oulihazbzy5cbh04,Marshall Smith™,9 months ago,1469562714930,Everybody knows Buzz and Woody went to the moon in that space rocket driven by a horse...,0,false,0,,,,,,
z13uubprjnvayhbwu04cdbcootysj50gekk0k,MrJohnm1965,9 months ago,1469562714933,dont mess with buzz!,0,false,0,,,,,,
z13etvqjzqm2tbln5224zvpxgvmfwbnog04,Row Hill,9 months ago,1469562714936,Hahaha great great great. I love it.,0,false,0,,,,,,
z12lwzhbno35vlqdh23sgpq4lxepdl5ht04,brettfavreify,9 months ago,1469562714940,"If the gov concocted a conspiracy, what was the rationale behind Apollo 13? Wouldn't all the missions have been successful?
Hell, we'll make a pit stop at Mars.",6,true,9,,,,,,
,,,,,,,,z12lwzhbno35vlqdh23sgpq4lxepdl5ht04.1469288367560683,Tony From Syracuse,9 months ago,1469562715459,actually thats a good point.,1
,,,,,,,,z12lwzhbno35vlqdh23sgpq4lxepdl5ht04.1469294296712537,Illumi Notme,9 months ago,1469562715462,"The argument is that america was completely disillusioned and disinterested with the apollo program.  Manufacture a crisis to garner sympathy and attention.  If this is what happened, it clearly worked.",0
,,,,,,,,z12lwzhbno35vlqdh23sgpq4lxepdl5ht04.1469319238627984,Welshwizardtruther,9 months ago,1469562715465,Apollo 13 a hoax....most news events are hoaxes except local ones...,0
,,,,,,,,z12lwzhbno35vlqdh23sgpq4lxepdl5ht04.1469320696397097,Illumi Notme,9 months ago,1469562715467,"So what's the deal with Bill speaking out against the big banks, dropping the Rothschild name on national tv as well as saying Hillary's going to Bilderberg and probably sacrificing a goat before she fronts like she shares common ground with plow truck drivers, but then defending this freemasonic piece of shit?  I'm not the biggest Bart Sibrel fan, but all 3 apollo 11 astronot's reaction's to him and others is extremely telling.",0
,,,,,,,,z12lwzhbno35vlqdh23sgpq4lxepdl5ht04.1469344173442682,sey yed,9 months ago,1469562715470,ur a retard welshwizard,0
,,,,,,,,z12lwzhbno35vlqdh23sgpq4lxepdl5ht04.1469384168395106,EPLURiBusUNUM,9 months ago,1469562715472,That's the kind of thing I'd expect someone to say if they lived their lives inside of a fucking basement.,0
,,,,,,,,z12lwzhbno35vlqdh23sgpq4lxepdl5ht04.1469843592694711,brettfavreify,8 months ago,1472241115475,"America was disillusioned with Vietnam, the assassinations, racial injustice, cities burning, Chicago, the counterculture, maybe even the Colts losing to the Jets. The Apollo program was the single rallying point for all.",0
,,,,,,,,z12lwzhbno35vlqdh23sgpq4lxepdl5ht04.1469844462743482,Illumi Notme,8 months ago,1472241115477,Plus there were those CCCP dudes we weren't exactly super tight with at the time...,0
,,,,,,,,z12lwzhbno35vlqdh23sgpq4lxepdl5ht04.1470095915107488,Diego Augusto,8 months ago,1472241115480,"Hammer, meet nail.",0
z12fflq5nzj1e5vxc04cdbvqoqqlepzoqyk0k,mistanix,9 months ago,1469562714944,all the astronauts suffered bone loss from the zero gee's - buzz could have broken every bone in his hand and still laid out the fucker,0,false,0,,,,,,
z12wepg45ozlzvfuc22kenep4lmsixhf2,Josh Matthews,9 months ago,1469562714947,"You talk shit and call people a coward, you better be prepared to get punched in the mouth. Fact of life that the fat dude didn't seem to realize...",3,false,0,,,,,,
z13xu1pjqqicgvtcj22bfpp4woqfivnum,Andre Campbell,9 months ago,1469562714951,Good for Buzz.,0,false,0,,,,,,
z12ay54ykpazhporz04chdqwbkvusp2w0e0,Richard Kardos,9 months ago,1469562714953,street justice. got what he deserved. The beauty of being someone like Buzz Aldrin is how many people did he motivate and inspire to do dream and do something with their lives? We don't need anymore of these dough boys just trying to make a name for themselves off of the names of others who have achieved.,0,false,0,,,,,,
z12mx3mrrxulcn44304cffmhcyfvyxdpgkc0k,Cheezeburger Walrus,9 months ago,1469562714956,"That asshole got what he deserved. Actually he deserved a couple more shots to the dome, but unlike that piece of shit Buzz has class. Buzz is the definition of a hero.",0,false,0,,,,,,
z12ac5trroatzlbed23birfwqzmavjmhv04,bushbaby 1,9 months ago,1469562714960,"God bless Aldrin, wish he had had a combination left in him , a sweet left hook following the crisp right cross dropping the piece of shit would have been too sweet.",0,false,0,,,,,,
z12cydzjbpuus1zdk22izdypsqj5w3vtd,Albert Clark,9 months ago,1469562714963,"In Canada we can these types of people bags of milk People think they can just harass and antagonize others  with no repercussions. Good for Buzz, way to fuck up that dumb ass bag of milk.",1,false,0,,,,,,
z12hgxyoknnawpnkz23wdhyjkx31dfnvo,James Passmore,9 months ago,1469562714966,The guy is a fucking taxi driver.,0,false,0,,,,,,
z12awpsrprytjhqfi23ni3vgolf2wlvhz04,James Richardson,9 months ago,1469562714969,Salute that man! Shoot fucko in the knees!,0,false,0,,,,,,
z13df5nwqryzjlyyp04cjjyh2ne4inv4zcs,Wiseguy,9 months ago,1469562714972,Beautiful!  Too bad there's no video of him afterwards crying at Dunkin Donuts stuffing his fat face with jelly donuts,0,false,0,,,,,,
z12ozjh5gqrtipwtm22lwhgoxpfvfhszd04,John Doe,9 months ago,1469562714975,The moon landings were obviously faked.,0,false,0,,,,,,
z131if5aqx2mdviav04cih2j4pmovhor5hg,Hallowell Carew,9 months ago,1469562714977,"""Soft serve ice cream eatin' Fag"" ..... fucking legendary insult!",0,false,0,,,,,,
z12aspzijubczbv4n04cjb5iqxvowls5vgg,Red Bart,9 months ago,1469562714981,What's better than a video about some obnoxious pos getting punched by Buzz Aldrin? A video about some obnoxious pos getting punched by Buzz Aldrin and narrated by Bill Burr. That's what.,0,false,0,,,,,,
z13nvh4zlpemexnvc231trwb3s34hhyx504,Jay Fraser,9 months ago,1469562714983,Much respect to Buzz. This clip had a happy ending :-),0,false,0,,,,,,
z13msxbq2wi1dhprl04cd1rwum2rxr352aw,Marko Franić,9 months ago,1469562714986,one punch  artist :),0,false,0,,,,,,
z12vwjsr4zvntfdyw04cffazpw32zbgopws0k,quacka 1003,9 months ago,1469562714989,Allenpalin Did you ever think that the reason Aldrin punched the guy was because he didn't like hearing the truth?  Calling the guy names because he called him out over false claims.Show me your proof that he landed if you're so positive he did! Amazing it was never done again after all the advancements in technology yet nada!!,0,false,0,,,,,,
z13tcfgb5qv4v3r0q22utrxj0srtv55ja04,quacka 1003,9 months ago,1469562716244,Whoever believes that buzz or anybody else walked on the moon with that shitty video thats been shown to the world must be crazy! Don't you people ever question why it hasn't been done again with all the advancements in technology?  !!!,0,false,0,,,,,,
z13ijxa5loz2zlm3w230grrxfpfrsnsog04,Doc Holliday,9 months ago,1469562716248,They should line up all the flat earthers an let buzz aldrin punch them in the face one by one,0,false,0,,,,,,
z12th3xynpzjz3rkh224hl2jltymg5uye04,Toza,9 months ago,1469562716252,"I've heard about this but never thought it ever happened. Well, I can only say..Buzz Aldrin threw a cracking punch! Would have loved to see him follow up with a left then a kick to the head. Although I know he wouldn't, too much of a gentleman. Best thing I've seen all day! Good on Buzz!",0,false,0,,,,,,
z12dhnjjgnadibn3122jvjl4ftfntfdoq04,Hitlery Rotten Crackhead,9 months ago,1469562716255,hahahaahha Punching a Fatty in the Face...,0,false,0,,,,,,
z13xczqoxmimjlhaz04cf3tz4yicfxr4u44,Joshua Mirabella,9 months ago,1469562716259,"""your a coward and a liar and a THOOF"" so satisfying... that dudes whole word just shattered around him as Buzz landed that  hook...",0,true,3,,,,,,
,,,,,,,,z13xczqoxmimjlhaz04cf3tz4yicfxr4u44.1469267111227671,style002323,9 months ago,1469562717930,the shot heard round the world,1
,,,,,,,,z13xczqoxmimjlhaz04cf3tz4yicfxr4u44.1469430722165640,albarino gold,9 months ago,1469562717932,"it's ""you're a coward and a liar....""  like for example, there's a difference between your shit and you're shit, but then in your case there might not be.",0
,,,,,,,,z13xczqoxmimjlhaz04cf3tz4yicfxr4u44.1469437430639334,Joshua Mirabella,9 months ago,1469562717934,+albarino gold yupp. Shit happens. Move along troll.. I dont care.,0
z12ferr4jvi2z1yfb23rexgbuyftibbpw04,lentmain,9 months ago,1469562716264,"This is typical for A--holes with cameras...  I was hoping he would have killed him...  It would teach his mother to have another a--hole like him...   Good job, Buzz.....",0,false,0,,,,,,
z13pibapuwqeujfjn04civ4bmpifcd3qhb4,sdry,9 months ago,1469562716267,Buzz is a bad ass. Check out the Ali G interviewing him.,0,false,0,,,,,,
z13rx5laspzttrccv23ojbwolqz5dt2aj04,Rick Charles,9 months ago,1469562716272,"Wish I had been there. Would have loved to beat hell out of the chicken-shit calling him a liar. Wasn't there anyone else around to pound on the guy? You could have at least hit him with your camera and knocked out a few teeth.
Where was this at? Somebody needs to find that lard-ass, rip off his head and shit down his throat.",0,false,0,,,,,,
z134h5xhrx2ozh3do23synkb2wzjy15uy,Joe King,9 months ago,1469562716276,"""All quarter-pounder w/ cheese though,""
10/10 I am stealing this",0,false,0,,,,,,
