commentText,likes
"What if they did lie  and all they actually caught  on  film  was Buzz Aldrin bouncing around on a shitload  of Styrofoam and cotton balls   in the same Hollywood studio  they filmed ""When Mars Attacks""?  Stop asking what and start asking yourself why? I think they faked it for America's own good. To give us hope, to boost our spirit.  We just lost the race to the moon. We were feeling like losers. Russia beat us to the moon and kept throwing it in our faces, and made sure we knew that we where fucking failures.",0
"There's one clear fact that moon conspiracy theorists forget about the moon landing is the signal.  America couldn't receive the signal directly, they needed it relayed from the southern hemisphere.  So in fact Australia had the signal before America did. A signal that in any basic science class shows can't be manipulated without showing evidence of manipulation.",0
Don't we all want to punch that guy?,0
Buzz lightyear handled himself well for 80.,1
soft serve ice cream eating fag,0
nice shot buzz,0
"Good man u are Buzz, he deserved it.",0
"soft serve ice cream eating fag. 

what an awesome insult hahaha.",8
So Buzz is 80 years old. Wondering why not use that wisdom and lay your hand on the bible and swear. So the guy bothering him would walk away. Why wont he do that? Not religious or he haven't been?,0
I mean who does that???,0
Buzz Aldrin is a war hero?,0
Old man strength ain't nuttin' ta fuck wit.,0
Props for punching a fatty in the face! :D,1
He's like the old batman from the dark knight returns,0
come on bill i like softserve,0
"Actually the room was called 237 because it only went up to 217 and the owners were afraid that people wouldn't stay in that room (it was actually 217 in the novel I believe), the change was merely coincidental. Plus, if you look at Kubricks other movies it's hard not for the guy to drop a few nods to them.",0
Video is 4:20. Coincidence?,0
"Lmao xD you should take your meds pal, because you're just ranting and babbling. Are you trying to be unbiased?...no? Thought not, you're just cutting the vid for your own untruthful agenda....creating a YouTube channel

SUCKER PUNCHED Bart Sibrel because he was embarrassed....a ""god fearing man"" who WON'T swear on the bible!? An We're supposed to believe him..!? I notice you haven't used the footage of these astronauts running away from a bible!! Also in ""A Funny Thing Happened On The Way To The Moon"", there is NASA FOOTAGE of the astronauts faking shots, supposedly half way to moon and showing earth.... But go ahead and ridicule him for believing hard facts and  evidence, over a lying actornaut that won't swear on the bible....you know like they do in a court of law? (Thus giving credence to his story) Moon rock they ""brought back"" was also fake.",1
God bless America,0
"might not have landed on the moon but he sure as hell landed on that guys face bu-dum-tchi


...I'm here all night, dont forget to tip the waiter, thank you, thank you!",0
"""Nothing beats an astronaut""",0
"Don't fuck with old dudes, man. They have the most life experience. They'll knock your ass out lol.",0
3:11 i swear i almost choked on my food,0
Left right good night,0
Buzz should get a medal for this.,0
This is what 'Merica has to do to all their SJWs.,0
Buzz is an actual national hero and American legend! What disrespect..,0
well said,0
I like how he's not afraid to call him a fag and fatty to the chagrin of all the sjw cunts.,0
Gotta Love Buzz for this.  Where is this guy today?,0
"Running your mouth one minute, and the next, YOU'RE on the fucking moon. Nice right hook Buzz! (I noticed he kept that folder in his left hand the whole time. You know, just in case.)",0
"""soft serv eatin' fag"" is my new favorite insult.",0
Buzz Aldrin: like a bawss.,0
good one buzz. after the punch that guy thought he landed on the stars.,0
"Why didn't Buzz just do what the guy said, and put his hand on the Bible and swear he walked on the Moon?
Why? Because some people don't permit obnoxious wannabees to set the terms .",0
"Moon landing conspirators man, get a fucking life.
I love that punch so much.
pow! Right in the kisser!",0
I kinda wish the guy who walked on the moon punched ME in the face.... ðŸ˜ª,0
Ol' Billy Reddish Cunt Face could narrate grocery shopping and I'd be funny! lmao,0
this is the kind of guy that believes the earth is flat ...,0
"lmao what a jerk, get out of here dumby picking on an old man, that's what you get",0
fuck that fat prick. Buzz aldrin shouldve spit in his face,0
The sack on that guy. Legend.,0
"""Swear on the bible"" ðŸ˜… Buzz is an Atheist. 

Great hook on the old guy!",0
"whats not to get??  they needed a  powerful propaganda tool at the time

http://www.lifecoachcode.com/2016/05/28/bassist-confronted-buzz-aldrin-faking-moon-landing/",0
"Since we are talking conspiracies and such, I couldn't help but notice that this isn't your only video with a 4:20 length. 
Coincidence?",0
Moon landing hoaxers are the dumbest people on the planet.,0
"Why don't you just show the video where he punches a guy, we're not really interested in all the other useless crap",0
"who the fuck is this whinny cunt pissing and moaning on this video, you tottal fuknut.",0
Buzz is the man.,0
tom cruise and a whale landed on the moon,0
Mr Aldrin in fact did not land on the moon and he should admit it before he dies,0
"If you can't tell why he got mad, then you'll never know anything about reality. We are entering an age of awakening. It's going to be exciting!",0
"You are owned by Satan's DEED owe-cult until YOU decide to walk away from the mark of the beast I.D.ol worship of self called legal name I.D.entity...I.D.s a demon entity contract...to bind the fallen...only the innocent will remove that and leave the Baby-loan empire of Satan's legal relion Ba'al owe-cult blood eating and sacrifice of life to de-vow-her-I.D...be QUIET and list 10!...Matthew..the mark...look John the ACTS of the Romans....for those with eyes and a heart of life only..welcome to the storm of truth.WAKE UP!!!!.......Satan drains life from your souls since you worship the robed/uniformed demons as kings and queens and are owned by the CROWN of Satan's CITY OF LONDON, LONDON, inside London, England...Satan ate I.D.s-elf = you..you are the A-liens fools...last warning......hear me now or fall forever....10 commandments pure....do that for God....or waste the price paid to redeem you forever...you're married?..fornicating at all?....you commit acts of adult-tree where Jesus said ye must be as children.....Fornication is forbidden for children in all realities.....adult-tree = sex with another child of God you think is an adult but is really a 5 year old child on average spiritually...Follow only the ten commandments and get out of the Ba'al Babyloan temples like Jesus taught and the robed demons of Ba'al you call church deceived you...again...Just a reminder for those worshiping the mark of the beast legal name thinking I.D.s them and serving in Satan's cult against us getting the word out?.....Sins you love your I.D.ols of your sell-fees so much....hell is going to be helled over for part III forever....enjoy the show....apparently I.D.s a hot weekend at Burn-knees...'neath the skin and in two the plasmara with the RFID or the quick guy low teen heir cut...navy sty-hell...short back and cides...just above the shouldn't haves.... enjoy the guillotines....thinking they're saved because a robed demon owe-cult monk guy tells them exactly the opposite of what Jesus taught while they party I.D. down in Babylon..If you claim to follow the laws of God and not Satan's legal blasphemy then repent of the I.D.ol worship or fall..forget the stoop-I.D. de-baits....DEED figs. and num. skulls of the I.D.yacht three tree stay here...always too ripe fo a fight or a fuck...never mature into being grown up swinging around committing acts of adult-tree when Jesus told you ye must be as children...seems you like k-I.D.-die porn tomb much...it's spelled krist....you worship the english french roman c-ash-wrist....h is ash in french...the maze-sonic dazzled you in sound spells upside down and backwards....only smart people can see that and a heart to serve all humanity, not just yer own blood soaked flag breeds of the cult of Ape-Ra-Ham the fallen...he needed a whore to breed remember?...after T-ruth was made B.A.R.wren...ignore truth as you will and go back to your parish semen-ares roman gods of money....legal religion in roman lusciferian bait and switch game...you bought I.D....you got I.D. made alright...a date with a FEMA camp for an RFID perma demon legal name insert or the only escape left to remove the I.D.ols head sins you kept the paper dolly...the meat dolly heir cut...you are the non believers and will be leaving...left behind...why?...idol worship and committing acts of adult-tree...children don't have sex and get married and have babies...you did...the allegory for you all?.....you left your families and children to die while you ran off seeking your true god, money....a mother and father that would place their children in another's hands or separately from both are murderers.....10 commandment verified...Satan's legal cult will spin the sob story....S.O.B. story lies...I know the true repentant and the fools that cry wolf at a broken finger nail and take it to satan's court...me cry?..yeah me too...used to but then you won't list 10, you never did, you D.I.E.D....watching so many of you lost in the legal death camp wilderness of sell-fee I.D.ol warship ink..the we-upon of truth for when the robed uniformed armed thugs come a knocking....it's illegal to use a legal name = express trip to the guillotines sins you won't stop lusting in the money harlot legal religion game.....cut the I.D.ols head off and simply know that legal fact now, saves the pay in fool heir cut later...your pyr-I.D.e owns you..nope...you never introduced the twins of revelation to anyone...matthew 25...you buried the bag Our Father gave US to give humanity....here's a last one for you.. if you ever did any research beyond what the past-whores force fed you...seagull's and l'eagles will swallow everything...DEED Row-man burneds....we tried to reason with you....you spat in our space, the twins......still time but let's say....Our Father is not happy you all worship the mark of the beast legal name and shortly, neither will you sins you love I.D. so much....go ahead....scoff...please.....my tears are gone now....We tried...forever...don't let the train roll by...that's my wedding train...you ask, I answer, you ignore and continue in the robed monkey scrypts of the Ba'al Satanic church that has you worshiping Lucifer making you believe you serve God and truth....Jesus taught everyone what to pray and still they prey on Jesus....fools...Our Father...who art in heaven....etc......one prayer and one prayer only...the robed maggots of the sin Og MaGog churches teach the demon spellssss to drain the blood of life...Satan's cult of the legal stole your gold 10 fleece when you were born...you KNOW the gold 10 fleece rules so...here's why...Being ignorant of a fact isn't a crime......remaining ignorant of a fact once told is willful ignorance where two facts become crystal clear....let me, Je Suis K.R,isT. all here clearing the weigh for you but you run back in two the arms of Satan every thyme... 1. the fact that you don't know it's illegal to use a legal name that, in fact, makes you a criminal is a legal fact and.... 2. You're too lazy, arrogant, stupid, criminal, lustful, angry, spite filled, hateful etc. to bother to check.....google legal name fraud you get to pick one fact of those 2....which one stoop-I.D.? that should scare you enough........there is no longer time to be gentle...you are damned to hell if you miss this....period deuteronomy 16:22 22 Neither shalt thou set thee up any image; which the LORD thy God hateth. If you think this is a joke....then are you willing to bet your soul without even looking?...you already did did...It's illegal to use a legal name....a legal proven, tested and verified absolute fact in all legal and lawful terms...fact.........but you....?......YOU will doubt that......and why is that you will ask?...because you are a doubter of God, truth and a daughter of man, the fallen cult.....where I AM the daughter and son twins of God and we doubt all men as well we should except for those that didn't doubt my word as abeing true where to claim otherwise is simply you calling me a liar where I was there as the witness living the experience with others while you sat in your lazy buoy DEED armchair quarter-backing the cult you're part of and will worship until damned eternally as you are now and for real, momentarily...what's a day, a month, a year in any context?...limited time and for me?....thyme ran out for man....save the precious few that took me at my word and went to see for themselves because they had and have a heart of courage, the only true sign of a heavenly child...and the very few of us banned-I.D. together and watched Satan and his armed thieves you call cops run while all they had and have left is their media Thules and well, humans are starting to see that they've been lying to them all along to keep them distracted like unique-horns in the rain tooting their own I.D.ols of fame and fortune while worshiping other man I.D.ols as their man-gods to lead them and tell them what to do.... You're master, Satan, taught you to kill and rape others for their goodies as you climb the mountain of doom to be asshole-she-ate-dead with the ones that make their money most when humans are killing each other in droves paying for Satan's sins with their signs and contracts of continuing the same think generation after generation while no-one bothered to remember the law...the 10 commandments, calm and meants are the law.....Satan's Sharia law Muslim legal cult that unifies the jew/christian/muslim and other cults into one religion that rules them and their Harlot god is moon I worship....the false silver and gold of the dead moon, ripped from the heart of the earth and the golden fireball on it's last legs of fire ready to die as well since we cut off Satan's blood supply with a JANE DOE-755 legal heart buy-pass shunt ink of the death....No, the BBC, CNN et al won't tell you this but they'll bring one of the legal lawyer cultists in to ask and of course the liar lawyer is gonna bullshit but you, the fool who trusts liars to speak for you, will fall for I.D. out of fear of life and the knowing that you truly are a son of man doubter of God....the mirror for the boys?...you get to be a daughter of Satan....1 boy, the rest are his bitches...he eats you eternally and he's perma-horny so don't expect him or his horny devils to let up....it's illegal to worship Satan...even Satan himself knows that....he's just banking on you calling me a liar without checking my story out first....go ahead....you're fucked either weigh atm you just might want to con S.I.D. her how is awl......go ahead...doubt me....dare ya......forever, kate",0
That was a nice solid right hook as well. Not bad at all for a man in his eighties.,0
Love the way his assistant just walks away right before the punch.  She could see what was coming and wanted to get out of the way.,0
funny af narration,0
"Never mind his psychotic conspiracy theory, guy deserved the hit either way. He was harassing Buzz Aldrin. You follow someone in that way and you are crossing a boundary.",0
"That Pizza Face fatso is stalking an Astronaut and calling him a liar, a coward and also invading his space, blocking his exit from the insults...So take this...Well done Buzz..",0
Owning a pit bull is an ego on a leash Bill. Fucken horrible things.,0
NASA can't leave earth orbit cause we are living in a computer simulation,0
"2:06 wow, never heard Bill Burr call somebody a fag before.",0
Buzzzzzzzzzzzzzzzzzzzzzzzzzzzzzzzzzzzzzzzzzzzzzzzzzzzzzzzzzzzzzzzzzzzzzzzzzzzzzzzzzzzzzzzz Aldrin....,0
"""Soft serve eating asking fag"" genius",0
Buzz aldrin is a fraud - no man has never been to the moon,0
"Asking people if they believe the moon landing was fake is a great way to weed out the wackos in your life.  China & Russia can't disprove the moon landing, but your idiot neighbor Ned watched a few YouTube vids and knows the truth...",0
"Ahaha, what happened with my friend there, is that we bet that him couldn't make Buzz Aldrin punch in the face, even if he wanted to, so he came up with this. that guy is crazy",0
"""this guy outweighed him by 150 fuckin pounds, all quarter-pounder with cheese though"" classic!!! hahahaha",0
Why to Buzz YOU STUDD!,0
"If you think you can get Buz to admit he didn't go to the moon then your a waste of a journalist. that man dosnt have any more controle over his space flight then than an actor dose in a blockbuster film. 

I don't think we went to the moon. if you look into it even a little you will find its a hoax. the KGB dose know it was a fake 40 percent of Russian civilians don't believe it.",0
Loved it,0
I saw the moon and now you're gonna see stars!,0
"Never harass the man that is historically known as the second man on the moon. He is salty enough, already.",0
Bravo Buzz Aldrin.  That whiny fat fuck deserved a punch in the face.,0
"Stanley Cubric, Why did you put a bunch of bullshit conspiracy theories in your films and when there is a real one u put on ""eyes wide shut"" they go ahead and off you, silly you playing with those forces.",0
"Idk man. I think that punch was staged, there's no way the lighting would be like that naturally",0
"""Fuckin' soft serve ice cream eatin' fag"" is one of the most HILARIOUS things I've heard in a while. And I'm gay.",0
"What really kills me is how she just walks away, like ""eh, I tried to stop him""",0
Buzz Aldrin is my fucking hero,0
"Best.  Commentary.  Ever.  Love the KGB observation.  And yeah, Buzz's got a wicked right.",0
"Also, I have to say I love this how you've taken audio and brought it to life with video clips. It appears so seamless like this was always a documentary that existed. Fantastic work, just sublime. Subscribed!",0
"My take on it all is thus. The Russians had spies all over the US and it seems highly unlikely they would have ignored NASA. So if we assume that they had spies worked into NASA and by spies I mean people who already had the required skills for the job they would be going to and were placed there for decades, not just a quick spy mission. 

With that kind of access, the Russians would have had a field day ruining the US's reputation around the world that they had to fake a moon landing while Russia was successfully sending manned missions to space.

And to think even if they had pulled off the greatest hoax of all time, at some point in the future, maybe a near future, no one knew, the first real mission to the Moon would have shown there was no evidence of them ever being there. Of course with hindsight we know that funding for this kind of thing dried up after the cold war died down and there's never been a moon landing since but back then it was assumed we'd have a base up on the Moon before long.",0
I love the commentary by Bill Burr and I will never get enough of that fat sack of crap getting punched in the face.,0
Well done Buzz.  :-),0
was that fat piece of shit that Buzz punched... should've stomp his fatass out,0
Mother Teresa just got sainted but @allenpalin is still grinding away in the YouTube ghetto delivering the grace of god to all his children.,0
You go Buzz!!!,0
punchin a fatty in the face lmfao,0
Who are you you filthyÂ  mouth piece of dump you and buzz where probably lying in bed together smoking cigarettes then he stuck it in your moon a$$ and you yelling Apollo trash,0
he is a fucking liar,0
Buzz is the fuckin man! Right there Fred!,0
I only wish that Jessica alba would hit me in the face with her naked FANTASTIC pooper. who is with me on that thought?,0
"19.5 TRILLION in debt, sigh",0
kubrick filmed the apollo movie that was broadcast as news! at least that's the conspiracy. we prob really did it but it wasn't presentable for tv,0
Buzz Aldrin: True american hero and boss,1
"You're a coward, and a liar, and a thuuuueeeef",0
"The fake landing was as much about intimidating US citizens as anything else. The ones who know they're property, not the ones who think the government belongs to them while it rapes them.",0
"""all quarter pound n cheese tho""",0
Talk shit Get hit!!!,0
"A Coward, a Liar, and a The-HEEF",0
buzz is a liar and bill go fuck yourself,1
But I love eating soft serve ice cream ðŸ˜¢,0
Billions on top of billions of dollars was dumped into the moon program.,0
"If anyone wants to help Allen get some well deserved recognition for his awesome Bill Burr videos please email Bill Burr so he knows about these videos, and hopefully, calls him out on the podcast!
Send your emails to both bill@themmpodcast.com and http://www.billburr.com/contact and don't forget to use his screen name allenpalin, click like on this comment if your going to email and subscribe to Allen's channel and like his videos!!!
Thanks guys!",0
"Finally, at 3:21 we get to see what he had to wait for so long: the punch. I can just imagine Aldrin saying, ""That's one small punch for Man, one giant punch for Mankind"";)",0
analsex?,0
"Hell yeah ,right on Buzz! There's only so much of that big mouth you should take. And Snoop Dog would be proud of ya.",0
im glad people are finally noticing the comic god bill burr,0
the narrator is fuckin funny because he talks like me. ðŸ™‹,0
Buzz should have punched Sibrel multiple times just like how Jackie Chan punched a villain in police story 1986.,0
One punch aint enough!!!!,0
"Dude, I got a gay friend who said I'm the straightest guy he's ever known.Â  I'm straight as hell.Â  But knowing what I know about Buzz, and what I just saw, is it wrong that I have a testicle kringing man crush right about now?Â  hahahahahahahahaha",0
"good for you, Buzz! Maybe now that fat b astard will know when to leave someone alone.",0
"Bang, zoom, straight to the moon/",0
Hahaha Loved it! Go Buzz!!! ðŸš€,0
That had to feel amazing punching that asshole,0
SOOOOOO epic. Fuck that fucking douche bag. Buzz = legend.,0
"it did hurt people, it hurt everyone, becauze its just one lie on top of a mountain of them. They lie about everything. its all a big fucking lie.  But it will be revealed. Grissom killed to keep the secret. 9/11 another lie. 3000 people killed in a coup. its so fucked up!",0
Fucking soft serve ice cream eating fag.,0
"While it was handy, AGC wasnâ€™t particularly powerful having 64Kbyte of memory and operating at 0.043MHz. In fact, it was less equipped than a modern toaster!

the technology of a modern day toaster was guiding that through deadly radiation and temperatures.....if they went 50 years ago with a toaster, why dont we have a research center up their today?? why haven't we been back?? its a huge friggin deal if they lied to the world about this, it shows they'll lie about anything

http://www.zmescience.com/research/technology/smartphone-power-compared-to-apollo-432/",0
"Why don't they think we went to the moon? Our technology back then was primitive by comparison (today), but it was good enough to get the job done. We were able to do it, because we leveraged our brains doing a lot of math and science to find ways to get what tools we had utilized to get the goal accomplished.

These are probably the same idiots that think precursor civilizations like Egyptians and Mayans needed aliens to help them erect massive pyramids, because they narrow-mindedly think that people in precursor civilizations couldn't have possibly have been smart or had any inkling of engineering or how simple machines work to magnify labor in such ways to move mountains.

Humans are smart. We always have been. There have been exceptionally gifted and bright individuals through-out all ages, and they helped create engineering marvels that others (that are either too stupid to learn complicated concepts, or unwilling to learn them) think aren't possible by humans. Just because one person can't fathom how to do something doesn't mean it's impossible. It means that person can't do it... but others possibly can.",0
Good job buzz!,0
"""Soft serve eating fag"" - that was funny",0
"What an absolute fucking ledge. Sir Buzz aldrin, fucking stud.",0
"That was a beautiful punch,old man can throw down",0
You're dope end comment,0
great form on that jab!,0
"I would call what Buzz did self defence.  This was harassment and verbal abuse by that dude.  At several points in the altercation Buzz had stated he wanted to be left alone. When someone gets in your face like that and you repeatedly tell them to back off and they don't, you should have the right to get physical with them. In my mind they are a potential threat to your physical being.  

I had been in a similar incident like that before.  Some stupid drunk dude off his meds wouldn't back off of me and was getting in my face. Kept telling him to back off and he wouldn't.  I even lit up a cigarette and kept backing away, but he kept inching closer yelling in my face with spit flying from his mouth.

When my cigarette was done I grabbed him by his jacket and threw him to the ground.  After that he backed off. Sometimes it's the only way. The bad thing is that I could have really hurt him and have to live with that along with other problems. I'm sure Buzz felt the same way after punching that dude.  People need to learn to back the fuck off when they are told to. If you get in someones face be prepared for the consequences. It never ends well. 

The lesson here kids is don't smoke.",0
