commentText,likes
"The earth is flat, we did not go to the moon. By now this should be common knowledge. Bill Burr knows this and has to promote globe earth.",0
Buzz Aldrin too fucking cool! Thanks Bill.,0
"Bill...CIAÂ Â  KGBÂ Â  MI6Â Â  FBIÂ Â  STASIÂ  Scotland YardÂ Â  InterpolÂ  all of these agencies are all ownedÂ  by globalist bankers...They own the governments that pay them....Get it ?Â  The Trillionaire BankersÂ  who own everythingÂ  and have for 250 years...They have central banks in every country on the planet but 3 or 4...Iceland...Cuba...N.KoreaÂ  andÂ  Iran...There were 7Â  butÂ  they invaded Afghanistan,Â  IraqÂ  and LibyaÂ  from their 911 eventÂ  to put a central bank in each....They control their economies so they can rape and plunder their resources ...They own the politicians ...Nothing is ever a coincidence ...It is always conspiredÂ  byÂ  Evil...It is all a richÂ  mansÂ  trickÂ  to get moreÂ  forÂ  themÂ Â  andÂ  lessÂ  for everyoneÂ  else...",1
I suppose he thinks the Earth is flat too.,0
oh my God everything he's talking about is f**** retarded the Russians that sitting out the people that's all the b***** that they f**** made up and he sitting there regurgitating it like the actual f**** story this is what angers me the most is a bill or whatever f*** his name is probably knows exactly what's going on but he's paid off so he sitting there pretending like he's a f**** idiot like he's using common logic sense and that all these things are actually just f**** retarded and it angers me so much Bill you are going to hell for this one,0
This narrator is the dummest person ive ever heard.,0
definitely a tub of shit!,0
"Buzz rotated his hips and came off that right rear foot, no doubt that guys jaw clacked hard and maybe broke a few teeth. Buzz is definitely an 81 year old Badass. I too would like to know the truth about the moon landing.",0
Bill are you f**** serious I'm not trying to be rude but pull your head out of the ass man. you talk all this s*** like you f**** know everything but you don't know what's going on behind the moon landing? I'm going to explain something to you right now it doesn't matter if it's real or fake it matters that it's affecting people's life and people like you who don't understand what's going on are the f**** problem. educate yourself better yet ill help educate you right now. the bible says the Earth is f**** flat and through prophecy things can be proven true thus proving the Bible true. now what's going on with the moon landing is if people are claiming they went to space and they went on the moon they can make the claim that we're in space and not on a flat plane that's the whole catch right there that's it that's all it is is to make the claim that the Bible is false by saying we're on a globe in space not on a flat plane. no I highly doubt someone like me who couldn't pass Grade 9 is smarter than you. no that's not the case so the reason is that you're purposely being ignorant or you're actually ignorant. I doubt somebody like you is actually that dumb or maybe you're just actually asking questions. but for me it already angers me that you actually made this video go educate yourself instead of trying to round up the people who don't know any better to get on your side. simply because of your status people are more likely to blindly follow you without any reasoning same goes for a f**** retard who puts on a lab coat says I'm a doctor take this pill. I definitely rambled and granted a lot here a lot of the probably doesn't make sense but for the most part I hope it does,0
Buzz did not like hearing the truth about his life of lies,0
Yay buzz,0
"Good for Buzz, that fat tub of sh*t insultingÂ  Buzz Â deserved a good beating.",0
Bill Burr is the kind of degenerate loser.. that Bill Burr would happily tear into.,0
Bill if you think that 1969 technology got humans to the moon ...AND BACK...especially from this murdering...thieving...lyingÂ  creature we call government and their media...I'd be surprised because you don't appear to be brainwashed or indoctrinated or programmed for stupid...,1
Buzz served him up a little sweet chin music,1
Hats off to anÂ 81 year old still slugging it out. He wasn't a test pilot in the days of just breaking theÂ  sound barrier and ejector chairs by coincidence.The conspiracy theorist is not only the ultimate coward for antagonising an 81 year old but also of average IQ. The soviet unionÂ  would of tracked the flight to the moon and would of been the first to claim that it was a Hollywood stunt but never did. That in its self says enough.,1
"Captain Aldrin has some of the biggest balls on the planet. That's been demonstrated long ago. Although I loved it when he punched that bibble-waving moron, I would much prefer we prevent the science-deniers from ever having children and passing on their ridiculous beliefs.",0
Right hook.,0
that creepo should be arrested.Â  It a shame Aldrin didn't have a gun on him.,0
How come no one's pointing out the fact that this dude is making money through YouTube ads off a podcast that's been released for free?,0
"if buzz was ten years younger he would've totally kicked this creampuffs ass and drug him through the street. he was a badass back then and still one, even in his eighties. would this coward that was insulting him even have the guts to sit on top of a rocket that could blow up and kill you, go through the launch into space and land on the moon?! he would shit his pants at the thought of it. good for buzz for drilling this loser, he said leave me alone and still kept it up, thinking he could pick on an old man. he thought wrong.",0
Go to 5:11 in this video - https://www.youtube.com/watch?v=zPhCYkaTvS0,0
call a man a coward be prepared to fight.,0
He gave that aggravating bastard every chance in the world to walk away.Â  Got what he deserved says me.,95
Everybody knows Buzz and Woody went to the moon in that space rocket driven by a horse...,0
dont mess with buzz!,0
Hahaha great great great. I love it.,0
"If the gov concocted a conspiracy, what was the rationale behind Apollo 13? Wouldn't all the missions have been successful?
Hell, we'll make a pit stop at Mars.",6
all the astronauts suffered bone loss from the zero gee's - buzz could have broken every bone in his hand and still laid out the fucker,0
"You talk shit and call people a coward, you better be prepared to get punched in the mouth. Fact of life that the fat dude didn't seem to realize...",3
Good for Buzz.,0
street justice. got what he deserved. The beauty of being someone like Buzz Aldrin is how many people did he motivate and inspire to doÂ dream and doÂ something with their lives? We don't need anymore of these dough boys just trying to make a name for themselves off of the names of others who have achieved.,0
"That asshole got what he deserved. Actually he deserved a couple more shots to the dome, but unlike that piece of shit Buzz has class. Buzz is the definition of a hero.",0
"God bless Aldrin, wish he had had a combination left in him , a sweet left hook following the crisp right cross dropping the piece of shit would have been too sweet.",0
"In Canada we can these types of people bags of milk People think they can just harass and antagonize others  with no repercussions. Good for Buzz, way to fuck up that dumb ass bag of milk.",1
The guy is a fucking taxi driver.,0
Salute that man! Shoot fucko in the knees!,0
Beautiful!  Too bad there's no video of him afterwards crying at Dunkin Donuts stuffing his fat face with jelly donuts,0
The moon landings were obviously faked.,0
"""Soft serve ice cream eatin' Fag"" ..... fucking legendary insult!",0
What's better than a video about some obnoxious pos getting punched by Buzz Aldrin? A video about some obnoxious pos getting punched by Buzz Aldrin and narrated by Bill Burr. That's what.,0
Much respect to Buzz. This clip had a happy ending :-),0
one punch  artist :),0
Allenpalin Did you ever think that the reason Aldrin punched the guy was because he didn't like hearing the truth?  Calling the guy names because he called him out over false claims.Show me your proof that he landed if you're so positive he did! Amazing it was never done again after all the advancements in technology yet nada!!,0
Whoever believes that buzz or anybody else walked on the moon with that shitty video thats been shown to the world must be crazy! Don't you people ever question why it hasn't been done again with all the advancements in technology?  !!!,0
They should line up all the flat earthers an let buzz aldrin punch them in the face one by one,0
"I've heard about this but never thought it ever happened. Well, I can only say..Buzz Aldrin threw a cracking punch! Would have loved to see him follow up with a left then a kick to the head. Although I know he wouldn't, too much of a gentleman. Best thing I've seen all day! Good on Buzz!",0
hahahaahha Punching a Fatty in the Face...,0
"""your a coward and a liar and a THOOF"" so satisfying... that dudes whole word just shattered around him as Buzz landed that  hook...",0
"This is typical for A--holes with cameras...  I was hoping he would have killed him...  It would teach his mother to have another a--hole like him...   Good job, Buzz.....",0
Buzz is a bad ass. Check out the Ali G interviewing him.,0
"Wish I had been there. Would have loved to beat hell out of the chicken-shit calling him a liar. Wasn't there anyone else around to pound on the guy? You could have at least hit him with your camera and knocked out a few teeth.
Where was this at? Somebody needs to find that lard-ass, rip off his head and shit down his throat.",0
"""All quarter-pounder w/ cheese though,""
10/10 I am stealing this",0
"Conspiracy theorists are fucking losers, but the good thing is that they're really only fucking up their own miserable lives while being a minor pain in the ass of a few others. Fuckin idiots.",0
"In his 80's and still a hero.   This is the definition of hero, ""Don't take shit from anyone"".",0
"Why don't anyone put a man on the moon now? Its been like 40 years or so. I guess technology in the 60/70's were much more advance than it is now ;) If it smells like bullshit, it is probably bullshit.",0
Why's Burr hating so much?,0
Good he put that fat slob in his place. Who wears a blazer with jeans and sneakers ? Fucking big goof WHACK !!!!!!,0
"With all technology, there are postitives and negatives. The internet has given us much, but it's also given us conspiracy theorist nutbag shitlords. Why not focus on Guantanamo bay and the other real issues that the government tries to hide? Because you're the pussies and cowards.",0
I hope that guy who hounded him wakes up to himself and reassess some life choices and tries to become a better man,0
"Him and the other lying old cunts should have taken a lie detector ,  thered be 300 reasons why they cant, oo no I cant Im old and on stroke medication otherwise I would",0
"He aint no war hero , hes a lying old cunt , deserves to be put under the hammer you fuckin idiots.",0
"lmfao good job, Buzz. Also, good shot for a guy of his age! Dude had it coming...",0
good video,0
"Hell, yeah.",0
"I LOVE YOU, BUZZ ALDRIN!!!  8^D  8^D  8^D",0
"""Bang Zoom ...You're Going to the Moon!""(ralph:honeymooners)",0
"old people can hit you one time as hard as they could when they were young, one good one.",0
"Go up to Audie Murphy and challenge him (granted, he is dead.). Tell John McCain he's a loser! (well, some asshole did that.) Call Buzz Aldrin a liar to his face, what do you expect?",0
he wasn't even hitting with full force. that was just a love tap,0
Bill I heard about your long balls.  You are not alone.  Red pubes and long balls.  Lifetime curse on poor Nia.,0
how'd do we really even know the moont is real?,2
"Buzz Aldrin, an American fucking hero. They don't make them like they used to.",0
"Fuck that fat cunt,I would love to have been there.",0
what conspiracy theories does bill believe in?,0
Bill Burr rules so does Buzz......,0
"Never mess with an air force pilot called ""Buzz."" Especially if you're an ice cream eating tub.",0
"i don't understand how a pitbull can go into pitbull mode. isn't a pitbull always in pitbull mode, seein' as it's a pitbull.",0
"The moon is 238,900 miles from earth; not 237,000.  I don't know who's more retarded: Kubrick fanboys or moon landing truthers.",0
"""Room 237"" is fucking awesome BTW.  Go watch it.",0
Bart Sibrel is a stupid cunt.,0
"You say who does it hurt if the never went, are you fkn serious lol are you that small minded? NASA ARE LYING ABOUT THE UNIVERSE!!!!!! E V E R Y T H I N G!!!!! do you compute??? everything you know about the universe is a lie ...all but 1% ...99%BULLS H I T!!!!! lol the CIA agent told me that!!!!!! and you would of heard if you were listening ffs! this world is finished you are part of the deception agenda with videos like this",0
F'n awesome Buzz!Buzz should ofÂ punched that tub a shit againÂ . You Rock Buzz!,0
ATTTTA BOY BUZZZ !!!Â  Right Hooked that fucker !!,0
way to go Buzz,0
Yo Allen Palin! I love ur videos. Will you put my comment in one of your intros?...please..,0
Four minutes and twenty seconds.  The perfect video length.,14
Add Rogans ooooooohhhh,0
"""swear on the Bible"". Why are the nutty conspiracy theorists always religious? You'd think, being ""skeptics"" and all...",44
"I don't know if he believes himself or just trying to be funny, but the jig is up, we all been lied to about everything and we waking up.",0
"The moon landing looked like crap, all of it did, look at this video filmed in 1947 and try toÂ tell me this is fake.https://www.youtube.com/watch?v=pukbzCC3cfQThere is something wrongÂ behind the moon landing and why not go there again, lets put a telescope or space station on the moon,Â if so easy back then.",0
"we did not go to the moon, but that punch was amazing, hhahahaa ""your liar and and thieff hughhhhuh""",0
"The qweef deserved to be punched just for wearing those jeans with white sneakers. Did his mom dress him before he left the house. ""Mom, I'm gonna go get some footage for my YouTube channel...ok honey, be home early, I made your favorite, meatloaf and mashed pertaters"". What a dbag",0
LOL_ I love it- wish Buzz had of kept going and kicked the little whiny bitches ass.,0
"Let me guess, Michael Moore Light is now going around saying that punch didn't land.",38
"look at the boom mic guy,hes just letting ol Buzz nail nerd boy.funny shit",3
Typical Donald Tramp supporter. Way to go Buzz. 86 and punch like a real man.,0
If they didn't went to the moon where did that big fucking rocket go?!,0
Good on ya Buzz. I hate cunts like that pussy he decked.,0
Doesnt matter if he landed or not. Show some fuckin' respect for your elders.,24
I like how discount Michael Moore is talking shit to a fuckin astronaut.,0
the funny thing is that there has always been the irrevocable truth of us going to the moon in that we set up reflectors.,0
"you had me at""punch a fatty in the face""!",0
"Yeah, Billy broke this one down well. A guy from that generation, you, little fat man do not get into his face shouting insults, he completely got what was coming to him.",0
hahahahaha go buzz punch that fatty,0
right in his cocksucker,0
please don't recommend these losers on my feed... worthless ain't with a s@#$  pile... fake accent.. jil,0
STOP REPEATING THE CLIPS YOU FUCKING PIECE OF SHIT NIGGER FAGGOT,0
"I eat ice cream ... you don't know either of them, busy body... jil",0
"I eat ice cream ... you don't know either of them, busy body... jil",0
"That guy was a Michael Moore wannabe' but got buzzed with right hook instead. That meathead did a little moonwalk when he got lit, too.",2
"First of all, thank you Allen for making these videos, Bill would approve.. I'm sure, big fan of his.  Second, Bill wtf?? You were on the opposite side of the debate on Rogan's podcast???",0
Poetic buzz-tice.,0
"Does't believe man has the technology to land on the moon, yet thinks that swearing on a book and lying will send you to a mythical eternal burning hell.",1
why dontcha thwear on tha bible that ya walked on tha moon,0
I like how the girl holding himback walks away when he calls him a liar and a coward like o shit here we go lol that guy was asking for it.,59
fucking national hero,0
"Buzz did way more than just land on the moon. He developed a lot of the eva techniques used to this day and worked on the development of orbital rendezvous, one of the toughest problems nasa had to solve before going to the moon. He risked his life in combat and in space flight for his country. It would be so great to take that icecream eating sack of shit up to the moon, show him Buzz' footprints beside the descent stage of the LEM and the American flag on the Sea of Tranquility, then leave him there.",37
Soft serve ice cream eating fag!Â  Lol that was gold.,2
"Easiest way to debunk moon conspiracy theorists...

""So... you're saying that the United States faked the moon landing because it was the cold war and we couldn't stand being outdone by the Russians, right? You do realise that less than a decade earlier, the Solviet Union put the first man into space, beating the USA, right... and that would have been much easier to fake. Also, a few years before that, The Solviet Union put the first satellite into orbit, beating the USA... So... what this means is that the USA was getting their asses kicked in the space race ALREADY. If there was a time to fake a satellite... or a person into space... or hell... even a moon landing, a decade before would have been the time to do it!""",1
You go Dr Aldrin! You're an Engineering icon!,0
"""..and Buzz fucking right hook to this guys fat fucking, triple cheeseburger eating face,..."" -- LOL!",5
"Well hes e thief living like a ""war hero""... Actually bill is only defenig this ol dude cause he believes his lies",2
"Funny Thing is of all the Apollo Astronauts to mess with, the one who has the reputation as a tough guy and a Brawler.Â  Yes Buzz is a coward, flew F86s in Korean war and strapped into a rocket filled with liquid Oxygen and Hydrogen, basically a Bomb. flew into space multiples times and walked on the moon. Attention conspiracy guys, you think if we didn't land on the moon the Russians wouldn't have been all over this.",0
The loser-fuck deserved every fuckin' bit of it and more. He should've been dragged into the nearest alley and beaten senseless.,0
That was a fucking great punch.,0
"Bill makes a good point. Kubricks an amazing film maker, but I don't think he's ""fool the KGB at the height of their power"" good",0
"it's interesting to me that he wouldn't swear on the bible...I mean, ya, tubby's being a cunt, but Buzz...just take 10 seconds to swear on the bible...even if you're lying, it would probably shut a lot of these people up...then again maybe it wouldn't...haha...entertaining as all hell, that's for sure
I don't know a single 80 year old that's that much of a badass!",0
"bill, put it this way. the Russians DID figure out that we lied about the moon. they weren't able to go there themselves because they could not figure out how to protect against the radiation belts. these belts need 4 foot thick LEAD walls for the astronauts to partially survive inside. even with the lead walls they STILL jwould have cellular damage.  and what did america send the astronauts up with??? a silly ship made of space blankets???",0
"even when they didn'T landed on the moon...how can you call a man who entered a rocket with a billion gallons of fucking flammable stuff to get out of the atmosphere a coward? dumb and a idiot maybe, but not a coward :D",0
Pow! Right in the kissa.,0
"""swear on the bible!"" lololol",0
Buzz don't  fuck around. My dude!,0
It would be more effort to stage the moon landing then cover it up for 50 years than just going to the fucking moon. Conspiracy theory a-holes are the worst.,0
"what a hero buzz is the man, that other git use to talking shit and geting away with it.",0
Gave him the ol' right there Fred!,2
"""Soft serve ice cream eating fag"" LOL",2
Buzz gave 'em the ol' right there Fred!,0
"Ok I'm confused - Bill is now a Moon Hoax dude, so this must be an old podcast.",0
"Buzz had every right to punch that fucking insect in the face. But , to tell the truth, what bothers and angers me even more than the fat conspiracy cunt is the stupid woman who is constantly pulling on Buzz's sleeve. I hope every time a stupid bitch takes it upon herself to grab on to a man's arm, right when she know he might need his arm free to fight, that the man abandons the fight, turns on her and beats the living shit out of her with closed fists. What is it with these stupid cunts and their need to exert power over men by hindering their movement at the worst possible times ?",0
Buzz certainty live like a baws,2
"Buzz could jump through whatever hoops this guy comes up with.  Swear on the Bible, take me to the moon and show me your footprints.  Dude isn't going to listen.",0
I love these videos. The editing just accentuates Bill's words making me laughing so hard! Oh and the comment section is always a gold mine.,0
Well done Buzz,0
Buzz is my hero!!!,0
Old school justice. Buzz ain't no coward.,0
This is how I want to watch every YouTube video,0
"and you could tell Buzz was stepping in to give him some more, too. Go Buzz. One of the coolest humans ever. Doctorate from MIT, shot down two MiGs in Korea, test pilot, walked on the moon.",0
"That's Buzz Fucking Aldrin! Whether we're talking Jimmy Lovell or some rooskie cosmonaut, those mutherfuckers that ventured beyond the stratosphere back when the best computers were little better than a basic calculator, they're all serious bad-asses and deserve some equally serious respect.",0
nice touch with the room 237 clips.,0
damn buzz yous a gangsta,0
That soft serve ice cream eating fag should feel lucky that he was laid out by an American hero,0
Fuck Buzz he's a fraud and should be in jail.,2
"Personally, Although I've seen and heard most of the evidence of the moon landing(s) hoax,Â  and I believe in a 911 alternate version of the official story,Â  specifically that it was an inside job, I don't believe in the moon hoax conspircacy.Â Â  I saw this video a few years ago, and give Buzz a big thumbs up for giving this ignorant fuck what he deserves.Â  I don't think there is a court in the United States that could watch this and convict him, and if they did, it surely wouldn't be justice served.",0
I didn't think a man in his 80s could punch a guy like that. Props to Buzz,0
That was a clean as punch.. you can tell Buzz done that before,0
"I love how the woman walks away mid-punch, right on the word ""coward"", like she's thinking ""oh shit here we go"". She doesn't even wait for it she just knows it's coming after he said coward 3:05",0
The only thing more awesome than Buzz punching him out is Bill Burr's commentary,0
They should have new law:  If a guy walks on the moon he gets to shoot one asshole no questions asked.  Call it the Buzzkill law.,235
heres a landing on your moon shaped face!! MERICA!,0
That was a right cross not a right hook.,0
Buzz rules  pay him his toy story royalties or this is what you get hollywood.,0
The dumbest I have ever heard Bill Burr.,2
"... and a liar, and a thiEFFFFFF",0
Buzz put some serious Fred to the head on that fat dude,0
"buzz handles it like a boss..

the girl knows buzz will beat his ass so she tries to move buzz away from the cock head..
she isn't trying to protect buzz from the guy.. she is trying to protect the guy from buzz.

1:43 he tells the cameramen to stop recording..

1:50  he does the 360 spin to get the girl out of harms way. 

3:05 the girl just walks away.. she knows there is no stopping buzz now..",0
"The KGB couldn't figure it out? Haha. As if the ownership classes of all these ""separate"" countries are NOT the same interlocking families. Banks and corporations have no national loyalties. Even if they were not all in cahoots together, the Soviet Union uses the same media lies and manipulation to control their people too, so it would be completely against their interests to expose another country faking stuff. Their citizens might catch on that they are doing it also. I hate that ""debunking"" point.",0
Do the doomsday preppers one,0
"The fucking asshole sounds like a real life version of Zach Galifianakis's effeminate character.

He deserved more than he got.

Buzz is a real life hero. 

The other guy's a silly little twat.",2
That right hook about knocked him out of his 'Nurse Reeboks',0
"Great daughter! She does her best to keep Buzz from whooping dude's ass, but she finally knows he crossed the wrong line and walks away right before Buzz throws a nice right hook to fat fucks face.",0
"Allen you been putting in work. I don't like you, but your videos are dope.",17
"everyone who sees this tub of shit should punch him again, just cause he's a tub of shit, Buzz is the man.",0
"Bill burr needs to shoutout your channel on his podcast. I just found your channel and I'm pissed I hadn't found it sooner, great work.",0
I like how you used an actual unexplained moon photo around 1:00 Good stuff as always btw,0
this is definitely my new favourite YouTube channel. please don't stop making these,1
"Buzz is an extreme badass.  Shot down MiGs in the Korean War, gets his Ph.D from MIT, and his dissertation is what they basically used for the Apollo mission.",0
