commentText,likes
"they siphoned billions of dollars away from the public that could have been spent on a lot more urgent needs billy boy, i'm glad buzz ""buzzed"" him , Â the guy was a cunt !",0
Wow you even added Jay Weidner's take on Stanley Kubrick's The Shining movie faked moon landing clues.  Fuckin perfect.,0
I've had enough of your disingenuous assertions.,1
Buzz got fed up.,0
Buzz Aldrin is a World hero. If you are slandering him in these comments you should be ashamed of yourself. When the human race expands out into the stars it will be on men like Buzz Aldrin's shoulders!,0
"nice one, buzz",0
go BUZZ!!!,0
Leave me alone!  will Ten bucks cover it?  lol,0
"i dont like buzz, i dont like the fat guy, and i dont believe we landed on the moon. But damnit i love bill burr :P",0
I don't understand how you can be this smart and this ignorant at the same time but somehow Bill pulls it off...,0
I wish I could have ONLY one Hour with this Asshole Sibrel!,0
Yup those Freemasons can hit hard when you call out their BS! ;),0
"Houston, the Eagle has landed...a right hook",0
So remember to eat your oats children. You may not be able to go to the moon like Buzz ... but you'll still be strong enough to punch an arsehole's lights out when you're in your 80s!,0
when you realize the video time is 420blazeit,0
Fat fucking triple cheesburger eatin face lol!,0
"Nicely put, Bill. ""The KGB couldn't figure out if Americans didn't go to the moon but this tub of shit apparently did.""",0
"Answer to your question at 0:50.  You'll notice that at the height of the Vietnam war, during the presidency of Tricky Dick Nixon, is when all the moon landing missions occurred.  Whenever there was really bad news coming in from Vietnam Tricky Dick sent 3 more astronauts to the moon to distract the American tax payers and keep them patriotic while 300+ young American soldiers were coming home in body bags every week.  Who did it hurt?  Wake up after 48 years, you fucking nimrod.",0
Holy shit just shut the fuck up and show us the video,0
"I am anti-violence, but this is one of my favorite punches of all time.",0
"not only for being a hero but for punching a fatty in the face. oh man! that was good, I lost it.",0
A man that punches like that in his 80s is not one to fuck with. Lmao learned a lesson real quick.,0
would not put his hand on the Bible ... i don't know,0
"Buzz is a hero great video this made me subscribe to your channel, thumbs way up",0
Buzz should have knocked his ass out!!!,0
buzz actually lifted fat fag a little with that right,0
"ðŸ‘¨ðŸ¼â€ðŸš€That fuck'n American HeroðŸ‡ºðŸ‡¸.....he should've landed his foot right on his balls....than said ""That's one small step for man, one giant leap for mankind"" ðŸŒš than kick him right in the teeth.....ðŸ‘´ðŸ¼like a boss...than walk ðŸš¶ðŸ»across the street....into the lobby up the stairs on stage with a half chubðŸ’ªðŸ¼ ...say most awesomeness speech ever in American historyðŸ—£ðŸ‡ºðŸ‡¸....awhile single tooth still stuck on bottom of his shoe....than you hear whispered in the wind ðŸŒ¬""I'm mother fuck'n.... Buzz Aldrin ....Bitch...& don't you forget it"" ðŸ–•ðŸ»",1
He had me dead at: Last guy picked in gym class hahahaha,0
Aldrin hits him a good one. Watch the guys head jerk back.,0
"My friend you are the definition of apathy. You don't care that you are lied to. Its about the fact that NASA lies about everything they do.

https://www.youtube.com/watch?v=pEE7OPKLhaM",0
Nice punch... better than anything Mayweather or Connor for that matter... has ever done in their illustrious career.,0
Why should buzz have to put up with that? Good for him!,0
420,0
He may not have landed on the moon but his right hand sure as hell landed on that chin.,0
"lol, one right hook for mankind! Still laughing",0
youre a coward and a liar and a HHMPPGH,0
Buzz Aldring is a GOD!!,0
he would have dropped me... you pussy.,0
excellent synopsis of of aldrins encounter with a major douche,0
He was better in Toy story,1
why would Buzz Aldrin punch the guy? Because this guy was saying the truth!!!!!!,1
USE MY SONG AUGURY IN YOUR INTRO,0
The two things Bill hates most on this world womans and fat peoples,0
"Well done, Sir Buzz Aldrin!",1
Haha love your commentary the guy sooo deserved it tho,0
what's a bouse? How is this like one?,0
Buzz should have just sworn on the Bible.. that's all it took.... lol,0
Get'm Buzz!! That fat dumb ass deserved it!!,0
"OO WEE LOOK AT ME, I FAILED SCHOOL AND MY LIFE IS A COMPLETE JOKE. 
BUT IT'S OKAY, BCUZ IM ENLIGHTENED AND SHIEET. 
I'M SPECIAL!!!! 
I'M NOT A SHEEPLE LIKE YOU! 
I SAY THE MOON LANDING AND SCIENCE IS A LIE! 
THE FACT THAT A LOWLIFE PATHETIC MORON LIKE ME SAID THAT COMPLETELY DISCREDITS EVERY SINGLE SCIENTIST AND SCIENCE DISCOVERY THERE IS! 
NO! I DIDN'T FAIL SCHOOL BECAUSE I'M RETARDED, I QUIT SCHOOL CAUSE I'M SPECIAL AND SHIEEEEET. YOU ARE ALL BELOW ME!!!!!!",0
"That's what I call ""The right stuff"", although others might call it ""The right cross"". Either way, I likes it.",0
https://youtu.be/b2yq0jfmcvMÂ  mason lands on fake moon,0
"""You're a coward, and a liar, and a THWOOEEF""",1
That was a rude way of dealing with the issue but he's probably right. Those guys never went to the moon.,0
"I love how the lady finally just walks away like ya know what fuk it , hit him.",0
Wow!  Ole Buzz tried to send that guy to the moon...but he was to fat...but he SURE did make him see the stars!   Lol.,0
"Buzz never punched this idiot because he denied the moon landing, he smacked him for harrassing him and his family, and for calling him a liar and a coward in public. Buzz should have kicked the living shit out of him.",1
FAT,0
Should have beaten that disrespectful cunt unconscious.,0
I love it! A man with balls that's not afraid to stand up to a asshole! I wish he really beat the shit out of him!!!,0
van allen radiaiton belts...lost telemetry data....moon landing seems like a hoax. burr sounds like a dope here.,0
put that buzz bastard in jail---like he landed on the moon lmao,0
taking a punch for the truth,0
hang that buzz liar,0
sue that liar son of a bitch,0
I feel like that is legally harassment and if not it should be.,0
"I can't take credit for thinking of this comment. Saw it on a different Buzz punch video and it's total gold:

2nd best landing by Buzz.",0
That was the greatest thing I've seen in a LONG time!! Ex boxer here...Great punch!!,0
I come to this video once and a while just to hear bill call this guy a soft serve ice creme eating fag. Fuckin gold.,0
His name is Bart Sibrel !,0
"that guy is a flat earth theorist, he goes around finding astronauts and making them swear on the bible",0
only retard Americans still believe they landed on the moon,0
""" You're a coward, and a liar, and a... FEETH! """,0
anyone notice anything funny here? 3:03,0
"Classic, hahaha",0
"yeah- it was a FAKED MORON LANDING! gawd it would be so much fun loop replaying that punch in time to ""another one bites the dust"".
wish to fuck this would also happen to all the 9/11 truthers out there, fucking losers all.",0
I don't care about the moon. He's a hero for punching a fatty  in the face. Rock on Buzz Aldrin.,0
Is this guy where Buzz lightyear got his name from?,0
Fuck moon landing deniers,0
we have never landed on the moon or been out of the earth atmosphere.. He is right. They are all freemasons,0
Awesome!,0
"Didn't hit him enough.  Of course, that chubby fuck either sued him or is in the process of doing so.  A lot of guys would have disemboweled him.",0
"I agree with Bill Burr in this video, but why call this guy a fag? Is he referring to that homosexuality is a bad thing?",0
I'll that was a haymaking of a bunch... ðŸ˜• ðŸ’¥,0
This video was staged.  Buzz Aldrin never punched this guy.,0
"Buzz, hats off to you for that! He should've been wearing a ring that had ""Eagle 1"" on it backwards, to let that fool know it landed...",0
Happy Birthday Our Hero Buzz thanks for Dance at20th fox 70's Edy Williams hope Cross path again Sorry for that lunatic stalker!,0
"Damn, you can see that loser's skull move before his face.",0
maybe they faked it ...who cares!!  But the balls it takes to sit at the top of that Saturn V...full of fuel !!!,0
none of them would swear on the bible and say they landed on the moon.,0
"""Soft serve ice cream eatin fag""...",0
"Good for him, I'd have done the same thing",0
"This is a VERY distressing video to watch.  And the most distressing part is, Buzz didn't put this stupid son of a bitch in the hospital for a couple of months.",0
"Agree with everything Bill says, except that ""it"" (fake or not) did ""hurt"" a lot of people, because ""it"" was paid with extorted tax money.",0
"Tips on how to punch like Buzz Aldrin:




- Don't blow it
- Keep it simple
- Count your money",0
"Fuck that fat coward piece of shit. Glad Buzz buzzed his ass. Calling that old man a coward, when he himself is a coward for trying to provoke an old ass man!",0
"ya mess with the bull ya get the horns  , awesome  , Buzz is a true hero !",0
Mean straight right,0
are u related to Sarah Palin?,0
"Buzz and fellow Astronauts have more guts than any of these harassing assholes who probably don't know their ass from their elbows anyway! We're proud of Buzz and all the brave men and women that have the guts to go into space! Buzz, take it easy, you deserve it.",0
lol fat chesse burgar face good punch,0
"RIP Buzz, you were the man",0
Buzz needed to put his body more into that punch.,0
">somehow manages to pass through the van allen radiation belt and survive through freezing temperatures in the lunar space craft without having on-board batteries to support such power expenditures to enable a heating and protective device.
>gets defended by government welfare sell-sword queen with a jewtube account whose best argument is calling the opposition a fatty.",0
I like how u put that shinning conspiracy bit,0
"No judge or jury would ever convict him for slugging this guy. No prosecutor would ever even bring any charges. Even if the guy sued he would never win because Buzz is a national hero and this guy is a idiot who got what he deserved. What I do find disappointing is that someone else there did not get in this guy's face and back him down, or lay him out if necessary,  before it ever got this far.",0
lmao true American hero,0
My favourite punch ever!,0
"The dude was acting like a woman, insulting somebody and not thinking about the physical ramifications that could happen (ass kicking). Don't know why I went all lawyer on ya but eh.",0
"love our channel man,  keep it up :)",0
Usa had every reason to fake a moon landing. Most important was to bankrupt the soviets into space. Im not saying it did happen but its dum to say they had no reason to fake it.,0
"Buzz, you are an American hero! salute for Rockin that pussy.",0
Nice one buzz that Bible bashing inbreeding pice of uninformed dumdass monkey crap got what he deserved if nobody landed on the moon both the Russian and Chinese space agency's would have posted any information regarding a lie to world that the Americans lied in getting to the moon but as they have not means the Americans got there.,0
"I think its pretty sad that some people have such sad pathetic lives that they come up with these conspiracies.
I mean, sure, there are lots of things that hve unanswered questions, but fuck me the moon... Have some people got no shame?
If you get a really really good telescope, especially a digital one that you can control with your PC, you can enter in all kinds of locations and you can see in many cases, some of the crap we have left up there, such as moon buggies and so on.
I have seen these for myself with my fathers own telescope.

Its the same with the ISS.... Anyone with a pair of even good binoculars can see it for fucks sake, and yet there are some stupiud morons who say it doesnt exist! - what sort of stupidity must someone have to be that dumb?",0
"Do you love the way the guy's voice wanes when he says ""thief"", as Buzz's fist crams some justice down his throat?",0
To the Moon Alice,0
that Dick head ate one big knuckle sandwich,0
notice how buzz's daughter spends the video stopping him from decking that bloke but as soon as he is called a coward she turned and walked away and just let him unload. she knew she wasn't stopping shit after that comment.,0
You don't get it?  Use your fucking brain.,0
Moonfist,0
He didn't punch him hard enough in the face. It didn't satisfy me.,0
"Buzz landed that punch...no conspiracy there. Lucky for the guy I wasnt the doorman, i would have
broke up the fight by stepping on the guys face....they had to be separated right?",0
"Imagine the onions on this guy!   To get on to a rocket, with a very good chance of exploding, to go into a hostile enviroment with even a GREATer chance a deadly failure.   Too bad he only popped this pudgy fuck, once!",0
Wish there were a couple more good ole boys there to lobotomize this disrespectful anti American sack of vomit.,0
Buzz Aldrin and his colleagues lost a lot of close friends to accidents in the space program.  I'd imagine that would fuel a lot of rage when asshats rant in his face like this situation.,0
As tweetie bird said...Right on the kisser!,0
"Fuck that pasty pile. People like this piss me off because they always have a better job than me. Like, this freak? Really? Wtvr",0
"The asshole is Bart Sibrel, who ironically has a very good documentary called 'A funny thing happened on the way to the moon' (availble on youtube) which is actually worth watching. Then he did another where he doorstops all the astronauts that went to the moon and does the same thing. He gains access to their homes unfortunately and some it is quite upsetting.",0
"Joe Rogan is another hoax-believer. NASA's 10,000 employees all lied for 50 years? The Soviets kept Shtum all this time? Cmdr. Aldrin was one of the bravest men in history. Travelling for three days to the moon and hoping you get back safely? He probably punched him out in memory of Chaffee, Grissom and White.",0
Great punch,0
How many times can I jerk off to this?!?!?!,0
'soft-serve eating fag',0
what happened to the good ol days where conspiracy theorists stayed at home typin their theories out on the net with their fuckin tin foil hats?,0
That punch was OLD SCHOOL!,0
"this "" soft served ice cream eating fag ""  hahaha brilliant",0
"hell yeah buzz, that guy was a fucking moron...",0
soft-serve ice cream-eatin' fag,0
hahhahaha buzz,0
"you're a liar, a coward, and a thiEEEf",1
"seantendo001, so you don't have any good documentary evidence of a faked moon landing and you are full of shit. Imagine my shock!",0
Nice punch but if you slow it down lol............,0
"It's not good to lie. Buzz didn't have a reason to punch him. Also, a tell-tell sign that he's lying is he refused to put his hand on the Bible.",0
It is unbelievable that there are people out there who think that there is a massive conspiracy to fake the moon landings. They are like flat earthers. Way too much time on their hands.,0
You don't mess with irl buzz lightyear you pussy conspiranoid!,0
Triple-cheeseburger-eaten face was punched...I laughing so hard,0
"like you said Bill even if the moon landing was faked what kind of douche accosts an 80 year old man? One that gets creamed by a real ass man, our gramps once was mugged by some young punk and put the little pussy in the hospital he too asked to be left alone. I loved that old man . Boxed his way through the depression..,,,Boxed his way through the Safeway parking lot at 85!! Thanks Billyboy!!!",0
look at what buzz did when he knew he was gonna hit dude. he reached into his pocket for a fist pack hahaha. that old fucker is hardcore,0
"""for punchin a fatty in the face""",0
"Bart Sibrel, and anyone who does not believe the moon landing happened, are dumb phucks. If your dumb ass was taking to the moon and shown evidence, you'd still come up with how Buzz Aldrin was not on the moon. He should have beat you to a pulp. IDIOT",0
"I  (generally) try not to call names because you can't change someone's mind when you go hard on offense, but this whole thing was worded perfectly. The little d-bag wasn't going to listen to fact, he wanted to be a jerk. I just wish Buzz had gotten a few more licks in. The man is a hero and seeing him punch that loser makes me love him more.",0
"Hey chuckles... I know you are new this stuff... but before this shit bomb called the internet hit where all you noobs twist stories, the true conspiracy theorists from the 90s and earlier made it really CLEAR: The ""fake moon landing"" is NOT about we didn't make it to the moon, it IS about what was televised was not the real moon landing. So... to finalize for you... the conspiracy is NOT about that we never made it to the moon, but that the moon landing that was televised was not the real moon landing. Perpetuating the LIE that this conspiracy is about we never actually made to the moon is a red herring and belittles us true researchers.   Please put in for a course correction, and conduct yourself according from now on.",0
He punched him hard! Well done hehe,0
props buzz indeed.,0
what about the billions they charged tax payers?,0
I want to find the guy and punch him too....  And then tune on him a while with a baseball bat...,0
Why would he punch him?  I thought words would never hurt? Don't adults grow up? If he can go to the moon he can go fuck his wife instead of listening to ice cream eating fatass? right Bill? come oooon lol,0
Buzz is such a badass.  He rules.,0
"...And like that, with the force of a shuttle descent, he brought that man with his pie-in-the-sky notions back down to Earth.",0
I think he knockedÂ the quarter pounder out of him.,0
"Great stuff dude, all your vids are great!",0
Who's that milf standing next to him? I'd love to fuck her brains out.,1
"If they didn't land on the moon, it hurts the tax payers. Billions of dollars pocketed.",0
Damn. Buzz still has the right stuff.,1
"well, he bang zoomed that guy straight to the moon. amirite? faggots?",1
"How dare this guy bother and insult one of America's bravest men, a pioneer in space exploration, who accomplished more in his life than this guy or, really, most of us ever will, not to mention disrespecting and harassing an 80 year old man! Shame! He got less than he deserved.",0
A really good movie about faking the moon landing: Operation Avalanche.  https://www.youtube.com/watch?v=BJ6IPQ2lTeQ,0
love it. all proper love to buzz,0
"""swear on the bible . . . ""  i'll swear on the bible that i think the god of the bible is a myth, LOL
it is amazing to me how many people believe the bible is true, when they haven't even bothered to read the bible.
between wizards casting spells, unicorns, a world wide flood, and a flat earth, i couldn't believe the fairy tales in the bible.",0
"""Punchin a fatty in the face"". Hahahaha",0
+joebullis1.....and YOU go back under the rock you obviously slithered from,0
"profanity and name calling ALWAYS proves that your point is more valid than another's...doesnt it!?
 lmao every single point you make is retarded...""dont ask an old man to tell the truth or to swear on the bible?"". You're absolutely biased towards Buzz, but ONLY because you believe Bart not to be credible..yes?...but what of the NASA footage of faking shots of the Earth (half way to the moon. in Barts Documentary ""A funny thing happened on the way to the moon) on the Apollo mission? You clearly see what they're doing....but that doesnt fit your ""mocking"" agenda....does it!? Who wants to see that when you can just watch Buzz punch a guy for asking him to....swear on the bible....Awwww!!! you cant ask Buzz to swear he DID go, thats just ignorant, lmao you'd make a good CNN reporter/Anchor...cos they're full of shit too.

Maybe show both sides of the arguement, before you lower yourself to nursery school levels of name calling....only retards will listen, but thats what you want isnt it? retards viewing equals money in your pocket... You dont care about the truth or you would have shown more than Buzz punching Bart!....btw the footage of the punch...IS BART'S OWN FOOTAGE.",1
"The thing about the moon landing conspiracy (which bill nails).. Is its not really a breach of liberty.. Like its kinda just one of those things where you know its a bad thing to do.. But not really.. And on the scale of which they actually did do it.. You gotta just be more impressed than mad.

JFK and 9/11 though.. I can get behind wanting to solve that",0
"Buzz punches so hard that fat tall men see moons flying around their head, he is a fucking true hero.",0
"if he went to the moon you would think he would of had the pleasure to stand and talk to the guy, but he was running away so there's a sign that he's lying",0
bill quit being so ignorant,0
"Anyone with half a brain knows that the USA made taped recordings on Earth to show the World because they wanted to hide what they seen and found on the Moon!,,You didn't give Info: to the Enemy back then!,, or even now!",0
"Buzz had good form on that punch, rolled the shoulder and everything. Shit, he was even punching up a foot and got good chin contact.",0
"hey morons, Burr included... we didn't land men on the moon. What's the first thing you'd do if you landed on the moon? point the fucking video camera back at EARTH and say ""hey there's EARTH, our home... HELLO EARTH"" etc. Search all known video footage of the Apollo missions and you'll notice that there isn't one fucking video depicting the Earth in the background with the Fakeonauts in the foreground, NONE. It's fake, we didn't land men on the moon. There's footage of them driving the lunar rover around cracking jokes, them golfing on the moon, playing hopscotch, singing karaoke etc... not one fucking video of the Earth over their shoulder as they scratched their balls on the moon.",0
Buzz Aldrin is an American hero,14
if I see bill  im going to slap his gay ass ....,0
Punch that fattie in the face!,0
Left him Buzzing!,0
that must be one of the most satisfying videos on the internet. complete justice porn.,2
"""The KGB couldn't figure out that we didn't land on the moon, but this tub of shit, who's yelling at this fucking war hero, he somehow figured it out.""  Haha!",44
Don't mess with any veteran sir.,0
Wow. Good for you Buzz. Not even sex feels as good as punching someone who deserves it in the face and catching that look they get when you do. That little nano glimmer before the fight or flight kicks in and they realize what just happened. Awesome. If I could put it in a bottle Id be rich...,1
"Rule#1) never call a guy, affectionately nicknamed ""Buzz"", a coward.",8
"wtf is wrong with soft serve? Also, I love the sound have fat fuck saying ""thief"" as he gets rocked",8
"one small smack back for buzz 
one giant heap of lard gets his teeth rattled
what a cunt",0
sweet,0
"Way to go, Buzz!  I hope that asshole never opens his big mouth again.",1
If you truly believe we never landed on the moon then your are the text book definition of a raging moron. That and these flat earth dumbasses with half a brain. My only suggestion to these idiots is stop reading all these wack job conspiracy theory books and quit getting all of your knowledge and information from stupid ass youtube videos. It'll do you wonders in life. I swear sometimes humanity can be so freakin stupid.,13
He practically punched that Mary to infinity and beyond.,0
"Fuck Yes!!! I love your narration...Fat, fucking tubby triple cheeseburger soft serve fag!!! Best Ever, I spent a decade doing atrocities for America, and you could totally hang with my crew with that kinda mouth!!!",0
Bil you're wrong !! Every American should be able to punch that satanic Buzz in his fucking face !!! Fuck NASA !! Fuck the government!! Fuck all satanist !! Then the rest of the world should be able to punch the motherfucker in the face too !!! And yes bill the Russians were in on it too !! Fucking Mason scum !!! All Masan scum should die too !!! Fuck your secret society !!,0
"We left a reflector thing that you can beamÂ a laser at certain spot on the moon, and it'll reflect back.Â  Anyone can do it with a strong enough laser.Â  They even did it on Mythbusters.Â  Not sure how people call the moon landing fake anymore.",3
sick punch for an old men :D,2
"What did the fingers on the hand of an astronaught say to the moron? 
SLAP!!!!!",1
The fatty should of bitch slapped the old cunt back and made sure he dropped the old fake cunt!!,0
That was a great punch. In his prime he would have took that guys head off.,9
"""You're a coward and a liar and a thi-hppfhh""",0
This is why Buzz Aldrin is an American hero. Will do the shit that needs to get done,6
And I like how the girl knew the precise moment it was time to go.,11
Such a satisfying vid to watch. Does anyone know the name of the conspiracy nut moron Buzz hits?,0
all quarter pounder with cheese though hahah,0
they stole 20 billion dollars from its own people,0
I love it when the Tin Foil Hates get snapped by an 86 year old. As you know they will never get any pussy without paying for it now or called one!,0
calling a man of that generation 'coward' is without doubt the worst  insult possible ...worse than any mf this or that...loser got whatfor...,2
"Imagine..becoming an astronaut is also a hell of a job..look it up..after that so is a mission to the moon..than landing and walking on the moon and doing the job.. when  back on earth
there comes..milkface
.saying you didn't ..and keep shouting to you
sure I would give kick him into deepspace...",0
